,symbol,name,description__profile,ceo__profile,industry__profile,price__profile,currency__profile,mktCap__profile,image__profile,volAvg__profile,pe__quote,change__quote,volume__quote,ebitda__income_statement,netIncome__income_statement,annual_earnings,quaterly_earnings,eps__income_statement,epsdiluted__income_statement,totalAssets__balance_sheet_statement,totalCurrentAssets__balance_sheet_statement,cashAndShortTermInvestments__balance_sheet_statement,totalLiabilities__balance_sheet_statement,netReceivables__balance_sheet_statement,longTermInvestments__balance_sheet_statement,totalCurrentLiabilities__balance_sheet_statement,cashAndCashEquivalents__balance_sheet_statement,freeCashFlow__cash_flow_statement,growthEBITDA__income_statement_growth,growthNetIncome__income_statement_growth,growthEPS__income_statement_growth,dividend__historical-price-full/stock_dividend,date__historical-price-full/stock_dividend,derived__netIncomeMargin,derived__debtRatio
88,ADUS,Addus HomeCare Corporation Common Stock,"Addus HomeCare Corporation, together with its subsidiaries, provides personal care services to elderly, chronically ill, disabled persons, and individuals who are at risk of hospitalization or institutionalization in the United States. It operates through three segments: Personal Care, Hospice, and Home Health. The Personal Care segment provides non-medical assistance with activities of daily living. This segment offers services that include assistance with bathing, grooming, oral care, feeding and dressing, medication reminders, meal planning and preparation, housekeeping, and transportation services. The Hospice segment provides palliative nursing care, social work, spiritual counseling, homemaker, and bereavement counseling services for people who are terminally ill, as well as related services for their families. The Home Health segment offers skilled nursing and physical, occupational, and speech therapy for the individuals who requires assistance during an illness or after hospitalization. The company's payor clients include federal, state, and local governmental agencies; managed care organizations; commercial insurers; and private individuals. As of December 31, 2021, the company served consumers through 206 offices located in 22 states. Addus HomeCare Corporation was founded in 1979 and is based in Frisco, Texas.",Mr. R. Dirk Allison CPA,Medical - Care Facilities,111.63,USD,2053891533,https://images.financialmodelingprep.com/symbol/ADUS.png,232975,25.26,1.73,154431,120615000,73598000,"[{'period': '2024', 'revenue': 1150.0, 'unit': 'M', 'net_profit': 73.6}, {'period': '2023', 'revenue': 1060.0, 'unit': 'M', 'net_profit': 62.52}, {'period': '2022', 'revenue': 951.12, 'unit': 'M', 'net_profit': 46.02}, {'period': '2021', 'revenue': 864.5, 'unit': 'M', 'net_profit': 45.13}]","[{'period': ""Q1 '25"", 'revenue': 337.71, 'unit': 'M', 'net_profit': 21.23}, {'period': ""Q4 '24"", 'revenue': 297.14, 'unit': 'M', 'net_profit': 19.53}, {'period': ""Q3 '24"", 'revenue': 289.79, 'unit': 'M', 'net_profit': 20.16}, {'period': ""Q2 '24"", 'revenue': 286.92, 'unit': 'M', 'net_profit': 18.08}, {'period': ""Q1 '24"", 'revenue': 280.75, 'unit': 'M', 'net_profit': 15.83}, {'period': ""Q4 '23"", 'revenue': 276.35, 'unit': 'M', 'net_profit': 19.58}]",4.33,4.23,1464422000,260382000,0,442142000,135258000,0,155871000,0,110384000,0.13191876724412996,0.1772666197453452,0.12467532467532466,__nan__,__nan__,__nan__,0.3019225332588557
89,ADV,Advantage Solutions Inc. Class A Common Stock,"Advantage Solutions Inc. provides outsourced solutions to consumer goods companies and retailers in North America and internationally. It operates in two segments, Sales and Marketing. The Sales segment offers brand-centric services, such as headquarter relationship management; analytics, insights, and intelligence; administration; and brand-centric merchandising services. This segment also provides retailer-centric services comprising retailer-centric merchandising, in-store media, and digital commerce. The Marketing segment offers brand-centric services, including shopper and consumer marketing, and brand experiential services; and retailer-centric services, such as retail experiential, private label, digital marketing, and digital media and advertising. The company was formerly known as Karman Holding Corp. and changed its name to Advantage Solutions Inc. in March 2016. Advantage Solutions Inc. was founded in 1987 and is headquartered in Irvine, California.",Mr. David A. Peacock,Advertising Agencies,1.26,USD,408633120,https://images.financialmodelingprep.com/symbol/ADV.png,605746,-1.06,0.17,1389321,-82755000,-326962000,"[{'period': '2024', 'revenue': 3570.0, 'unit': 'M', 'net_profit': -326.96}, {'period': '2023', 'revenue': 4220.0, 'unit': 'M', 'net_profit': -63.26}, {'period': '2022', 'revenue': 4.05, 'unit': 'B', 'net_profit': -1.38}, {'period': '2021', 'revenue': 3600.0, 'unit': 'M', 'net_profit': 54.49}]","[{'period': ""Q1 '25"", 'revenue': 821.79, 'unit': 'M', 'net_profit': -56.13}, {'period': ""Q4 '24"", 'revenue': 892.28, 'unit': 'M', 'net_profit': -177.88}, {'period': ""Q3 '24"", 'revenue': 939.27, 'unit': 'M', 'net_profit': -42.78}, {'period': ""Q2 '24"", 'revenue': 873.36, 'unit': 'M', 'net_profit': -114.01}, {'period': ""Q1 '24"", 'revenue': 879.0, 'unit': 'M', 'net_profit': -62.32}, {'period': ""Q4 '23"", 'revenue': 1080.0, 'unit': 'M', 'net_profit': 17.43}]",-1.02,-1.02,3106517000,910738000,205233000,2357782000,637225000,226510000,460062000,205233000,85257000,-1.2747756272972677,-4.168705934427266,-4.1,__nan__,__nan__,__nan__,0.758979268421837
90,ADVM,Adverum Biotechnologies Inc. Common Stock,"Adverum Biotechnologies, Inc., a clinical-stage gene therapy company, develops gene therapy product candidates to treat ocular and rare diseases. Its lead product candidate is ADVM-022, a single intravitreal injection gene therapy candidate used for the treatment of patients with chronic retinal, including wet age-related macular degeneration and diabetic macular edema. Adverum Biotechnologies, Inc. has license and collaboration agreements with University of California; Cornell University; GenSight; Lexeo; and Virovek. The company was formerly known as Avalanche Biotechnologies, Inc. and changed its name to Adverum Biotechnologies, Inc. in May 2016. Adverum Biotechnologies, Inc. was incorporated in 2006 and is headquartered in Redwood City, California.",Dr. Laurent  Fischer,Biotechnology,2.115,USD,44183831,https://images.financialmodelingprep.com/symbol/ADVM.png,331893,-0.32,0.065,391729,-127274000,-130927000,"[{'period': '2024', 'revenue': 1.0, 'unit': 'M', 'net_profit': -130.93}, {'period': '2023', 'revenue': 3.6, 'unit': 'M', 'net_profit': -117.17}, {'period': '2022', 'revenue': 0.0, 'unit': 'M', 'net_profit': -154.54}, {'period': '2021', 'revenue': 7.5, 'unit': 'M', 'net_profit': -145.54}]","[{'period': ""Q1 '25"", 'revenue': 0.0, 'unit': 'M', 'net_profit': -47.02}, {'period': ""Q4 '24"", 'revenue': -3.6, 'unit': 'M', 'net_profit': -32.88}, {'period': ""Q3 '24"", 'revenue': 1.0, 'unit': 'M', 'net_profit': -27.13}, {'period': ""Q2 '24"", 'revenue': 0.0, 'unit': 'M', 'net_profit': -18.48}, {'period': ""Q1 '24"", 'revenue': 0.0, 'unit': 'M', 'net_profit': -24.79}, {'period': ""Q4 '23"", 'revenue': -3.6, 'unit': 'M', 'net_profit': -23.71}]",-6.62,-6.62,179841000,131300000,125691000,109127000,0,0,22898000,60652000,-92850000,-0.0322470761893948,-0.11745828532411556,0.4533443435177539,__nan__,__nan__,__nan__,0.6067971152295639
91,ADVWW,Advantage Solutions Inc. Warrant,"Advantage Solutions Inc. provides business solutions to consumer goods manufacturers and retailers in North America and internationally. It operates in two segments, Sales and Marketing. The Sales segment offers brand-centric services, such as headquarter relationship management; analytics, insights, and intelligence; and brand-centric merchandising services. This segment also provides retailer-centric services comprising retailer-centric merchandising and in-store media services. The Marketing segment offers brand-centric services, including shopper and consumer marketing, and brand experiential services; retailer-centric services, such as retail experiential and private label services; and digital marketing, and digital media and advertising services. The company was formerly known as Karman Holding Corp. and changed its name to Advantage Solutions Inc. in March 2016. The company was founded in 1987 and is headquartered in Irvine, California.",Mr. David A. Peacock,Advertising Agencies,0.0129,USD,4183625,https://images.financialmodelingprep.com/symbol/ADVWW.png,46433.50481,,0.0028,13,-82755000,-326962000,"[{'period': '2024', 'revenue': 3570.0, 'unit': 'M', 'net_profit': -326.96}, {'period': '2023', 'revenue': 4220.0, 'unit': 'M', 'net_profit': -63.26}, {'period': '2022', 'revenue': 4.05, 'unit': 'B', 'net_profit': -1.38}, {'period': '2021', 'revenue': 3600.0, 'unit': 'M', 'net_profit': 54.49}]","[{'period': ""Q1 '25"", 'revenue': 821.79, 'unit': 'M', 'net_profit': -56.13}, {'period': ""Q4 '24"", 'revenue': 892.28, 'unit': 'M', 'net_profit': -177.88}, {'period': ""Q3 '24"", 'revenue': 939.27, 'unit': 'M', 'net_profit': -42.78}, {'period': ""Q2 '24"", 'revenue': 873.36, 'unit': 'M', 'net_profit': -114.01}, {'period': ""Q1 '24"", 'revenue': 879.0, 'unit': 'M', 'net_profit': -62.32}, {'period': ""Q4 '23"", 'revenue': 1080.0, 'unit': 'M', 'net_profit': 17.43}]",-1.02,-1.02,3106517000,910738000,205233000,2357782000,637225000,226510000,460062000,205233000,85257000,-1.2747756272972677,-4.168705934427266,-4.1,__nan__,__nan__,__nan__,0.758979268421837
92,ADXN,Addex Therapeutics Ltd American Depositary Shares,"Addex Therapeutics Ltd, a development-stage biopharmaceutical company, discovers, develops, and commercializes small-molecule pharmaceutical products for central nervous system (CNS) disorders in Switzerland. The company focuses on the discovery of oral small molecule allosteric modulators of G-protein coupled receptors. Its lead programs include Dipraglurant for the treatment of Parkinson's disease levodopa-induced dyskinesia, and dystonia; ADX71149 for epilepsy and undisclosed CNS disorders; and GABAB PAM for addiction. It has license and collaboration agreement with Janssen Pharmaceuticals Inc.; Indivior PLC; and The CharcotMarieTooth Association. The company was formerly known as Addex Pharmaceuticals Ltd and changed its name to Addex Therapeutics Ltd in March 2012. Addex Therapeutics Ltd was founded in 2002 and is headquartered in Geneva, Switzerland.",Mr. Timothy Mark Dyer,Biotechnology,8.5,USD,6965903,https://images.financialmodelingprep.com/symbol/ADXN.png,7222,-0.37,0.38,674,-10228668,-10556227,"[{'period': '2023', 'revenue': 1.61, 'unit': 'M', 'net_profit': -10.56}, {'period': '2022', 'revenue': 1.42, 'unit': 'M', 'net_profit': -20.8}, {'period': '2021', 'revenue': 2.92, 'unit': 'M', 'net_profit': -15.35}, {'period': '2020', 'revenue': 3.61, 'unit': 'M', 'net_profit': -12.86}]","[{'period': ""Q3 '24"", 'revenue': 0.053840000000000006, 'unit': 'M', 'net_profit': -1.53}, {'period': ""Q2 '24"", 'revenue': 0.11528000000000001, 'unit': 'M', 'net_profit': 12.88}, {'period': ""Q1 '24"", 'revenue': 0.23491, 'unit': 'M', 'net_profit': -3.09}, {'period': ""Q4 '23"", 'revenue': 0.15345, 'unit': 'M', 'net_profit': -2.86}, {'period': ""Q3 '23"", 'revenue': 0.32773, 'unit': 'M', 'net_profit': -2.62}, {'period': ""Q2 '23"", 'revenue': 0.63088, 'unit': 'M', 'net_profit': -2.68}]",-16.8,-16.8,4641885,4234605,3866329,3496420,151268,0,2893284,3865481,-7999253,0.49434707257049587,0.49259186108121467,0.6956521739130435,__nan__,__nan__,__nan__,0.7532327922815839
93,ADXS,Advaxis Inc. Common Stock,"Advaxis, Inc., a clinical-stage biotechnology company, focuses on the discovery, development, and commercialization of proprietary Listeria monocytogenes (Lm) technology antigen delivery products in the United States. The company is developing ADXS-PSA, which is in Phase 2 clinical trials for the treatment of metastatic prostate cancer; ADXS-503 that is in Phase 1/2 clinical trials for the treatment of non-small cell lung cancer; and ADXS-504 for the treatment of prostate cancer. It is also conducting clinical studies of Lm Technology immunotherapies in the following areas of disease focused hotspot/off-the-shelf neoantigen-directed therapies; human papilloma virus-associated cancers; and prostate cancer. The company has collaborations and partnerships with Merck & Co., Inc.; OS Therapies, LLC; Aratana Therapeutics Inc.; Biocon Limited; Global BioPharma Inc.; Knight Therapeutics Inc; and others. Advaxis, Inc. was founded in 2002 and is based in Monmouth Junction, New Jersey.",Mr. Kenneth A. Berlin J.D.,Biotechnology,0.03415,USD,1455931,https://images.financialmodelingprep.com/symbol/ADXS.png,4583,,0.00415,2906,-35869000,-48072000,"[{'period': '2023', 'revenue': 0.013000000000000001, 'unit': 'M', 'net_profit': -48.07}, {'period': '2022', 'revenue': 0.25, 'unit': 'M', 'net_profit': -14.36}, {'period': '2021', 'revenue': 3.24, 'unit': 'M', 'net_profit': -17.86}, {'period': '2020', 'revenue': 0.253, 'unit': 'M', 'net_profit': -26.47}]","[{'period': ""Q4 '23"", 'revenue': 0.0, 'unit': 'M', 'net_profit': -24.67}, {'period': ""Q3 '23"", 'revenue': 0.0, 'unit': 'M', 'net_profit': -7.34}, {'period': ""Q2 '23"", 'revenue': 0.009000000000000001, 'unit': 'M', 'net_profit': -8.7}, {'period': ""Q1 '23"", 'revenue': 0.004, 'unit': 'M', 'net_profit': -7.36}, {'period': ""Q4 '22"", 'revenue': 0.105, 'unit': 'M', 'net_profit': -9.59}, {'period': ""Q3 '22"", 'revenue': 0.25, 'unit': 'M', 'net_profit': -4.96}]",-7.99,-7.99,16579000,7528000,4882000,40996000,0,0,25018000,4882000,-29485000,-1.2736435091277891,-2.3478654502402674,-0.01139240506329112,__nan__,__nan__,__nan__,2.4727667531214186
94,AEAC,Authentic Equity Acquisition Corp. Class A ordinary share,"Authentic Equity Acquisition Corp. does not have significant operations. The company focuses on effecting a merger, capital stock exchange, asset acquisition, stock purchase, reorganization, or similar business combination with one or more businesses. It intends to identify business opportunities in the field of the consumer in North America. The company was incorporated in 2020 and is based in Rye, New York.",Mr. David M. Hooper,Shell Companies,10.13,USD,0,https://images.financialmodelingprep.com/symbol/AEAC.png,34356,0,-0.02,4203,6962388,15491848,"[{'period': '2021', 'revenue': 0.0, 'unit': 'M', 'net_profit': 15.49}, {'period': '2020', 'revenue': 0.0, 'unit': 'K', 'net_profit': -34.25}]","[{'period': ""Q3 '22"", 'revenue': 0.0, 'unit': 'M', 'net_profit': 4.14}, {'period': ""Q2 '22"", 'revenue': 0.0, 'unit': 'M', 'net_profit': 7.34}, {'period': ""Q1 '22"", 'revenue': 0.0, 'unit': 'M', 'net_profit': 8.66}, {'period': ""Q4 '21"", 'revenue': 0.0, 'unit': 'M', 'net_profit': 17.02}, {'period': ""Q3 '21"", 'revenue': 0.0, 'unit': 'M', 'net_profit': 6.21}, {'period': ""Q2 '21"", 'revenue': 0.0, 'unit': 'M', 'net_profit': -8.35}]",0.52,0.52,697.5339999999997,675.792,442.162,18737,0,230021,876.735,442.162,-1010801,204.28733685655055,453.32993664048587,473.7272727272727,__nan__,__nan__,__nan__,26.861773046188443
95,AEACU,Authentic Equity Acquisition Corp. Unit,"Authentic Equity Acquisition Corp. does not have significant operations. The company focuses on effecting a merger, capital stock exchange, asset acquisition, stock purchase, reorganization, or similar business combination with one or more businesses. It intends to identify business opportunities in the field of the consumer in North America. The company was incorporated in 2020 and is based in Rye, New York.",Mr. David M. Hooper,Shell Companies,10.13,USD,0,https://images.financialmodelingprep.com/symbol/AEACU.png,4936,0,-0.0048,1300,6962388,15491848,"[{'period': '2021', 'revenue': 0.0, 'unit': 'M', 'net_profit': 15.49}, {'period': '2020', 'revenue': 0.0, 'unit': 'K', 'net_profit': -34.25}]","[{'period': ""Q3 '22"", 'revenue': 0.0, 'unit': 'M', 'net_profit': 4.14}, {'period': ""Q2 '22"", 'revenue': 0.0, 'unit': 'M', 'net_profit': 7.34}, {'period': ""Q1 '22"", 'revenue': 0.0, 'unit': 'M', 'net_profit': 8.66}, {'period': ""Q4 '21"", 'revenue': 0.0, 'unit': 'M', 'net_profit': 17.02}, {'period': ""Q3 '21"", 'revenue': 0.0, 'unit': 'M', 'net_profit': 6.21}, {'period': ""Q2 '21"", 'revenue': 0.0, 'unit': 'M', 'net_profit': -8.35}]",0.52,0.52,697.5339999999997,675.792,442.162,18737,0,230021,876.735,442.162,-1010801,204.28733685655055,453.32993664048587,473.7272727272727,__nan__,__nan__,__nan__,26.861773046188443
96,AEACW,Authentic Equity Acquisition Corp. Warrant,"Authentic Equity Acquisition Corp. focuses on effecting a merger, capital stock exchange, asset acquisition, stock purchase, reorganization or similar business combination with one or more businesses. The company was founded in 2020 and is based in Rye, New York.",Mr. David M. Hooper,Shell Companies,0.0009,USD,0,https://images.financialmodelingprep.com/symbol/AEACW.png,0,0,0,65887,6962388,15491848,"[{'period': '2021', 'revenue': 0.0, 'unit': 'M', 'net_profit': 15.49}, {'period': '2020', 'revenue': 0.0, 'unit': 'K', 'net_profit': -34.25}]","[{'period': ""Q3 '22"", 'revenue': 0.0, 'unit': 'M', 'net_profit': 4.14}, {'period': ""Q2 '22"", 'revenue': 0.0, 'unit': 'M', 'net_profit': 7.34}, {'period': ""Q1 '22"", 'revenue': 0.0, 'unit': 'M', 'net_profit': 8.66}, {'period': ""Q4 '21"", 'revenue': 0.0, 'unit': 'M', 'net_profit': 17.02}, {'period': ""Q3 '21"", 'revenue': 0.0, 'unit': 'M', 'net_profit': 6.21}, {'period': ""Q2 '21"", 'revenue': 0.0, 'unit': 'M', 'net_profit': -8.35}]",0.52,0.52,697.5339999999997,675.792,442.162,18737,0,230021,876.735,442.162,-1010801,204.28733685655055,453.32993664048587,473.7272727272727,__nan__,__nan__,__nan__,26.861773046188443
97,AEHL,Antelope Enterprise Holdings Limited Common Stock (0.024 par),"Antelope Enterprise Holdings Limited, through its subsidiaries, manufactures and sells ceramic tiles for exterior siding and interior flooring, and design in residential and commercial buildings in the People's Republic of China. The company provides porcelain tiles, glazed tiles, glazed porcelain tiles, rustic tiles, and polished glazed tiles. It sells its products under the HD or Hengda brands through a network of distributors, as well as directly to property developers. The company was formerly known as China Ceramics Co., Ltd. and changed its name to Antelope Enterprise Holdings Limited in October 2020. Antelope Enterprise Holdings Limited was founded in 1993 and is headquartered in Jinjiang, the People's Republic of China.",Ms. Tingting  Zhang,Construction,2.82,USD,9640982,https://images.financialmodelingprep.com/symbol/AEHL.png,1019194,,0.13,143790,-9158000,-10544000,"[{'period': '2024', 'revenue': 98.77, 'unit': 'M', 'net_profit': -10.54}, {'period': '2023', 'revenue': 510.55, 'unit': 'M', 'net_profit': -14.34}, {'period': '2022', 'revenue': 286.35, 'unit': 'M', 'net_profit': -5.65}, {'period': '2021', 'revenue': 71.53, 'unit': 'M', 'net_profit': -90.06}]","[{'period': ""Q2 '24"", 'revenue': 315.86, 'unit': 'M', 'net_profit': -48.22}, {'period': ""Q4 '23"", 'revenue': 201.3, 'unit': 'M', 'net_profit': -48.95}, {'period': ""Q2 '23"", 'revenue': 309.25, 'unit': 'M', 'net_profit': -37.85}, {'period': ""Q4 '22"", 'revenue': 168.1, 'unit': 'M', 'net_profit': -6.83}, {'period': ""Q2 '22"", 'revenue': 118.25, 'unit': 'M', 'net_profit': -3.09}, {'period': ""Q2 '21"", 'revenue': 50.11, 'unit': 'M', 'net_profit': -70.77}]",0,0,38006000,26909000,1047000,11765000,20185000,0,10693000,1047000,-19685000,0.897365206379092,0.26471408647140865,1,"[0.0033, 0.025]","['2014-12-10', '2013-06-11']",__nan__,0.30955638583381573
98,AEHR,Aehr Test Systems Common Stock,"Aehr Test Systems provides test systems for burning-in and testing logic, optical, and memory integrated circuits worldwide. It offers products, such as the ABTS and FOX-P families of test and burn-in systems and FOX WaferPak Aligner, FOX-XP WaferPak Contactor, FOX DiePak Carrier, and FOX DiePak Loader. The ABTS system is used in production and qualification testing of packaged parts for lower power and higher power logic devices, as well as various common types of memory devices. The FOX-XP and FOX-NP systems are wafer contact and singulated die/module test and burn-in systems used for burn-in and functional test of complex devices, such as memories, digital signal processors, microprocessors, microcontrollers, systems-on-a-chip, and integrated optical devices. The FOX-CP system is a single-wafer compact test and reliability verification solution for logic, memory, and photonic devices. The WaferPak Contactor contains a unique full wafer probe card capable of testing wafers up to 300mm that enables IC manufacturers to perform test and burn-in of full wafers on Aehr Test FOX systems. The DiePak Carrier is a reusable, temporary package that enables IC manufacturers to perform final test and burn-in of bare die and modules. Aehr Test Systems was incorporated in 1977 and is headquartered in Fremont, California.",Mr. Gayn  Erickson,Semiconductors,9.29,USD,276576306,https://images.financialmodelingprep.com/symbol/AEHR.png,781848,12.06,0.01,476065,11441000,33156000,"[{'period': '2024', 'revenue': 66.22, 'unit': 'M', 'net_profit': 33.16}, {'period': '2023', 'revenue': 64.96, 'unit': 'M', 'net_profit': 14.56}, {'period': '2022', 'revenue': 50.83, 'unit': 'M', 'net_profit': 9.45}, {'period': '2021', 'revenue': 16.6, 'unit': 'M', 'net_profit': -2.03}]","[{'period': ""Q3 '25"", 'revenue': 18310.0, 'unit': 'K', 'net_profit': -643.0}, {'period': ""Q2 '25"", 'revenue': 13.45, 'unit': 'M', 'net_profit': -1.03}, {'period': ""Q1 '25"", 'revenue': 13120.0, 'unit': 'K', 'net_profit': 660.0}, {'period': ""Q4 '24"", 'revenue': 16.6, 'unit': 'M', 'net_profit': 23.86}, {'period': ""Q3 '24"", 'revenue': 7.56, 'unit': 'M', 'net_profit': -1.47}, {'period': ""Q2 '24"", 'revenue': 21.43, 'unit': 'M', 'net_profit': 6.09}]",1.15,1.12,127912000,97848000,49159000,16319000,9996000,0,10508000,49159000,1007000,-0.17244122965641953,1.2776671017379955,1.2115384615384612,__nan__,__nan__,__nan__,0.12757989868034272
99,AEI,Alset EHome International Inc. Common Stock,"Alset EHome International Inc., through its subsidiaries, engages in the real estate development, financial services, digital transformation technologies, biohealth, and consumer products businesses in the United States, Singapore, Hong Kong, Australia, and South Korea. It operates through four segments: Real Estate, Digital Transformation Technology, Biohealth, and Other Business Activities segments. The Real Estate segment develops property projects and participates in third-party property development projects; and owns, operates, and manages real estate development projects with a focus on land subdivision developments and house rental projects. The Digital Transformation Technology segment provides consulting, implementation, and development services with various technologies, including blockchain, e-commerce, social media, and payment solutions. Its technology platform focuses on business-to-business solutions, such as communications and workflow, instant messaging, international calling, social media, e-commerce and payment systems, and direct marketing solutions. The Biohealth segment engages in developing, researching, testing, manufacturing, licensing, and distributing biohealth products and services. The Other Business Activities segment offers corporate strategy and business development, asset management, corporate restructuring, and leveraged buy-out expertise services. The company was formerly known as HF Enterprises Inc. and changed its name to Alset EHome International Inc. in February 2021. Alset EHome International Inc. was incorporated in 2018 and is based in Bethesda, Maryland.",Mr. Heng Fai  Chan,Real Estate - Development,0.9482,USD,10179022,https://images.financialmodelingprep.com/symbol/AEI.png,49596,-2.21,-0.0118,28451,-2674819,-3965884,"[{'period': '2024', 'revenue': 21.12, 'unit': 'M', 'net_profit': -3.97}, {'period': '2023', 'revenue': 22.09, 'unit': 'M', 'net_profit': -58.95}, {'period': '2022', 'revenue': 4.48, 'unit': 'M', 'net_profit': -40.49}, {'period': '2021', 'revenue': 19.8, 'unit': 'M', 'net_profit': -119.02}]","[{'period': ""Q1 '25"", 'revenue': 1.07, 'unit': 'M', 'net_profit': -9.5}, {'period': ""Q4 '24"", 'revenue': 8.94, 'unit': 'M', 'net_profit': 2.33}, {'period': ""Q3 '24"", 'revenue': 4.96, 'unit': 'M', 'net_profit': 1.72}, {'period': ""Q2 '24"", 'revenue': 1.13, 'unit': 'M', 'net_profit': -1.24}, {'period': ""Q1 '24"", 'revenue': 6.09, 'unit': 'M', 'net_profit': -6.77}, {'period': ""Q4 '23"", 'revenue': 1.02, 'unit': 'M', 'net_profit': -33.27}]",-0.43,-0.43,96761977,59760342,27243787,6563126,75646,0,5476601,27243787,5053298,-2.344422563563958,0.9327204837223171,0.9340490797546013,__nan__,__nan__,__nan__,0.06782753105592293
