,symbol,name,description__profile,ceo__profile,industry__profile,price__profile,currency__profile,mktCap__profile,image__profile,volAvg__profile,pe__quote,change__quote,volume__quote,ebitda__income_statement,netIncome__income_statement,annual_earnings,quaterly_earnings,eps__income_statement,epsdiluted__income_statement,totalAssets__balance_sheet_statement,totalCurrentAssets__balance_sheet_statement,cashAndShortTermInvestments__balance_sheet_statement,totalLiabilities__balance_sheet_statement,netReceivables__balance_sheet_statement,longTermInvestments__balance_sheet_statement,totalCurrentLiabilities__balance_sheet_statement,cashAndCashEquivalents__balance_sheet_statement,freeCashFlow__cash_flow_statement,growthEBITDA__income_statement_growth,growthNetIncome__income_statement_growth,growthEPS__income_statement_growth,dividend__historical-price-full/stock_dividend,date__historical-price-full/stock_dividend,derived__netIncomeMargin,derived__debtRatio
176,ALEC,Alector Inc. Common Stock,"Alector, Inc., a clinical stage biopharmaceutical company, develops therapies for the treatment of neurodegeneration diseases. Its products include AL001, a humanized recombinant monoclonal antibody, which is in Phase III clinical trial for the treatment of frontotemporal dementia, Alzheimer's, Parkinson's, and amyotrophic lateral sclerosis diseases; and AL101 that is in Phase I clinical trial for the treatment of neurodegenerative diseases, including Alzheimer's and Parkinson's diseases. The company also offers AL002, a product candidate that is in Phase II clinical trial for the treatment of Alzheimer's disease; and AL003, which is in Phase I clinical trial for the treatment of Alzheimer's disease. In addition, its products in development stage include AL044 that targets MS4A4A, a risk gene for Alzheimer's disease. Alector, Inc. has a collaboration agreement with Adimab, LLC for the research and development of antibodies; and a strategic collaboration agreement with GlaxoSmithKline plc for the development and commercialization of monoclonal antibodies, such as AL001 and AL101 to treat neurodegenerative diseases. The company was founded in 2013 and is headquartered in South San Francisco, California.",Dr. Arnon  Rosenthal Ph.D.,Biotechnology,1.22,USD,121990972,https://images.financialmodelingprep.com/symbol/ALEC.png,857111,-0.97,0.115,1794524,-136156000,-119049000,"[{'period': '2024', 'revenue': 100.56, 'unit': 'M', 'net_profit': -119.05}, {'period': '2023', 'revenue': 97.06, 'unit': 'M', 'net_profit': -130.39}, {'period': '2022', 'revenue': 133.62, 'unit': 'M', 'net_profit': -133.31}, {'period': '2021', 'revenue': 207.09, 'unit': 'M', 'net_profit': -28.01}]","[{'period': ""Q1 '25"", 'revenue': 3.67, 'unit': 'M', 'net_profit': -40.47}, {'period': ""Q4 '24"", 'revenue': 54.24, 'unit': 'M', 'net_profit': -2.07}, {'period': ""Q3 '24"", 'revenue': 15.34, 'unit': 'M', 'net_profit': -42.22}, {'period': ""Q2 '24"", 'revenue': 15.08, 'unit': 'M', 'net_profit': -38.68}, {'period': ""Q1 '24"", 'revenue': 15.89, 'unit': 'M', 'net_profit': -36.08}, {'period': ""Q4 '23"", 'revenue': 15.19, 'unit': 'M', 'net_profit': -41.43}]",-1.23,-1.23,468303000,424817000,413397000,341503000,0,0,125059000,33021000,-231160000,0.04714049771855667,0.08698453114095298,0.21153846153846156,__nan__,__nan__,__nan__,0.7292351319551658
177,ALF,ALFI Inc. Common Stock,"Centurion Acquisition Corp. operates as a blank check company. The Company aims to acquire one and more businesses and assets, via a merger, capital stock exchange, asset acquisition, stock purchase, and reorganization.",Mr. Mark  Gerhard,Shell Companies,10.43,USD,374470345,https://images.financialmodelingprep.com/symbol/ALF.png,120866,31.61,-0.06,224553,-467492,5573892,"[{'period': '2024', 'revenue': 0.0, 'unit': 'M', 'net_profit': 5.57}, {'period': '2021', 'revenue': 0.0, 'unit': '', 'net_profit': 0.0}, {'period': '2020', 'revenue': 0.0, 'unit': 'M', 'net_profit': -3.56}, {'period': '2019', 'revenue': 0.0, 'unit': 'K', 'net_profit': 66.73}]","[{'period': ""Q1 '25"", 'revenue': 0.0, 'unit': 'M', 'net_profit': 2.32}, {'period': ""Q4 '24"", 'revenue': 0.0, 'unit': 'M', 'net_profit': 3.22}, {'period': ""Q3 '24"", 'revenue': 0.0, 'unit': 'M', 'net_profit': 4.05}, {'period': ""Q2 '24"", 'revenue': 0.0, 'unit': 'K', 'net_profit': 612.18}, {'period': ""Q2 '22"", 'revenue': 0.12930000000000003, 'unit': 'M', 'net_profit': -11.1}, {'period': ""Q1 '22"", 'revenue': 0.0633, 'unit': 'T', 'net_profit': -5.29}]",0.33,0.33,296657187,798845,665430,13812496,0,0,124996,665430,-165249,0,0,0,"[0.015, 0.015]","['2019-12-19', '2019-12-19']",__nan__,0.046560463070796934
178,ALFIW,ALFI Inc. Warrant,"Alfi, Inc. provides interactive intelligent artificial intelligence and machine learning software solutions. Alfi, Inc. was formerly known as Lectrefy, Inc. and changed its name to Alfi, Inc. in January 2020. The company was founded in 2018 and is based in Miami Beach, Florida.",Dr. Paul Antonio Pereira,Software - Infrastructure,0.22,USD,0,https://images.financialmodelingprep.com/symbol/ALFIW.png,0,0,0.11,500,-428391000000,0,"[{'period': '2021', 'revenue': 0.0, 'unit': '', 'net_profit': 0.0}, {'period': '2020', 'revenue': 0.0, 'unit': 'M', 'net_profit': -3.56}, {'period': '2019', 'revenue': 0.0, 'unit': 'K', 'net_profit': 66.73}]","[{'period': ""Q3 '24"", 'revenue': 0.0, 'unit': 'M', 'net_profit': 4.05}, {'period': ""Q2 '24"", 'revenue': 0.0, 'unit': 'K', 'net_profit': 612.18}, {'period': ""Q2 '22"", 'revenue': 0.12930000000000003, 'unit': 'M', 'net_profit': -11.1}, {'period': ""Q1 '22"", 'revenue': 0.0633, 'unit': 'T', 'net_profit': -5.29}, {'period': ""Q4 '21"", 'revenue': -0.01839, 'unit': 'M', 'net_profit': 7.87}, {'period': ""Q3 '21"", 'revenue': 0.000112, 'unit': 'M', 'net_profit': -5.08}]",0,0,11373005,5323564,4391816,2362757,5578,0,2362757,4391816,-20566553,-143436.64031418995,1,1,__nan__,__nan__,__nan__,0.20775133748732194
179,ALGM,Allegro MicroSystems Inc. Common Stock,"Allegro MicroSystems, Inc. designs, develops, manufactures, and markets sensor integrated circuits (ICs) and application-specific analog power ICs for motion control and energy-efficient systems. Its products include magnetic sensor ICs, such as position, speed, and current sensor ICs; power ICs comprising motor driver ICs, and regulator and LED driver ICs; and photonic and 3D sensing components, including photodiodes, eye-safe lasers, and readout ICs for LiDAR applications. The company sells its products to original equipment manufacturers and suppliers primarily in the automotive and industrial markets through its direct sales force, third party distributors, independent sales representatives, and consignment. It operates in the United States, rest of the Americas, Europe, Japan, Greater China, South Korea, and other Asian markets. The company was founded in 1990 and is headquartered in Manchester, New Hampshire. Allegro MicroSystems, Inc. is a subsidiary of Sanken Electric Co., Ltd.",Mr. Michael C. Doogue,Semiconductors,27.51,USD,5065278750,https://images.financialmodelingprep.com/symbol/ALGM.png,3823200,-70.54,0.49,2174107,276942000,152697000,"[{'period': '2024', 'revenue': 1050.0, 'unit': 'M', 'net_profit': 152.7}, {'period': '2023', 'revenue': 973.65, 'unit': 'M', 'net_profit': 187.36}, {'period': '2022', 'revenue': 768.67, 'unit': 'M', 'net_profit': 119.41}, {'period': '2021', 'revenue': 591.21, 'unit': 'M', 'net_profit': 17.95}]","[{'period': ""Q4 '25"", 'revenue': 192.82, 'unit': 'M', 'net_profit': -14.8}, {'period': ""Q3 '25"", 'revenue': 177.87, 'unit': 'M', 'net_profit': -6.86}, {'period': ""Q2 '25"", 'revenue': 187.39, 'unit': 'M', 'net_profit': -33.67}, {'period': ""Q1 '25"", 'revenue': 166.92, 'unit': 'M', 'net_profit': -17.68}, {'period': ""Q4 '24"", 'revenue': 240.58, 'unit': 'M', 'net_profit': -7.12}, {'period': ""Q3 '24"", 'revenue': 254.98, 'unit': 'M', 'net_profit': 33.34}]",0.79,0.78,1530603000,572213000,212143000,398887000,125168000,26727000,117908000,212143000,56943000,0.04707928466104579,-0.18499442241282685,-0.1938775510204081,__nan__,__nan__,__nan__,0.2606077474041277
180,ALGN,Align Technology Inc. Common Stock,"Align Technology, Inc., a medical device company, designs, manufactures, and markets Invisalign clear aligners and iTero intraoral scanners and services for orthodontists and general practitioner dentists, and restorative and aesthetic dentistry. It operates in two segments, Clear Aligner; and Scanners and Services. The Clear Aligner segment consists of comprehensive products, including Invisalign comprehensive treatment that addresses the orthodontic needs of teenage patients, such as mandibular advancement, compliance indicators, and compensation for tooth eruption; and Invisalign First Phase I and Invisalign First Comprehensive Phase 2 package for younger patients generally between the ages of seven and ten years, which is a mixture of primary/baby and permanent teeth. This segment's non-comprehensive products comprise Invisalign moderate, lite and express packages, and Invisalign go; and non-case products include retention products, Invisalign training fees, and sales of ancillary products, such as cleaning material, and adjusting tools used by dental professionals during the course of treatment. The Scanners and Services segment offers iTero scanner, a single hardware platform with software options for restorative or orthodontic procedures; restorative software for general practitioner dentists, prosthodontists, periodontists, and oral surgeons; and software for orthodontists for digital records storage, orthodontic diagnosis, and for the fabrication of printed models and retainers. This segment also provides computer-aided design and computer-aided manufacturing services; ancillary products, such as disposable sleeves for the wand; iTero model and dies; third party scanners and digital scans; Invisalign outcome simulator, a chair-side and cloud-based application for the iTero scanner; Invisalign progress assessment tool; and TimeLapse technology, which allows doctors or practitioners to compare a patient's historic 3D scans to the present-day scan. The company sells its products in the United States, Switzerland, China, and internationally. Align Technology, Inc. was incorporated in 1997 and is headquartered in Tempe, Arizona.",Mr. Joseph M. Hogan,Medical - Devices,188.29,USD,13648162992,https://images.financialmodelingprep.com/symbol/ALGN.png,1291904,34.17,1.57,684640,816798000,421362000,"[{'period': '2024', 'revenue': 4000.0, 'unit': 'M', 'net_profit': 421.36}, {'period': '2023', 'revenue': 3860.0, 'unit': 'M', 'net_profit': 445.05}, {'period': '2022', 'revenue': 3730.0, 'unit': 'M', 'net_profit': 361.57}, {'period': '2021', 'revenue': 3950.0, 'unit': 'M', 'net_profit': 772.02}]","[{'period': ""Q1 '25"", 'revenue': 979.26, 'unit': 'M', 'net_profit': 93.23}, {'period': ""Q4 '24"", 'revenue': 995.22, 'unit': 'M', 'net_profit': 103.81}, {'period': ""Q3 '24"", 'revenue': 977.87, 'unit': 'M', 'net_profit': 115.96}, {'period': ""Q2 '24"", 'revenue': 1030.0, 'unit': 'M', 'net_profit': 96.56}, {'period': ""Q1 '24"", 'revenue': 997.43, 'unit': 'M', 'net_profit': 105.03}, {'period': ""Q4 '23"", 'revenue': 956.73, 'unit': 'M', 'net_profit': 124.01}]",5.63,5.62,6214600000,2492441000,1043887000,2362615000,1029713000,0,2038027000,1043887000,622651000,0.02222544831979415,-0.053231862272583266,-0.0326460481099657,__nan__,__nan__,__nan__,0.38017169246612814
181,ALGS,Aligos Therapeutics Inc. Common Stock,"Aligos Therapeutics, Inc., a clinical-stage biopharmaceutical company, focuses to develop novel therapeutics to address unmet medical needs in viral and liver diseases. Its lead drug candidate is ALG-010133, a s-antigen transport-inhibiting oligonucleotide polymer that is in Phase Ib clinical trial for the treatment of chronic hepatitis B (CHB); and ALG-000184, a capsid assembly modulator, which is in Phase I clinical trials to treat CHB. The company also develops ALG-020572, an antisense oligonucleotide to prevent HBsAg translation and secretion; and ALG-055009, a small molecule THR- agonist that is in the Phase 1a/1b for the treatment of non-alcoholic steatohepatitis(NASH). In addition, it develops siRNA drug candidate, ALG-125755, as well as ALG-125097 and ALG-125819, demonstrated potent inhibition of HBsAg release from HBV-infected cells. It has entered into license and collaboration agreements with Luxna Biotech Co., Ltd. to develop and commercialize products containing oligonucleotides targeting hepatitis B virus genome; Emory University to provide hepatitis B virus capsid assembly modulator technology; research, licensing, and commercialization agreement with Katholieke Universiteit Leuven to develop coronavirus protease inhibitors; and Merck to discover, research, optimize, and develop oligonucleotides directed against a NASH. The company was incorporated in 2018 and is headquartered in South San Francisco, California.","Dr. Lawrence M. Blatt MBA, Ph.D.",Biotechnology,5.84,USD,35710432,https://images.financialmodelingprep.com/symbol/ALGS.png,177235,-0.33,0.04,155913,-89154000,-131211000,"[{'period': '2024', 'revenue': 3.94, 'unit': 'M', 'net_profit': -131.21}, {'period': '2023', 'revenue': 15.53, 'unit': 'M', 'net_profit': -87.68}, {'period': '2022', 'revenue': 13.91, 'unit': 'M', 'net_profit': -96.05}, {'period': '2021', 'revenue': 4.36, 'unit': 'M', 'net_profit': -128.33}]","[{'period': ""Q1 '25"", 'revenue': 0.311, 'unit': 'M', 'net_profit': 43.09}, {'period': ""Q4 '24"", 'revenue': 0.629, 'unit': 'M', 'net_profit': -82.15}, {'period': ""Q3 '24"", 'revenue': 1.27, 'unit': 'M', 'net_profit': -19.26}, {'period': ""Q2 '24"", 'revenue': 1.06, 'unit': 'M', 'net_profit': 5.06}, {'period': ""Q1 '24"", 'revenue': 0.986, 'unit': 'M', 'net_profit': -34.86}, {'period': ""Q4 '23"", 'revenue': 2.68, 'unit': 'M', 'net_profit': -27.89}]",-20.94,-20.94,70094000,62141000,56939000,99067000,0,0,21737000,36997000,-80873000,-0.04815537633144443,-0.4964928888331299,-4.948863636363637,__nan__,__nan__,__nan__,1.4133449367991555
182,ALGT,Allegiant Travel Company Common Stock,"Allegiant Travel Company, a leisure travel company, provides travel services and products to residents of under-served cities in the United States. The company offers scheduled air transportation on limited-frequency, nonstop flights between under-served cities and leisure destinations. As of February 14, 2022, it operated a fleet of 110 Airbus A320 series aircraft. The company also provides air-related services and products in conjunction with air transportation, including baggage fees, advance seat assignments, travel protection products, priority boarding, a customer convenience fee, food and beverage purchases on board, and other air-related services, as well as use of its call center for purchases. In addition, it offers third party travel products, such as hotel rooms and ground transportation, such as rental cars and hotel shuttle products; and air transportation services through fixed fee agreements and charter service on a year-round and ad-hoc basis. Further, the company operates a golf course. Allegiant Travel Company was founded in 1997 and is based in Las Vegas, Nevada.",Mr. Gregory Clark Anderson CPA,"Airlines, Airports & Air Services",56.13,USD,1024636311,https://images.financialmodelingprep.com/symbol/ALGT.png,575715.4,-4.8,0.87,353256,60859000,-240238000,"[{'period': '2024', 'revenue': 2510.0, 'unit': 'M', 'net_profit': -240.24}, {'period': '2023', 'revenue': 2510.0, 'unit': 'M', 'net_profit': 117.6}, {'period': '2022', 'revenue': 2300.0, 'unit': 'M', 'net_profit': 2.49}, {'period': '2021', 'revenue': 1710.0, 'unit': 'M', 'net_profit': 151.85}]","[{'period': ""Q1 '25"", 'revenue': 699.07, 'unit': 'M', 'net_profit': 32.1}, {'period': ""Q4 '24"", 'revenue': 627.71, 'unit': 'M', 'net_profit': -216.23}, {'period': ""Q3 '24"", 'revenue': 562.2, 'unit': 'M', 'net_profit': -36.79}, {'period': ""Q2 '24"", 'revenue': 666.28, 'unit': 'M', 'net_profit': 13.7}, {'period': ""Q1 '24"", 'revenue': 656.41, 'unit': 'M', 'net_profit': -1.27}, {'period': ""Q4 '23"", 'revenue': 611.0, 'unit': 'M', 'net_profit': -2.3}]",-13.49,-13.49,4429853000,991605000,781126000,3340461000,90407000,51725000,1277404000,285892000,38302000,-0.875857496914745,-3.042909622776285,-3.134493670886076,"[0.6, 0.75]","['2024-05-14', '2010-05-12']",__nan__,0.7540794243059533
183,ALHC,Alignment Healthcare Inc. Common Stock,"Alignment Healthcare, Inc., a tech-enabled Medicare advantage company, operates consumer-centric health care platform. It provides customized health care in the United States to seniors and those who need it through its Medicare advantage plans. The company owns Medicare advantage plans in the states of California, North Carolina, and Nevada. It also coordinates and provides covered health care services, including professional, institutional, and ancillary services to members enrolled in certain benefit plans of unaffiliated Medicare Advantage Health Maintenance Organizations. The company was founded in 2013 and is based in Orange, California.",Mr. John E. Kao,Medical - Healthcare Plans,15.78,USD,3121962540,https://images.financialmodelingprep.com/symbol/ALHC.png,3215775,-33.57,0.88,2568814,-77595000,-128035000,"[{'period': '2024', 'revenue': 2700.0, 'unit': 'M', 'net_profit': -128.03}, {'period': '2023', 'revenue': 1820.0, 'unit': 'M', 'net_profit': -148.02}, {'period': '2022', 'revenue': 1430.0, 'unit': 'M', 'net_profit': -149.64}, {'period': '2021', 'revenue': 1170.0, 'unit': 'M', 'net_profit': -212.96}]","[{'period': ""Q1 '25"", 'revenue': 926.93, 'unit': 'M', 'net_profit': -9.11}, {'period': ""Q4 '24"", 'revenue': 701.24, 'unit': 'M', 'net_profit': -31.09}, {'period': ""Q3 '24"", 'revenue': 692.43, 'unit': 'M', 'net_profit': -26.41}, {'period': ""Q2 '24"", 'revenue': 681.29, 'unit': 'M', 'net_profit': -24.01}, {'period': ""Q1 '24"", 'revenue': 628.6, 'unit': 'M', 'net_profit': -46.52}, {'period': ""Q4 '23"", 'revenue': 465.39, 'unit': 'M', 'net_profit': -47.21}]",-0.67,-0.67,782063000,661638000,470650000,681108000,153904000,0,351845000,432859000,-6648000,0.2630774198450084,0.13499800698568407,0.15189873417721517,__nan__,__nan__,__nan__,0.8709119342047891
184,ALIM,Alimera Sciences Inc. Common Stock,"Alimera Sciences, Inc., a pharmaceutical company, engages in the development and commercialization of ophthalmic pharmaceuticals in the United States and internationally. It offers ILUVIEN, an intravitreal implant for the treatment of diabetic macular edema (DME), which is a disease of the retina that affects individuals with diabetes and lead to severe vision loss and blindness; and to prevent relapse in recurrent non-infectious uveitis affecting the posterior segment of the eye. The company sells its products to physician offices, pharmacies, and hospitals through direct sales and distributors. It has a collaboration agreement with EyePoint Pharmaceuticals US, Inc. for the development and sale of insert technology to deliver other corticosteroids to the back of the eye for the treatment and prevention of eye diseases in humans or to treat diabetic macular edema. The company was incorporated in 2003 and is headquartered in Alpharetta, Georgia.",Mr. Richard S. Eiswirth Jr.,Drug Manufacturers - Specialty & Generic,5.54,USD,301288468,https://images.financialmodelingprep.com/symbol/ALIM.png,866825,5.276190476190476,-0.01,2677974,7276000,-20132000,"[{'period': '2023', 'revenue': 80.75, 'unit': 'M', 'net_profit': -20.13}, {'period': '2022', 'revenue': 54.13, 'unit': 'M', 'net_profit': -18.11}, {'period': '2021', 'revenue': 59.03, 'unit': 'M', 'net_profit': -4.37}, {'period': '2020', 'revenue': 50.82, 'unit': 'M', 'net_profit': -5.34}]","[{'period': ""Q2 '24"", 'revenue': 27.0, 'unit': 'M', 'net_profit': -3.31}, {'period': ""Q1 '24"", 'revenue': 23.01, 'unit': 'M', 'net_profit': -6.25}, {'period': ""Q4 '23"", 'revenue': 26.31, 'unit': 'M', 'net_profit': -3.78}, {'period': ""Q3 '23"", 'revenue': 23.36, 'unit': 'M', 'net_profit': -1.35}, {'period': ""Q2 '23"", 'revenue': 17.54, 'unit': 'M', 'net_profit': -10.03}, {'period': ""Q1 '23"", 'revenue': 13.55, 'unit': 'M', 'net_profit': -8.3}]",-0.79,-0.79,153524000,52423000,12090000,107354000,34545000,0,21913000,12090000,-89793000,1.8144168345645848,-0.11183520185563595,0.6949806949806949,__nan__,__nan__,__nan__,0.699265261457492
185,ALJJ,ALJ Regional Holdings Inc. Common Stock,"ALJ Regional Holdings, Inc. provides call center, back-office, staffing, and toll collection services to government and commercial clients in the healthcare, utility, toll, transportation, and toll revenue collection industries in the United States. It operates through two segments, Faneuil and Phoenix. The Faneuil segment offers customer contact centers, fulfillment operations, and information technology services, as well as manual and electronic toll collection, violation processing, and medical device tracking services. This segment also provides customer relationship management; billing, payment, and claims processing; data entry; document management; operational expertise; workforce and support analytics; quality assurance; staffing; and system support and maintenance services. The Phoenix segment manufactures book components; educational materials and related products; heavily illustrated books; and specialty commercial products. This segment also provides label, printing, and packaging solutions. The company was formerly known as YouthStream Media Networks, Inc. and changed its name to ALJ Regional Holdings, Inc. in October 2006. ALJ Regional Holdings, Inc. was incorporated in 1999 and is based in New York, New York.",Mr. Jess Marshall Ravich J.D.,Specialty Business Services,1.92,USD,0,https://images.financialmodelingprep.com/symbol/ALJJ.png,28910,1.0607734806629834,0,184093,8920000,-3580000,"[{'period': '2021', 'revenue': 440.85, 'unit': 'M', 'net_profit': -3.58}, {'period': '2020', 'revenue': 389.15, 'unit': 'M', 'net_profit': -67.67}, {'period': '2019', 'revenue': 355.0, 'unit': 'M', 'net_profit': -15.98}, {'period': '2018', 'revenue': 369.78, 'unit': 'M', 'net_profit': -7.33}]","[{'period': ""Q3 '22"", 'revenue': 57.62, 'unit': 'M', 'net_profit': 105.87}, {'period': ""Q2 '22"", 'revenue': 68.51, 'unit': 'M', 'net_profit': -8.48}, {'period': ""Q1 '22"", 'revenue': 103.08, 'unit': 'M', 'net_profit': -9.39}, {'period': ""Q4 '21"", 'revenue': 111.67, 'unit': 'M', 'net_profit': 1.06}, {'period': ""Q3 '21"", 'revenue': 103.46, 'unit': 'M', 'net_profit': -3.5}, {'period': ""Q2 '21"", 'revenue': 114590.0, 'unit': 'K', 'net_profit': -115.0}]",-0.0846,-0.0846,214653000,89396000,2276000,202077000,68572000,0,58928000,2276000,3574000,20.349240780911064,0.9470993291367438,0.947125,__nan__,__nan__,__nan__,0.9414124191136393
186,ALKS,Alkermes plc Ordinary Shares,"Alkermes plc, a biopharmaceutical company, researches, develops, and commercializes pharmaceutical products to address unmet medical needs of patients in various therapeutic areas in the United States, Ireland, and internationally. Its marketed products include ARISTADA, an intramuscular injectable suspension for the treatment of schizophrenia; VIVITROL for the treatment of alcohol and prevention of opioid dependence; RISPERDAL CONSTA for the treatment of schizophrenia and bipolar I disorder; INVEGA SUSTENNA for the treatment of schizophrenia and schizoaffective disorder; XEPLION, INVEGA TRINZA, and TREVICTA to treat schizophrenia and schizoaffective; and VUMERITY for the treatment of relapsing forms of multiple sclerosis in adults, including clinically isolated syndrome, relapsing-remitting and active secondary progressive diseases. The company is also developing LYBALVI, an oral atypical antipsychotic drug candidate for the treatment of adults with schizophrenia and bipolar I disorder; and nemvaleukin alfa, an engineered fusion protein to expand tumor-killing immune cells and to avoid the activation of immunosuppressive cells. It has collaboration agreements primarily with Janssen Pharmaceutica N.V., Janssen Pharmaceutica Inc, and Janssen Pharmaceutica International. Alkermes plc was founded in 1987 and is headquartered in Dublin, Ireland.",Mr. Richard F. Pops,Biotechnology,31.42,USD,5181189420,https://images.financialmodelingprep.com/symbol/ALKS.png,1771787,14.28,0.21,957411,494861000,367070000,"[{'period': '2024', 'revenue': 1560.0, 'unit': 'M', 'net_profit': 367.07}, {'period': '2023', 'revenue': 1660.0, 'unit': 'M', 'net_profit': 355.76}, {'period': '2022', 'revenue': 1110.0, 'unit': 'M', 'net_profit': -158.27}, {'period': '2021', 'revenue': 1170.0, 'unit': 'M', 'net_profit': -48.17}]","[{'period': ""Q1 '25"", 'revenue': 306.51, 'unit': 'M', 'net_profit': 22.46}, {'period': ""Q4 '24"", 'revenue': 429.99, 'unit': 'M', 'net_profit': 146.5}, {'period': ""Q3 '24"", 'revenue': 378.14, 'unit': 'M', 'net_profit': 92.38}, {'period': ""Q2 '24"", 'revenue': 399.13, 'unit': 'M', 'net_profit': 91.36}, {'period': ""Q1 '24"", 'revenue': 350.37, 'unit': 'M', 'net_profit': 36.83}, {'period': ""Q4 '23"", 'revenue': 377.48, 'unit': 'M', 'net_profit': 112.78}]",2.22,2.17,2055567000,1415355000,751668000,590590000,389518000,73148000,465199000,291146000,405640000,-0.04738795483158093,0.031799795928119476,0.03738317757009349,__nan__,__nan__,__nan__,0.28731245442255104
