,symbol,name,description__profile,ceo__profile,industry__profile,price__profile,currency__profile,mktCap__profile,image__profile,volAvg__profile,pe__quote,change__quote,volume__quote,ebitda__income_statement,netIncome__income_statement,annual_earnings,quaterly_earnings,eps__income_statement,epsdiluted__income_statement,totalAssets__balance_sheet_statement,totalCurrentAssets__balance_sheet_statement,cashAndShortTermInvestments__balance_sheet_statement,totalLiabilities__balance_sheet_statement,netReceivables__balance_sheet_statement,longTermInvestments__balance_sheet_statement,totalCurrentLiabilities__balance_sheet_statement,cashAndCashEquivalents__balance_sheet_statement,freeCashFlow__cash_flow_statement,growthEBITDA__income_statement_growth,growthNetIncome__income_statement_growth,growthEPS__income_statement_growth,dividend__historical-price-full/stock_dividend,date__historical-price-full/stock_dividend,derived__netIncomeMargin,derived__debtRatio
262,ANSS,ANSYS Inc. Common Stock,"ANSYS, Inc. develops and markets engineering simulation software and services worldwide. It offers ANSYS Workbench, a framework upon which its multiphysics engineering simulation technologies are built and enables engineers to simulate the interactions between structures, heat transfer, fluids, electronics, and optical elements in a unified engineering simulation environment; high-performance computing product suite; power analysis and optimization software suite that manages the power budget, power delivery integrity, and power-induced noise in an electronic design; and structural analysis product suite that provides simulation tools for product design and optimization. The company also provides electronics product suite that offers field simulation software for designing electronic and electromechanical products; SCADE product suite, a solution for embedded software simulation, code production, and automated certification; fluids product suite that enables modeling of fluid flow and other related physical phenomena; Ansys Granta products to give access to material intelligence; photonic design and simulation tools; and optical sensor and closed-loop, and real-time simulation, as well as safety-certified embedded software solutions. In addition, the company provides Discovery product family for use in the simulation of product design; and academic product suite used in research and teaching settings, which allows students to become familiar with its simulation software. It serves engineers, designers, researchers, and students in the aerospace and defense, automotive transportation and mobility, construction, consumer products, energy, healthcare, high-tech, industrial equipment, materials and chemical processing, and sports industries. The company was founded in 1970 and is headquartered in Canonsburg, Pennsylvania.",Dr. Ajei S. Gopal Ph.D.,Software - Application,346.63,USD,30474357743,https://images.financialmodelingprep.com/symbol/ANSS.png,612754,51.51,3.11,660590,908559000,575692000,"[{'period': '2024', 'revenue': 2540.0, 'unit': 'M', 'net_profit': 575.69}, {'period': '2023', 'revenue': 2270.0, 'unit': 'M', 'net_profit': 500.41}, {'period': '2022', 'revenue': 2070.0, 'unit': 'M', 'net_profit': 523.71}, {'period': '2021', 'revenue': 1910.0, 'unit': 'M', 'net_profit': 454.63}]","[{'period': ""Q1 '25"", 'revenue': 504.89, 'unit': 'M', 'net_profit': 51.87}, {'period': ""Q4 '24"", 'revenue': 882.17, 'unit': 'M', 'net_profit': 282.69}, {'period': ""Q3 '24"", 'revenue': 601.89, 'unit': 'M', 'net_profit': 128.19}, {'period': ""Q2 '24"", 'revenue': 594.14, 'unit': 'M', 'net_profit': 130.03}, {'period': ""Q1 '24"", 'revenue': 466.61, 'unit': 'M', 'net_profit': 34.78}, {'period': ""Q4 '23"", 'revenue': 805.11, 'unit': 'M', 'net_profit': 274.76}]",6.59,6.55,8051431000,2831493000,1497517000,1964991000,1275210000,785000,941184000,1446743000,751695000,0.19761704842487665,0.15043604070246117,0.14409722222222224,__nan__,__nan__,__nan__,0.2440548767045262
263,ANTE,AirNet Technology Inc. American Depositary Shares,"AirNet Technology Inc. operates out-of-home advertising platforms in the People's Republic of China. It operates through two segments, Cryptocurrency Mining and Air Travel Media Network. The company provides in-flight solutions to connectivity, entertainment, and digital multimedia; and in-flight entertainment and advertising contents, such as sports, comedies, local attractions, reality shows, commentaries, documentaries. It also offers advertising time slots in the form of digital TV screens on airplanes; and media contents display in air travel. In addition, the company operates CIBN-AirNet channel to broadcast network TV programs to air travelers. Further, it engages in cryptocurrency mining business. The company was formerly known as AirMedia Group Inc. AirNet Technology Inc. was founded in 2005 and is headquartered in Beijing, the People's Republic of China.",Ms. Dan  Shao,Telecommunications Services,0.7496,USD,10743753,https://images.financialmodelingprep.com/symbol/ANTE.png,2680004,-0.79,-0.0703,32910,-10483000,-13651000,"[{'period': '2024', 'revenue': 0.343, 'unit': 'M', 'net_profit': -13.65}, {'period': '2023', 'revenue': 845.0, 'unit': 'K', 'net_profit': -574.0}, {'period': '2022', 'revenue': 2.87, 'unit': 'M', 'net_profit': -12.31}, {'period': '2021', 'revenue': 11.68, 'unit': 'M', 'net_profit': -17.79}]","[{'period': ""Q2 '24"", 'revenue': 0.193, 'unit': 'M', 'net_profit': 19.89}, {'period': ""Q4 '23"", 'revenue': 0.31362, 'unit': 'M', 'net_profit': 3.75}, {'period': ""Q2 '23"", 'revenue': 0.538, 'unit': 'M', 'net_profit': -3.92}, {'period': ""Q4 '22"", 'revenue': 0.39405, 'unit': 'M', 'net_profit': -12.0}, {'period': ""Q2 '22"", 'revenue': 2.49, 'unit': 'M', 'net_profit': -1.76}, {'period': ""Q4 '21"", 'revenue': 2.9, 'unit': 'M', 'net_profit': -10.84}]",-1.7,-1.7,60220000,25955000,356000,82226000,23011000,0,78595000,113000,-1557000,-8.377199155524279,-22.782229965156795,1,__nan__,__nan__,__nan__,1.3654267685154433
264,ANY,Sphere 3D Corp. Common Shares,"Sphere 3D Corp. focuses on operating as a carbon neutral bitcoin mining company. It also provides data management solutions through hybrid cloud, cloud, and on-premises implementations directly and through its reseller network and professional services organization. Its products portfolio includes HVE-STACK high density server, which provides computer and storage appliance for the data centers; HVE-VELOCITY, a high availability dual enclosure storage area network that offers reliability and integrity for optimal data storage, protection, and recovery; HVE 3DGFX, a virtual desktop infrastructure solution; HVE STAGE, a server virtualization platform; and HVE VAULT, an appliance designed to handle requirements for backup and replication storage. In addition, it offers self-service and support services. Sphere 3D Corp. is based in Toronto, Canada.",Mr. Kurt L. Kalbfleisch,Software - Application,0.838,USD,22171720,https://images.financialmodelingprep.com/symbol/ANY.png,348535,-1.75,0.0569,629197,-2207000,-9470000,"[{'period': '2024', 'revenue': 16.61, 'unit': 'M', 'net_profit': -9.47}, {'period': '2023', 'revenue': 21.91, 'unit': 'M', 'net_profit': -23.41}, {'period': '2022', 'revenue': 6.08, 'unit': 'M', 'net_profit': -192.91}, {'period': '2021', 'revenue': 3.72, 'unit': 'M', 'net_profit': -17.29}]","[{'period': ""Q1 '25"", 'revenue': 0.0, 'unit': 'M', 'net_profit': -8.79}, {'period': ""Q4 '24"", 'revenue': 2.64, 'unit': 'M', 'net_profit': -7.22}, {'period': ""Q3 '24"", 'revenue': 2350.0, 'unit': 'K', 'net_profit': 104.0}, {'period': ""Q2 '24"", 'revenue': 4.67, 'unit': 'M', 'net_profit': 2.12}, {'period': ""Q1 '24"", 'revenue': 6.95, 'unit': 'M', 'net_profit': -4.48}, {'period': ""Q4 '23"", 'revenue': 7.69, 'unit': 'M', 'net_profit': -8.77}]",-0.48,-0.48,43228000,17787000,12955000,3913000,0,0,3895000,5425000,-13520000,0.8615780230807827,0.5954028881483381,0.7512953367875648,__nan__,__nan__,__nan__,0.0905200333117424
265,ANZU,Anzu Special Acquisition Corp I Class A Common Stock,"Anzu Special Acquisition Corp I does not have significant operations. The company focuses on effecting a merger, capital stock exchange, asset acquisition, stock purchase, reorganization, or related business combination with one or more businesses. It intends to identify business opportunities in the field of industrial applications. The company was incorporated in 2020 and is based in Tampa, Florida.",Dr. Whitney Patrick Haring-Smith,Shell Companies,6.86,USD,102473308,https://images.financialmodelingprep.com/symbol/ANZU.png,35220,114.33333333333333,1.22,157285,-19806000,-20795000,"[{'period': '2024', 'revenue': 0.225, 'unit': 'M', 'net_profit': -20.8}, {'period': '2023', 'revenue': 0.316, 'unit': 'M', 'net_profit': -29.91}, {'period': '2022', 'revenue': 0.23700000000000002, 'unit': 'M', 'net_profit': -15.92}, {'period': '2021', 'revenue': 0.31, 'unit': 'M', 'net_profit': -8.68}]","[{'period': ""Q1 '25"", 'revenue': 0.046, 'unit': 'M', 'net_profit': -5.0}, {'period': ""Q4 '24"", 'revenue': 0.042, 'unit': 'M', 'net_profit': -4.62}, {'period': ""Q3 '24"", 'revenue': 0.056, 'unit': 'M', 'net_profit': -5.96}, {'period': ""Q2 '24"", 'revenue': 0.068, 'unit': 'M', 'net_profit': -3.95}, {'period': ""Q1 '24"", 'revenue': 0.059000000000000004, 'unit': 'M', 'net_profit': -6.27}, {'period': ""Q4 '23"", 'revenue': 0.095, 'unit': 'M', 'net_profit': -4.88}]",-1.49,-1.49,11538000,9384000,5483000,30380000,818000,0,7538000,5483000,-18929000,-0.08597433929158899,0.30470108332218804,0.3739495798319327,__nan__,__nan__,__nan__,2.6330386548795284
266,ANZUU,Anzu Special Acquisition Corp I Units,"Anzu Special Acquisition Corp I does not have significant operations. The company focuses on effecting a merger, capital stock exchange, asset acquisition, stock purchase, reorganization, or related business combination with one or more businesses. It intends to identify business opportunities in the field of industrial applications. The company was incorporated in 2020 and is based in Tampa, Florida.",Dr. Whitney Patrick Haring-Smith,Shell Companies,7.09,USD,104595615,https://images.financialmodelingprep.com/symbol/ANZUU.png,741,27.587548638132297,0.49,3436,-19806000,-20795000,"[{'period': '2024', 'revenue': 0.225, 'unit': 'M', 'net_profit': -20.8}, {'period': '2023', 'revenue': 0.316, 'unit': 'M', 'net_profit': -29.91}, {'period': '2022', 'revenue': 0.23700000000000002, 'unit': 'M', 'net_profit': -15.92}, {'period': '2021', 'revenue': 0.31, 'unit': 'M', 'net_profit': -8.68}]","[{'period': ""Q1 '25"", 'revenue': 0.046, 'unit': 'M', 'net_profit': -5.0}, {'period': ""Q4 '24"", 'revenue': 0.042, 'unit': 'M', 'net_profit': -4.62}, {'period': ""Q3 '24"", 'revenue': 0.056, 'unit': 'M', 'net_profit': -5.96}, {'period': ""Q2 '24"", 'revenue': 0.068, 'unit': 'M', 'net_profit': -3.95}, {'period': ""Q1 '24"", 'revenue': 0.059000000000000004, 'unit': 'M', 'net_profit': -6.27}, {'period': ""Q4 '23"", 'revenue': 0.095, 'unit': 'M', 'net_profit': -4.88}]",-1.49,-1.49,11538000,9384000,5483000,30380000,818000,0,7538000,5483000,-18929000,-0.08597433929158899,0.30470108332218804,0.3739495798319327,__nan__,__nan__,__nan__,2.6330386548795284
267,ANZUW,Anzu Special Acquisition Corp I Warrant,"Anzu Special Acquisition Corp I is a blank check company. The company was incorporated in 2020 and is based in Tampa, Florida.",Dr. Whitney Patrick Haring-Smith,Shell Companies,0.085,USD,0,https://images.financialmodelingprep.com/symbol/ANZUW.png,0,0,-0.035,16473,-19806000,-20795000,"[{'period': '2024', 'revenue': 0.225, 'unit': 'M', 'net_profit': -20.8}, {'period': '2023', 'revenue': 0.316, 'unit': 'M', 'net_profit': -29.91}, {'period': '2022', 'revenue': 0.23700000000000002, 'unit': 'M', 'net_profit': -15.92}, {'period': '2021', 'revenue': 0.31, 'unit': 'M', 'net_profit': -8.68}]","[{'period': ""Q1 '25"", 'revenue': 0.046, 'unit': 'M', 'net_profit': -5.0}, {'period': ""Q4 '24"", 'revenue': 0.042, 'unit': 'M', 'net_profit': -4.62}, {'period': ""Q3 '24"", 'revenue': 0.056, 'unit': 'M', 'net_profit': -5.96}, {'period': ""Q2 '24"", 'revenue': 0.068, 'unit': 'M', 'net_profit': -3.95}, {'period': ""Q1 '24"", 'revenue': 0.059000000000000004, 'unit': 'M', 'net_profit': -6.27}, {'period': ""Q4 '23"", 'revenue': 0.095, 'unit': 'M', 'net_profit': -4.88}]",-1.49,-1.49,11538000,9384000,5483000,30380000,818000,0,7538000,5483000,-18929000,-0.08597433929158899,0.30470108332218804,0.3739495798319327,__nan__,__nan__,__nan__,2.6330386548795284
268,AOSL,Alpha and Omega Semiconductor Limited Common Shares,"Alpha and Omega Semiconductor Limited designs, develops, and supplies power semiconductor products for computing, consumer electronics, communication, and industrial applications in Hong Kong, China, South Korea, the United States, and internationally. It offers power discrete products, including metal-oxide-semiconductor field-effect transistors (MOSFET), SRFETs, XSFET, electrostatic discharge, protected MOSFETs, high and mid-voltage MOSFETs, and insulated gate bipolar transistors for use in smart phone chargers, battery packs, notebooks, desktop and servers, data centers, base stations, graphics card, game boxes, TVs, AC adapters, power supplies, motor control, power tools, e-vehicles, white goods and industrial motor drives, UPS systems, solar inverters, and industrial welding. The company also provides power ICs that deliver power, as well as control and regulate the power management variables, such as the flow of current and level of voltage. Its power ICs are used in flat panel displays, TVs, Notebooks, graphic cards, servers, DVD/Blu-Ray players, set-top boxes, and networking equipment. In addition, the company offers aMOS5 MOSFET for quick charger, adapter, PC power, server, industrial power, telecom, and datacenter applications; and Transient Voltage Suppressors for laptops, televisions, and other electronic devices. Further, it provides EZBuck regulators; SOA MOSFET for hot swap applications; RigidCSP for battery management; and Type-C power delivery protection switches. The company was incorporated in 2000 and is headquartered in Sunnyvale, California.",Mr. Stephen Chunping Chang,Semiconductors,23.14,USD,688646400,https://images.financialmodelingprep.com/symbol/AOSL.png,544538,-30.05,-0.32,259827,50001000,-11081000,"[{'period': '2024', 'revenue': 657.27, 'unit': 'M', 'net_profit': -11.08}, {'period': '2023', 'revenue': 691.32, 'unit': 'M', 'net_profit': 12.36}, {'period': '2022', 'revenue': 777.55, 'unit': 'M', 'net_profit': 453.16}, {'period': '2021', 'revenue': 656.9, 'unit': 'M', 'net_profit': 58.12}]","[{'period': ""Q3 '25"", 'revenue': 164.63, 'unit': 'M', 'net_profit': -10.81}, {'period': ""Q2 '25"", 'revenue': 173.16, 'unit': 'M', 'net_profit': -6.61}, {'period': ""Q1 '25"", 'revenue': 181.89, 'unit': 'M', 'net_profit': -2.5}, {'period': ""Q4 '24"", 'revenue': 161.3, 'unit': 'M', 'net_profit': -2.73}, {'period': ""Q3 '24"", 'revenue': 150.06, 'unit': 'M', 'net_profit': -11.21}, {'period': ""Q2 '24"", 'revenue': 165.28, 'unit': 'M', 'net_profit': -2.92}]",-0.39,-0.39,1145013000,398001000,175127000,253406000,15951000,356139000,154233000,175127000,-11378000,-0.23936655713764146,-1.8962309932060821,-1.8666666666666667,__nan__,__nan__,__nan__,0.2213127711213759
269,AOUT,American Outdoor Brands Inc. Common Stock ,"American Outdoor Brands, Inc. provides outdoor products and accessories for rugged outdoor enthusiasts in the United States and internationally. It offers hunting, fishing, camping, shooting, and personal security and defense products. The company also provides shooting sports accessories products include rests, vaults, and other related accessories; outdoor lifestyle products, such as premium sportsmen knives and tools for fishing and hunting; land management tools for hunting preparedness; harvesting products for post-hunt or post-fishing activities; outdoor cooking products; and camping, survival, and emergency preparedness products. In addition, it offers electro-optical devices, including hunting optics, firearm aiming devices, flashlights, and laser grips; and reloading, gunsmithing, and firearm cleaning supplies. The company sells its products through e-commerce and traditional distribution channels under the Adventurer, Harvester, Marksman, and Defender brand lanes. American Outdoor Brands, Inc. was incorporated in 2020 and is headquartered in Columbia, Missouri.",Mr. Brian Daniel Murphy,Leisure,12.66,USD,161222568,https://images.financialmodelingprep.com/symbol/AOUT.png,57462,-37.24,-0.05,24394,3604000,-12248000,"[{'period': '2024', 'revenue': 201.1, 'unit': 'M', 'net_profit': -12.25}, {'period': '2023', 'revenue': 191.21, 'unit': 'M', 'net_profit': -12.02}, {'period': '2022', 'revenue': 247.53, 'unit': 'M', 'net_profit': -64.88}, {'period': '2021', 'revenue': 276.69, 'unit': 'M', 'net_profit': 18.41}]","[{'period': ""Q3 '25"", 'revenue': 58510.0, 'unit': 'K', 'net_profit': 169.0}, {'period': ""Q2 '25"", 'revenue': 60.23, 'unit': 'M', 'net_profit': 3.11}, {'period': ""Q1 '25"", 'revenue': 41.64, 'unit': 'M', 'net_profit': -2.37}, {'period': ""Q4 '24"", 'revenue': 46.3, 'unit': 'M', 'net_profit': -5.3}, {'period': ""Q3 '24"", 'revenue': 53.42, 'unit': 'M', 'net_profit': -2.91}, {'period': ""Q2 '24"", 'revenue': 57930.0, 'unit': 'K', 'net_profit': 77.0}]",-0.94,-0.94,240597000,155374000,29698000,62672000,25951000,0,29383000,29698000,18384000,-0.27905581116223244,-0.018629407850964737,-0.04444444444444436,__nan__,__nan__,__nan__,0.26048537596063126
270,APA,APA Corporation Common Stock,"APA Corporation, through its subsidiaries, explores for, develops, and produces oil and gas properties. It has operations in the United States, Egypt, and the United Kingdom, as well as has exploration activities offshore Suriname. The company also operates gathering, processing, and transmission assets in West Texas, as well as holds ownership in four Permian-to-Gulf Coast pipelines. APA Corporation was founded in 1954 and is based in Houston, Texas.",Mr. John J. Christmann IV,Oil & Gas Exploration & Production,17.59,USD,6347263550,https://images.financialmodelingprep.com/symbol/APA.png,9657795,6.3,-0.17,5699095,4223000000,804000000,"[{'period': '2024', 'revenue': 9740.0, 'unit': 'M', 'net_profit': 804.0}, {'period': '2023', 'revenue': 8.28, 'unit': 'B', 'net_profit': 2.85}, {'period': '2022', 'revenue': 11.07, 'unit': 'B', 'net_profit': 3.67}, {'period': '2021', 'revenue': 7990.0, 'unit': 'M', 'net_profit': 973.0}]","[{'period': ""Q1 '25"", 'revenue': 2640.0, 'unit': 'M', 'net_profit': 347.0}, {'period': ""Q4 '24"", 'revenue': 2710.0, 'unit': 'M', 'net_profit': 354.0}, {'period': ""Q3 '24"", 'revenue': 2530.0, 'unit': 'M', 'net_profit': -223.0}, {'period': ""Q2 '24"", 'revenue': 2540.0, 'unit': 'M', 'net_profit': 541.0}, {'period': ""Q1 '24"", 'revenue': 1950.0, 'unit': 'M', 'net_profit': 132.0}, {'period': ""Q4 '23"", 'revenue': 2.17, 'unit': 'B', 'net_profit': 1.77}]",2.28,2.28,19390000000,3404000000,625000000,13028000000,1959000000,0,2955000000,625000000,769000000,-0.11094736842105263,-0.7183887915936953,-0.7540453074433657,"[0.25, 0.06]","['2025-04-22', '1982-03-25']",__nan__,0.6718927282104178
271,APDN,Applied DNA Sciences Inc. Common Stock,"Applied DNA Sciences, Inc. develops and markets DNA-based technology solutions for use in the nucleic acid-based in vitro diagnostics and preclinical nucleic-acid based drug development and manufacturing markets; and for supply chain security, anti-counterfeiting, and anti-theft technology purposes. The company's supply chain security and product authentication solutions include SigNature molecular tags that provide forensic power and protection for various applications used to fortify brand protection efforts and strengthen supply chain security, as well as mark, track, and convict criminals; SigNify IF portable DNA readers and SigNify consumable reagent test kits that provide real-time authentication of molecular tags in the field; and CertainT, which indicates the use of tagging, testing, and tracking platforms and solutions enabling manufacturers, brands, and trade organizations to convey proof of their product claims. It also manufactures and sells COVID-19 PCR-based molecular diagnostic test kit under the LineaTM COVID-19 Assay Kit trademark; and COVID-19 diagnostic test kit to prevent virus spread within a community, school, or workplace under the safeCircle trademark. In addition, the company provides preclinical contract research and manufacturing services for the nucleic acid-based therapeutic markets; and contract research services to RNA based drug and biologic customers for preclinical studies. Further, it develops an invasive circulating tumor cell capture and identification technology that uses a patented functional assay to capture live invasive circulating tumor cell and associated lymphocytes. The company operates in the United States, Europe, Asia, and internationally. The company was formerly known as Datalink Systems, Inc. and changed its name to Applied DNA Sciences, Inc. in 2002. Applied DNA Sciences, Inc. was founded in 1983 and is headquartered in Stony Brook, New York.","Dr. James A. Hayward Ph.D., Sc.D.",Medical - Diagnostics & Research,0.67,USD,4353519,https://images.financialmodelingprep.com/symbol/APDN.png,1304961,-0.02,-0.14,1258590,-13328340,-6992521,"[{'period': '2024', 'revenue': 3.43, 'unit': 'M', 'net_profit': -6.99}, {'period': '2023', 'revenue': 13.37, 'unit': 'M', 'net_profit': -9.95}, {'period': '2022', 'revenue': 18.17, 'unit': 'M', 'net_profit': -8.38}, {'period': '2021', 'revenue': 9.03, 'unit': 'M', 'net_profit': -16.03}]","[{'period': ""Q2 '25"", 'revenue': 0.9833700000000001, 'unit': 'M', 'net_profit': -27.22}, {'period': ""Q1 '25"", 'revenue': 1.2, 'unit': 'M', 'net_profit': -2.64}, {'period': ""Q4 '24"", 'revenue': 0.81311, 'unit': 'M', 'net_profit': -3.3}, {'period': ""Q3 '24"", 'revenue': 0.79752, 'unit': 'M', 'net_profit': 1.88}, {'period': ""Q2 '24"", 'revenue': 0.9296300000000001, 'unit': 'M', 'net_profit': -4.47}, {'period': ""Q1 '24"", 'revenue': 0.89116, 'unit': 'M', 'net_profit': -1.18}]",-1.82,-1.82,12789040,8047670,6431095,3820955,362013,0,2398124,6431095,-14119301,-0.3896656264945588,0.29702628686529353,0.8803418803418803,__nan__,__nan__,__nan__,0.2987679294145612
272,APEI,American Public Education Inc. Common Stock,"American Public Education, Inc., together with its subsidiaries, provides online and campus-based postsecondary education. The company operates through three segments: American Public University System, Rasmussen University, and Hondros College of Nursing. It offers 130 degree programs and 111 certificate programs in various fields of study, including business administration, health science, technology, criminal justice, education, and liberal arts, as well as national security, military studies, intelligence, and homeland security. The company also provides nursing-and health sciences-focused postsecondary education, diploma in practical nursing, an associate degree in nursing, and an associate degree in medical laboratory technology. American Public Education, Inc. was incorporated in 1991 and is headquartered in Charles Town, West Virginia.",Ms. Angela K. Selden,Education & Training Services,27.85,USD,502405645,https://images.financialmodelingprep.com/symbol/APEI.png,143167,50.64,0.05,442341,52369000,16113000,"[{'period': '2024', 'revenue': 624.56, 'unit': 'M', 'net_profit': 16.11}, {'period': '2023', 'revenue': 600.54, 'unit': 'M', 'net_profit': -47.29}, {'period': '2022', 'revenue': 606.33, 'unit': 'M', 'net_profit': -114.97}, {'period': '2021', 'revenue': 418.8, 'unit': 'M', 'net_profit': 17.75}]","[{'period': ""Q1 '25"", 'revenue': 164.55, 'unit': 'M', 'net_profit': 8.89}, {'period': ""Q4 '24"", 'revenue': 164.11, 'unit': 'M', 'net_profit': 12.96}, {'period': ""Q3 '24"", 'revenue': 153.12, 'unit': 'M', 'net_profit': 2.26}, {'period': ""Q2 '24"", 'revenue': 152900.0, 'unit': 'K', 'net_profit': 371.0}, {'period': ""Q1 '24"", 'revenue': 154430.0, 'unit': 'K', 'net_profit': 516.0}, {'period': ""Q4 '23"", 'revenue': 152.8, 'unit': 'M', 'net_profit': 13.01}]",0.57,0.55,570103000,260572000,158941000,266224000,63414000,0,79155000,158941000,27790000,3.555832113225964,1.3407562492069534,1.193877551020408,__nan__,__nan__,__nan__,0.4669752658730089
