,symbol,name,description__profile,ceo__profile,industry__profile,price__profile,currency__profile,mktCap__profile,image__profile,volAvg__profile,pe__quote,change__quote,volume__quote,ebitda__income_statement,netIncome__income_statement,annual_earnings,quaterly_earnings,eps__income_statement,epsdiluted__income_statement,totalAssets__balance_sheet_statement,totalCurrentAssets__balance_sheet_statement,cashAndShortTermInvestments__balance_sheet_statement,totalLiabilities__balance_sheet_statement,netReceivables__balance_sheet_statement,longTermInvestments__balance_sheet_statement,totalCurrentLiabilities__balance_sheet_statement,cashAndCashEquivalents__balance_sheet_statement,freeCashFlow__cash_flow_statement,growthEBITDA__income_statement_growth,growthNetIncome__income_statement_growth,growthEPS__income_statement_growth,dividend__historical-price-full/stock_dividend,date__historical-price-full/stock_dividend,derived__netIncomeMargin,derived__debtRatio
47,FDX,FedEx Corporation Common Stock,"FedEx Corporation provides transportation, e-commerce, and business services in the United States and internationally. The company's FedEx Express segment offers express transportation, small-package ground delivery, and freight transportation services; time-critical transportation services; and cross-border enablement, technology, and e-commerce transportation solutions. Its FedEx Ground segment provides day-certain delivery services to businesses and residences. The company's FedEx Freight segment offers less-than-truckload freight transportation services. As of May 31, 2022, this segment had approximately 30,000 vehicles and 400 service centers. Its FedEx Services segment provides sales, marketing, information technology, communications, customer service, technical support, billing and collection, and back-office support services. The company's Corporate, Other and Eliminations segment offers integrated supply chain management solutions, specialty transportation, customs brokerage, and global ocean and air freight forwarding services; and document and business services, as well as retail access to its customers for its package transportation businesses. FedEx Corporation was founded in 1971 and is based in Memphis, Tennessee.",Mr. Rajesh  Subramaniam,Integrated Freight & Logistics,231.15,USD,55383308850,https://images.financialmodelingprep.com/symbol/FDX.png,1947430,14.55,-1.8,2189901,10868000000,4331000000,"[{'period': '2024', 'revenue': 87.69, 'unit': 'B', 'net_profit': 4.33}, {'period': '2023', 'revenue': 90.16, 'unit': 'B', 'net_profit': 3.97}, {'period': '2022', 'revenue': 93.51, 'unit': 'B', 'net_profit': 3.83}, {'period': '2021', 'revenue': 83.96, 'unit': 'B', 'net_profit': 5.23}]","[{'period': ""Q3 '25"", 'revenue': 22160.0, 'unit': 'M', 'net_profit': 909.0}, {'period': ""Q2 '25"", 'revenue': 21970.0, 'unit': 'M', 'net_profit': 741.0}, {'period': ""Q1 '25"", 'revenue': 21580.0, 'unit': 'M', 'net_profit': 794.0}, {'period': ""Q4 '24"", 'revenue': 22.11, 'unit': 'B', 'net_profit': 1.47}, {'period': ""Q3 '24"", 'revenue': 21740.0, 'unit': 'M', 'net_profit': 879.0}, {'period': ""Q2 '24"", 'revenue': 22160.0, 'unit': 'M', 'net_profit': 900.0}]",17.44,17.21,87007000000,18207000000,6501000000,59425000000,10087000000,0,13355000000,6501000000,3136000000,0.024992926530227295,0.09038267875125881,0.11723254324151197,"[1.38, 0.05]","['2025-03-10', '2002-06-13']",__nan__,0.682991023710736
48,FE,FirstEnergy Corp. Common Stock,"FirstEnergy Corp., through its subsidiaries, generates, transmits, and distributes electricity in the United States. It operates through Regulated Distribution and Regulated Transmission segments. The company owns and operates coal-fired, nuclear, hydroelectric, natural gas, wind, and solar power generating facilities. It operates 24,074 circuit miles of overhead and underground transmission lines; and electric distribution systems, including 273,295 miles of overhead pole line and underground conduit carrying primary, secondary, and street lighting circuits. The company serves approximately 6 million customers in Ohio, Pennsylvania, West Virginia, Maryland, New Jersey, and New York. FirstEnergy Corp. was incorporated in 1996 and is headquartered in Akron, Ohio.",Mr. Brian X. Tierney,Regulated Electric,41.23,USD,23796141880,https://images.financialmodelingprep.com/symbol/FE.png,6088548,21.93,-0.49,4435461,4103000000,978000000,"[{'period': '2024', 'revenue': 13470.0, 'unit': 'M', 'net_profit': 978.0}, {'period': '2023', 'revenue': 12.87, 'unit': 'B', 'net_profit': 1.1}, {'period': '2022', 'revenue': 12460.0, 'unit': 'M', 'net_profit': 406.0}, {'period': '2021', 'revenue': 11.13, 'unit': 'B', 'net_profit': 1.28}]","[{'period': ""Q1 '25"", 'revenue': 3770.0, 'unit': 'M', 'net_profit': 360.0}, {'period': ""Q4 '24"", 'revenue': 3180.0, 'unit': 'M', 'net_profit': 261.0}, {'period': ""Q3 '24"", 'revenue': 3730.0, 'unit': 'M', 'net_profit': 419.0}, {'period': ""Q2 '24"", 'revenue': 3280.0, 'unit': 'M', 'net_profit': 45.0}, {'period': ""Q1 '24"", 'revenue': 3290.0, 'unit': 'M', 'net_profit': 253.0}, {'period': ""Q4 '23"", 'revenue': 3150.0, 'unit': 'M', 'net_profit': 175.0}]",1.7,1.7,52044000000,2776000000,111000000,38324000000,1833000000,652000000,4997000000,111000000,-1139000000,0.10029498525073746,-0.11252268602540835,-0.11458333333333333,"[0.445, 0.125]","['2025-05-07', '1998-02-04']",__nan__,0.7363769118438245
49,FEDU,Four Seasons Education (Cayman) Inc. American Depositary Shares each two ADSs representing one ordinary share,"Four Seasons Education (Cayman) Inc. provides after-school education services for kindergarten, elementary, and middle school students in the People's Republic of China. It also offers consulting service. The company was founded in 2007 and is headquartered in Shanghai, the People's Republic of China.",Ms. Yi  Zuo,Education & Training Services,7.9787,USD,1688564,https://images.financialmodelingprep.com/symbol/FEDU.png,7785,79.79,0.0887,5017,-515000,4961000,"[{'period': '2024', 'revenue': 125.44, 'unit': 'M', 'net_profit': 4.96}, {'period': '2023', 'revenue': 34.22, 'unit': 'M', 'net_profit': -29.67}, {'period': '2022', 'revenue': 250.22, 'unit': 'M', 'net_profit': -113.46}, {'period': '2021', 'revenue': 280.28, 'unit': 'M', 'net_profit': -28.2}]","[{'period': ""Q2 '25"", 'revenue': 67.34, 'unit': 'M', 'net_profit': 1.04}, {'period': ""Q1 '25"", 'revenue': 67.34, 'unit': 'M', 'net_profit': 1.04}, {'period': ""Q4 '24"", 'revenue': 31810.0, 'unit': 'K', 'net_profit': -43.5}, {'period': ""Q3 '24"", 'revenue': 31810.0, 'unit': 'K', 'net_profit': -43.5}, {'period': ""Q2 '24"", 'revenue': 30.92, 'unit': 'M', 'net_profit': 2.52}, {'period': ""Q1 '24"", 'revenue': 30.92, 'unit': 'M', 'net_profit': 2.52}]",21,21,674160000,322579000,296040000,148016000,3249000,130817000,106819000,180198000,-40060000,0.983943380430984,1.167228477044428,1.1503221188260557,"[2.28, 0.42]","['2024-08-30', '2018-01-31']",__nan__,0.2195561884419129
50,FEI           ,First Trust MLP and Energy Income Fund Common Shares of Beneficial Interest,,,,,,,,,16.948275862068964,0.02,99885,,,[],[],,,,,,,,,,,,,,,__nan__,__nan__,__nan__,__nan__
51,FENG,Phoenix New Media Limited American Depositary Shares each representing 8 Class A ordinary shares.,"Phoenix New Media Limited provides content on an integrated Internet platform in the People's Republic of China. The company operates through two segments, Net Advertising Services and Paid Services. It offers content and services through PC channel, mobile channel, and telecom operators, as well as transmits content to TV viewers, primarily through Phoenix TV. The company, through its website, ifeng.com, provides various interest-based content verticals, such as news, finance, video, automobiles, technology, entertainment, military, real estate, fashion, and sport; and offers interactive services, including comments posting and user surveys. Its mobile channel consists of ifeng News, a news application that provides newsfeeds and other contents in the form of text, image, live streaming, and video; ifeng Video, a video application, which offers video news, live broadcasting, Phoenix TV programs content, etc.; i.ifeng.com mobile Internet website; and digital reading applications. In addition, Phoenix New Media Limited offers mobile newspaper, mobile video, and mobile game services, as well as wireless value-added services. The company was incorporated in 2007 and is headquartered in Beijing, the People's Republic of China. Phoenix New Media Limited is a subsidiary of Phoenix Satellite Television (B.V.I.) Holding Limited.",Mr. Yusheng  Sun,Internet Content & Information,2.26,USD,254241,https://images.financialmodelingprep.com/symbol/FENG.png,22286,-3.83,-0.03,21210,-43190000,-53554000,"[{'period': '2024', 'revenue': 703.7, 'unit': 'M', 'net_profit': -53.55}, {'period': '2023', 'revenue': 692.02, 'unit': 'M', 'net_profit': -102.5}, {'period': '2022', 'revenue': 785.71, 'unit': 'M', 'net_profit': -125.72}, {'period': '2021', 'revenue': 1030.0, 'unit': 'M', 'net_profit': -273.07}]","[{'period': ""Q4 '24"", 'revenue': 218.11, 'unit': 'M', 'net_profit': -3.59}, {'period': ""Q3 '24"", 'revenue': 164.28, 'unit': 'M', 'net_profit': -18.49}, {'period': ""Q2 '24"", 'revenue': 168.32, 'unit': 'M', 'net_profit': -5.46}, {'period': ""Q1 '24"", 'revenue': 152.99, 'unit': 'M', 'net_profit': -26.01}, {'period': ""Q4 '23"", 'revenue': 211.84, 'unit': 'M', 'net_profit': 8.12}, {'period': ""Q3 '23"", 'revenue': 153.61, 'unit': 'M', 'net_profit': -21.5}]",-214.08,-214.08,1711927000,1474352000,1035922000,598517000,403199000,85749000,537320000,607579000,-49524000,0.48047730170568,0.47750156103652824,-23.77777777777778,"[0.2285, 0.2285]","['2020-12-23', '2020-12-03']",__nan__,0.3496159590917136
52,FEO,First Trust/Aberdeen Emerging Opportunity Fund Common Shares of Beneficial Interest,"First Trust-abrdn Emerging Opportunity Fund is a closed-ended balanced mutual fund launched and managed by First Trust Advisors L.P. It is co-managed by Aberdeen Asset Management Inc. The fund invests in public equity and fixed income markets of global emerging countries. It seeks to invest in the stocks of companies operating across the diversified sectors. For its fixed income component, the fund invests in government debt securities, corporate bonds, non investment-grade securities, asset-backed securities, credit-linked notes, and credit default swaps. It employs fundamental analysis to create its portfolio. The fund benchmarks the performance of its portfolio against the Barclays Capital Global Emerging Markets Index, FTSE All World Emerging Market Index, and a blended index composed of JPMorgan Emerging Markets Bond Index - Global Diversified (32.5%); JPMorgan Government Bond Index - Emerging Markets (32.5%); MSCI Global Emerging Markets Index (35.0%). First Trust-abrdn Emerging Opportunity Fund was formed on August 28, 2006 and is domiciled in the United States.",Mr. Mark Bradley,Asset Management,9.58,USD,47821444,https://images.financialmodelingprep.com/symbol/FEO.png,0,-11.418355184743742,0.0297,150253,-4188763,-4188763,"[{'period': '2021', 'revenue': -3.94, 'unit': 'M', 'net_profit': -4.19}, {'period': '2020', 'revenue': 9.49, 'unit': 'M', 'net_profit': 8.96}, {'period': '2019', 'revenue': 14.04, 'unit': 'M', 'net_profit': 13.53}, {'period': '2018', 'revenue': -10.35, 'unit': 'M', 'net_profit': -10.86}]",[],-0.83,-0.83,75593801,1979867,807744,6177102,1172123,73613372,30016,807744,6880428,-1.4676580894354871,-1.4676580894354871,-1.4585635359116023,"[0.25, 0.22409]","['2022-09-22', '2009-03-19']",__nan__,0.08171439877722249
53,FERG,Ferguson plc Ordinary Shares,"Ferguson plc distributes plumbing and heating products in the United States and Canada. It offers plumbing and heating solutions to customers in the residential, commercial, civil/infrastructure, and industrial end markets. The company also distributes pipes, valves, fittings, plumbing supplies, water heaters, kitchen and bathroom fixtures, and appliances; heating, ventilation, air conditioning, and refrigeration products and supplies; and plumbing parts and supplies, fire sprinkler systems, hangers, struts, and fasteners. In addition, it distributes water meters and automation products, irrigation and drainage products, geosynthetics, and stormwater management products; flanges, general industrial maintenance repair and operations products, high density polyethylene products, and fabrication products; water and wastewater treatment products; and PVF solutions. Further, the company offers services, including consultation, advice and project management, pro pick-up, and delivery services; online tools; quotation, jobsite delivery and logistics, project management, and fabrication services; digitally enhanced estimation, and design services; advanced metering infrastructure services; and supply chain and equipment rental services. The company also sells its products through online channels. It operates a network of 1,679 branches and 11 distribution centers. Ferguson plc was founded in 1887 and is headquartered in Wokingham, the United Kingdom.",Mr. Kevin M. Murphy,Industrial - Distribution,177.01,USD,35171918862,https://images.financialmodelingprep.com/symbol/FERG.png,2109166,21.8,0.4,1009522,2978000000,1735000000,"[{'period': '2024', 'revenue': 29.64, 'unit': 'B', 'net_profit': 1.74}, {'period': '2023', 'revenue': 29.73, 'unit': 'B', 'net_profit': 1.89}, {'period': '2022', 'revenue': 28.57, 'unit': 'B', 'net_profit': 2.12}, {'period': '2021', 'revenue': 22.79, 'unit': 'B', 'net_profit': 1.47}]","[{'period': ""Q2 '25"", 'revenue': 6870.0, 'unit': 'M', 'net_profit': 276.0}, {'period': ""Q1 '25"", 'revenue': 7770.0, 'unit': 'M', 'net_profit': 470.0}, {'period': ""Q4 '24"", 'revenue': 7950.0, 'unit': 'M', 'net_profit': 451.0}, {'period': ""Q3 '24"", 'revenue': 7310.0, 'unit': 'M', 'net_profit': 443.0}, {'period': ""Q2 '24"", 'revenue': 6670.0, 'unit': 'M', 'net_profit': 322.0}, {'period': ""Q1 '24"", 'revenue': 7710.0, 'unit': 'M', 'net_profit': 519.0}]",8.55,8.53,16572000000,9410000000,571000000,10956000000,3602000000,0,5216000000,571000000,1501000000,-0.03842428156280271,-0.08152461619904712,-0.06557377049180324,"[0.83, 1.9988]","['2025-03-21', '2013-12-02']",__nan__,0.6611151339608979
54,FET,Forum Energy Technologies Inc. Common Stock,"Forum Energy Technologies, Inc. designs, manufactures, and distributes products serving the oil, natural gas, industrial, and renewable energy industries in the United States and internationally. It operates through three segments: Drilling & Downhole, Completions, and Production. The Drilling & Downhole segment designs, manufactures, and supplies products, and provides related services to the drilling, well construction, artificial lift, and subsea energy construction markets, including applications in oil and natural gas, renewable energy, defense, and communications. This segment offers drilling technologies consisting of capital equipment and a line of products consumed in the drilling process; well construction casing and cementing equipment, and protection products for artificial lift equipment and cables; and subsea remotely operated vehicles and trenchers, submarine rescue vehicles, specialty components and tools, and complementary subsea technical services. The Completions segment offers hydraulic fracturing pumps, cooling systems, high-pressure flexible hoses, and flow iron for pressure pumping, hydraulic fracturing and flowback services markets; wireline cable and pressure control equipment for well completion and intervention service markets; and coiled tubing strings and coiled line pipe. The Production segment designs, manufactures, and supplies products, and provides related equipment and services for production and infrastructure markets. This segment offers engineered process systems, production equipment, specialty separation equipment, and various industrial valves for oil and natural gas customers, power generation, renewable energy, and other general industrial applications. The company was formerly known as Forum Oilfield Technologies, Inc. and changed its name to Forum Energy Technologies, Inc. in August 2010. Forum Energy Technologies, Inc. was incorporated in 2005 and is headquartered in Houston, Texas.",Mr. Neal A. Lux,Oil & Gas Equipment & Services,16.4,USD,202861440,https://images.financialmodelingprep.com/symbol/FET.png,76731,-1.63,0.93,81016,-43219000,-135326000,"[{'period': '2024', 'revenue': 816.42, 'unit': 'M', 'net_profit': -135.33}, {'period': '2023', 'revenue': 738.86, 'unit': 'M', 'net_profit': -18.88}, {'period': '2022', 'revenue': 699.9, 'unit': 'M', 'net_profit': 3.71}, {'period': '2021', 'revenue': 541.1, 'unit': 'M', 'net_profit': -82.7}]","[{'period': ""Q1 '25"", 'revenue': 193.28, 'unit': 'M', 'net_profit': 1.1}, {'period': ""Q4 '24"", 'revenue': 201.0, 'unit': 'M', 'net_profit': -103.5}, {'period': ""Q3 '24"", 'revenue': 207.81, 'unit': 'M', 'net_profit': -14.81}, {'period': ""Q2 '24"", 'revenue': 205.21, 'unit': 'M', 'net_profit': -6.7}, {'period': ""Q1 '24"", 'revenue': 202.39, 'unit': 'M', 'net_profit': -10.31}, {'period': ""Q4 '23"", 'revenue': 185.2, 'unit': 'M', 'net_profit': -16.8}]",-11,-11,815954000,495637000,44661000,496054000,166310000,0,201856000,44661000,84046000,-1.9559399261241732,-6.169209578300487,-4.945945945945946,__nan__,__nan__,__nan__,0.6079435850550399
55,FF,FutureFuel Corp.  Common shares,"FutureFuel Corp., through its subsidiary, FutureFuel Chemical Company, manufactures and sells diversified chemical, bio-based fuel, and bio-based specialty chemical products in the United States. The company operates through two segments, Chemicals and Biofuels. The Chemicals segment provides various custom chemicals that are used in the agricultural chemical, coatings, chemical intermediates, industrial and consumer cleaning, oil and gas, and specialty polymers industries; and performance chemicals, such as polymer modifiers, glycerin products, and various specialty chemicals and solvents. The Biofuels segment is involved in the production and sale of biodiesel and petrodiesel blends; and the buying, sale, and shipping of refined petroleum products on common carrier pipelines. This segment markets its biodiesel products directly to customers through trucks, rail, and barges. FutureFuel Corp. is headquartered in Saint Louis, Missouri.",Mr. Roeland H. Polet,Chemicals,4.19,USD,183535408,https://images.financialmodelingprep.com/symbol/FF.png,330246,11.97,0.14,391268,25641000,15503000,"[{'period': '2024', 'revenue': 243.34, 'unit': 'M', 'net_profit': 15.5}, {'period': '2023', 'revenue': 368.25, 'unit': 'M', 'net_profit': 37.38}, {'period': '2022', 'revenue': 396.01, 'unit': 'M', 'net_profit': 15.21}, {'period': '2021', 'revenue': 321.39, 'unit': 'M', 'net_profit': 26.25}]","[{'period': ""Q1 '25"", 'revenue': 17.54, 'unit': 'M', 'net_profit': -17.64}, {'period': ""Q4 '24"", 'revenue': 61.51, 'unit': 'M', 'net_profit': 2.8}, {'period': ""Q3 '24"", 'revenue': 51.14, 'unit': 'M', 'net_profit': -1.2}, {'period': ""Q2 '24"", 'revenue': 72.41, 'unit': 'M', 'net_profit': 9.57}, {'period': ""Q1 '24"", 'revenue': 58.28, 'unit': 'M', 'net_profit': 4.33}, {'period': ""Q4 '23"", 'revenue': 92.01, 'unit': 'M', 'net_profit': 23.38}]",0.35,0.35,266382000,164786000,109541000,41870000,21949000,0,33307000,109541000,10134000,-0.46435062357684515,-0.5852816863731207,-0.5882352941176471,"[0.06, 0.1]","['2025-12-04', '2011-05-27']",__nan__,0.1571802899595318
56,FFA,First Trust Enhanced Equity Income Fund,"First Trust Enhanced Equity Income Fund is a closed-ended equity mutual fund launched and managed by First Trust Advisors L.P. The fund is co-managed by Chartwell Investment Partners, L.P. It invests in public equity markets of the United States. The fund seeks to invest in stocks of companies operating across the diversified sectors. It invests in stocks of companies across diversified market capitalizations. The fund also writes covered call options. It benchmarks the performance of its portfolio against the S&P 500 Index. The fund was formerly known as First Trust/Fiduciary Asset Management Covered Call Fund. First Trust Enhanced Equity Income Fund was formed on August 26, 2004 and is domiciled in the United States.","Mr. Timothy Joseph Riddle C.F.A., CFA",Asset Management - Income,19.66,USD,392966046,https://images.financialmodelingprep.com/symbol/FFA.png,41523,5.19,0.02,13499,75563701,75563248,"[{'period': '2024', 'revenue': 76.07, 'unit': 'M', 'net_profit': 75.56}, {'period': '2023', 'revenue': 7.06, 'unit': 'M', 'net_profit': 66.24}, {'period': '2022', 'revenue': -68.15, 'unit': 'M', 'net_profit': -68.64}, {'period': '2021', 'revenue': 87.46, 'unit': 'M', 'net_profit': 86.98}]","[{'period': ""Q4 '24"", 'revenue': 5.36, 'unit': 'M', 'net_profit': 28.91}, {'period': ""Q2 '24"", 'revenue': 27.58, 'unit': 'M', 'net_profit': 46.65}, {'period': ""Q4 '23"", 'revenue': 3.55, 'unit': 'M', 'net_profit': 23.71}, {'period': ""Q2 '23"", 'revenue': 3.5, 'unit': 'M', 'net_profit': 42.52}, {'period': ""Q4 '22"", 'revenue': 3.46, 'unit': 'M', 'net_profit': 9.61}, {'period': ""Q2 '22"", 'revenue': 3.59, 'unit': 'M', 'net_profit': -78.25}]",3.79,3.79,424657938,6612987,6612987,1809524,583641,417458592,0,6612987,0,0,0.1408269326247305,0.14501510574018125,"[0.35, 0.535]","['2025-03-24', '2004-12-20']",__nan__,0.004261133109914926
57,FFC,Flaherty & Crumrine Preferred and Income Securities Fund Incorporated,"Flaherty & Crumrine Preferred Securities Income Fund Inc. is a closed-ended balanced mutual fund launched and managed by Flaherty & Crumrine Incorporated. The fund invests in the public equity and fixed income markets of the United States. It seeks to invest in securities of companies operating across diversified sectors. The fund primarily invests in investment grade preferred securities consisting of hybrid or taxable preferreds. It employs quantitative analysis to create its portfolio. The fund benchmarks the performance of its portfolio against the Merrill Lynch 8% Capped DRD Preferred Stock Index, Merrill Lynch Hybrid Preferred Securities Index, and Merrill Lynch Adjustable Preferred Stock 7% Constrained Index. It was formerly known as Flaherty & Crumrine/Claymore Preferred Securities Income Fund Incorporated. Flaherty & Crumrine Preferred Securities Income Fund Inc. was formed on May 23, 2002 and is domiciled in the United States.",Mr. Donald Frasier Crumrine CFA,Asset Management - Income,15.66,USD,754465914,https://images.financialmodelingprep.com/symbol/FFC.png,118990,4.94,0.03,64587,184052894,152838394,"[{'period': '2024', 'revenue': 154.91, 'unit': 'M', 'net_profit': 152.84}, {'period': '2023', 'revenue': 85.52, 'unit': 'M', 'net_profit': 6.73}, {'period': '2022', 'revenue': -152.81, 'unit': 'M', 'net_profit': -154.63}, {'period': '2021', 'revenue': 75.24, 'unit': 'M', 'net_profit': 73.31}]","[{'period': ""Q4 '24"", 'revenue': 43.9, 'unit': 'M', 'net_profit': 71.56}, {'period': ""Q2 '24"", 'revenue': 44.16, 'unit': 'M', 'net_profit': 81.28}, {'period': ""Q4 '23"", 'revenue': 43.03, 'unit': 'M', 'net_profit': 46.48}, {'period': ""Q2 '23"", 'revenue': 42.49, 'unit': 'M', 'net_profit': -39.75}, {'period': ""Q4 '22"", 'revenue': 42.73, 'unit': 'M', 'net_profit': -46.9}, {'period': ""Q2 '22"", 'revenue': 40.29, 'unit': 'M', 'net_profit': -107.74}]",3.17,3.17,1343047153,0,0,509007329,12749856,1330224635,0,0,50088663,0,21.72625665594578,20.133333333333333,"[0.0939, 0.1725]","['2025-07-24', '2003-04-04']",__nan__,0.3789943844212892
58,FFG,FBL Financial Group Inc. Common Stock,,,,,,,,,,,,119530000,72513000,"[{'period': '2020', 'revenue': 736.46, 'unit': 'M', 'net_profit': 72.51}, {'period': '2019', 'revenue': 774.68, 'unit': 'M', 'net_profit': 126.21}, {'period': '2017', 'revenue': 735.48, 'unit': 'M', 'net_profit': 194.33}, {'period': '2016', 'revenue': 726.41, 'unit': 'M', 'net_profit': 107.22}]","[{'period': ""Q1 '21"", 'revenue': 190.31, 'unit': 'M', 'net_profit': 27.68}, {'period': ""Q4 '20"", 'revenue': 191.79, 'unit': 'M', 'net_profit': 27.84}, {'period': ""Q3 '20"", 'revenue': 195.94, 'unit': 'M', 'net_profit': 20.97}, {'period': ""Q2 '20"", 'revenue': 201.21, 'unit': 'M', 'net_profit': 26.21}, {'period': ""Q1 '20"", 'revenue': 147.52, 'unit': 'M', 'net_profit': -2.52}, {'period': ""Q4 '19"", 'revenue': 193.56, 'unit': 'M', 'net_profit': 34.74}]",2.96,2.96,10996272000,12882000,8359631000,9304156000,135157000,9754000000,299625000,12882000,218118000,-0.2083476832595968,-0.4254530184059774,-0.41846758349705304,__nan__,__nan__,__nan__,0.846119121098496
