,symbol,name,description__profile,ceo__profile,industry__profile,price__profile,currency__profile,mktCap__profile,image__profile,volAvg__profile,pe__quote,change__quote,volume__quote,ebitda__income_statement,netIncome__income_statement,annual_earnings,quaterly_earnings,eps__income_statement,epsdiluted__income_statement,totalAssets__balance_sheet_statement,totalCurrentAssets__balance_sheet_statement,cashAndShortTermInvestments__balance_sheet_statement,totalLiabilities__balance_sheet_statement,netReceivables__balance_sheet_statement,longTermInvestments__balance_sheet_statement,totalCurrentLiabilities__balance_sheet_statement,cashAndCashEquivalents__balance_sheet_statement,freeCashFlow__cash_flow_statement,growthEBITDA__income_statement_growth,growthNetIncome__income_statement_growth,growthEPS__income_statement_growth,dividend__historical-price-full/stock_dividend,date__historical-price-full/stock_dividend,derived__netIncomeMargin,derived__debtRatio
106,FRC,FIRST REPUBLIC BANK Common Stock,"First Republic Bank, together with its subsidiaries, provides private banking, private business banking, and private wealth management services to clients in metropolitan areas in the United States. It operates in two segments, Commercial Banking and Wealth Management. The company accepts deposit products, such as noninterest-bearing checking, interest-bearing checking, money market checking accounts, money market savings accounts, and passbook accounts, as well as certificates of deposit. It also offers a range of lending products that comprise residential mortgage loans, home equity lines of credit, multifamily loans, commercial real estate and construction loans, personal and business loans, single family construction loans, and other loans and lines of credit to businesses and individuals. The company's loans are secured by single family residences, multifamily buildings, and commercial real estate properties. In addition, it provides wealth management services, which include various investment strategies and products, online investment management, trust and custody, full service and online brokerage, financial and estate planning, and access to alternative investments, as well as investing, insurance, and foreign exchange services. Further, the company offers online and mobile banking services; refinancing services; and ATM and debit cards. As of December 31, 2021, it offered its services through 82 licensed deposit taking offices primarily in the San Francisco, Palo Alto, Los Angeles, Santa Barbara, Newport Beach and San Diego, California; Portland, Oregon; Boston, Massachusetts; Palm Beach, Florida; Greenwich, Connecticut; New York, New York; and Jackson, Wyoming. It also has 12 additional offices that offer lending, wealth management, or trust services. First Republic Bank was founded in 1985 and is headquartered in San Francisco, California.",Mr. Michael J. Roffler,Banks - Regional,3.51,USD,653628718,https://images.financialmodelingprep.com/symbol/FRC.png,64633037,0.4254545454545455,0,0,3221000000,1665000000,"[{'period': '2022', 'revenue': 5.77, 'unit': 'B', 'net_profit': 1.67}, {'period': '2021', 'revenue': 4.96, 'unit': 'B', 'net_profit': 1.48}, {'period': '2020', 'revenue': 3.85, 'unit': 'B', 'net_profit': 1.06}, {'period': '2019', 'revenue': 3250.0, 'unit': 'M', 'net_profit': 930.33}]","[{'period': ""Q3 '23"", 'revenue': 0.0, 'unit': '', 'net_profit': 0.0}, {'period': ""Q2 '23"", 'revenue': 0.0, 'unit': '', 'net_profit': 0.0}, {'period': ""Q1 '23"", 'revenue': 2180.0, 'unit': 'M', 'net_profit': 269.0}, {'period': ""Q4 '22"", 'revenue': 1420.0, 'unit': 'M', 'net_profit': 386.0}, {'period': ""Q3 '22"", 'revenue': 1500.0, 'unit': 'M', 'net_profit': 445.0}, {'period': ""Q2 '22"", 'revenue': 1480.0, 'unit': 'M', 'net_profit': 433.0}]",8.32,8.25,212639000000,5331000000,4623000000,195193000000,708000000,33102000000,6700000000,4283000000,55000000,0.6008946322067594,0.12652232746955344,0.06940874035989718,"[0.27, 0.1]","['2023-01-25', '2012-07-30']",__nan__,0.9179548436552091
107,FRO,Frontline Ltd. Ordinary Shares,"Frontline Ltd., a shipping company, engages in the seaborne transportation of crude oil and oil products worldwide. It owns and operates oil and product tankers. As of December 31, 2021, the company operated a fleet of 70 vessels. It is also involved in the charter, purchase, and sale of vessels. The company was founded in 1985 and is based in Hamilton, Bermuda.",Mr. Lars H. Barstad,Oil & Gas Midstream,17.84,USD,3971594320,https://images.financialmodelingprep.com/symbol/FRO.png,3079935,8,0.33,2054031,1146154000,495583000,"[{'period': '2024', 'revenue': 2050.0, 'unit': 'M', 'net_profit': 495.58}, {'period': '2023', 'revenue': 1800.0, 'unit': 'M', 'net_profit': 656.41}, {'period': '2022', 'revenue': 1430.0, 'unit': 'M', 'net_profit': 475.54}, {'period': '2021', 'revenue': 749.38, 'unit': 'M', 'net_profit': -11.15}]","[{'period': ""Q4 '24"", 'revenue': 425.64, 'unit': 'M', 'net_profit': 66.73}, {'period': ""Q3 '24"", 'revenue': 490.32, 'unit': 'M', 'net_profit': 60.46}, {'period': ""Q2 '24"", 'revenue': 556.03, 'unit': 'M', 'net_profit': 187.57}, {'period': ""Q1 '24"", 'revenue': 578.4, 'unit': 'M', 'net_profit': 180.82}, {'period': ""Q4 '23"", 'revenue': 415.0, 'unit': 'M', 'net_profit': 118.37}, {'period': ""Q3 '23"", 'revenue': 377.08, 'unit': 'M', 'net_profit': 107.74}]",2.23,2.23,6220807000,826013000,417559000,3880626000,137475000,11788000,595653000,413532000,-178836000,0.07800469894226772,-0.24501457921372793,-0.24406779661016953,"[0.2, 0.4]","['2025-03-14', '2001-08-21']",__nan__,0.6238139199624744
108,FRT,Federal Realty Investment Trust Common Stock,"Federal Realty is a recognized leader in the ownership, operation and redevelopment of high-quality retail-based properties located primarily in major coastal markets from Washington, D.C. to Boston as well as San Francisco and Los Angeles. Founded in 1962, Federal Realty's mission is to deliver long-term, sustainable growth through investing in communities where retail demand exceeds supply. Its expertise includes creating urban, mixed-use neighborhoods like Santana Row in San Jose, California, Pike & Rose in North Bethesda, Maryland and Assembly Row in Somerville, Massachusetts. These unique and vibrant environments that combine shopping, dining, living and working provide a destination experience valued by their respective communities. Federal Realty's 106 properties include approximately 3,100 tenants, in 25 million square feet, and approximately 3,200 residential units. Federal Realty has increased its quarterly dividends to its shareholders for 54 consecutive years, the longest record in the REIT industry. Federal Realty is an S&P 500 index member and its shares are traded on the NYSE under the symbol FRT. For additional information about Federal Realty and its properties, visit www.federalrealty.com.",Mr. Donald C. Wood CPA,REIT - Retail,96.91,USD,8359524437,https://images.financialmodelingprep.com/symbol/FRT.png,884720,28.34,-1.3,740621,814954000,295208000,"[{'period': '2024', 'revenue': 1200.0, 'unit': 'M', 'net_profit': 295.21}, {'period': '2023', 'revenue': 1130.0, 'unit': 'M', 'net_profit': 236.99}, {'period': '2022', 'revenue': 1070.0, 'unit': 'M', 'net_profit': 254.74}, {'period': '2021', 'revenue': 951.22, 'unit': 'M', 'net_profit': 132.56}]","[{'period': ""Q1 '25"", 'revenue': 309.15, 'unit': 'M', 'net_profit': 63.77}, {'period': ""Q4 '24"", 'revenue': 311.44, 'unit': 'M', 'net_profit': 65.54}, {'period': ""Q3 '24"", 'revenue': 303.63, 'unit': 'M', 'net_profit': 60.95}, {'period': ""Q2 '24"", 'revenue': 296.05, 'unit': 'M', 'net_profit': 111.98}, {'period': ""Q1 '24"", 'revenue': 291.32, 'unit': 'M', 'net_profit': 56.74}, {'period': ""Q4 '23"", 'revenue': 291.81, 'unit': 'M', 'net_profit': 64.1}]",3.42,3.42,8524757000,361633000,123409000,5100327000,238224000,33458000,689034000,123409000,327803000,0.10608871739398933,0.24568221617401945,0.22142857142857147,"[1.1, 0.3]","['2025-07-01', '1987-12-18']",__nan__,0.598295881043882
109,FRX,Forest Road Acquisition Corp. Class A Common Stock,"Forest Road Acquisition Corp. intends to effect a merger, capital stock exchange, asset acquisition, stock purchase, reorganization, or similar business combination with one or more businesses in the technology, media, and telecommunications space. The company was founded in 2020 and is based in New York, New York.",Mr. Zachary  Tarica,Shell Companies,12,USD,3745943940,https://images.financialmodelingprep.com/symbol/FRX.png,1567251,0,0.78,3958568,-5636000,-21432000,"[{'period': '2020', 'revenue': 863.58, 'unit': 'M', 'net_profit': -21.43}]","[{'period': ""Q2 '21"", 'revenue': 223.11, 'unit': 'M', 'net_profit': -12.44}, {'period': ""Q1 '21"", 'revenue': 0.0, 'unit': 'M', 'net_profit': -16.59}]",-0.57,-0.57,251495000,16492000,2990000,35996000,0,0,3243000,2990000,,0,0,0,__nan__,__nan__,__nan__,0.1431280939978926
110,FRXB,Forest Road Acquisition Corp. II Class A Common Stock,"Forest Road Acquisition Corp II does not have significant operations. The company intends to effect a merger, capital stock exchange, asset acquisition, stock purchase, reorganization, or related business combination with one or more businesses. It intends to identify businesses in the areas of technology, media, and telecommunications industry. The company was formerly known as Forest Road Acquisition Corp. III and changed its name to Forest Road Acquisition Corp II in January 2021. Forest Road Acquisition Corp II was incorporated in 2020 and is based in New York, New York.",Mr. Zachary  Tarica,Shell Companies,10.43,USD,137932568,https://images.financialmodelingprep.com/symbol/FRXB.png,15664,29.8,-0.005,1104,-11790251,9524605,"[{'period': '2022', 'revenue': 0.0, 'unit': 'M', 'net_profit': 9.52}, {'period': '2021', 'revenue': 0.0, 'unit': 'M', 'net_profit': 7.83}]","[{'period': ""Q3 '23"", 'revenue': 0.0, 'unit': 'M', 'net_profit': 1.83}, {'period': ""Q2 '23"", 'revenue': 0.0, 'unit': 'K', 'net_profit': 752.95}, {'period': ""Q1 '23"", 'revenue': 0.0, 'unit': 'M', 'net_profit': 5.92}, {'period': ""Q4 '22"", 'revenue': 0.0, 'unit': 'M', 'net_profit': -3.46}, {'period': ""Q3 '22"", 'revenue': 0.0, 'unit': 'M', 'net_profit': 7.18}, {'period': ""Q2 '22"", 'revenue': 0.0, 'unit': 'M', 'net_profit': 3.5}]",0.26,0.26,354809179,196047,154312,19796006,0,354613132,833660,154312,-1072015,-0.12747675023173027,0.21602505332538874,0.2380952380952382,__nan__,__nan__,__nan__,0.05579338746475891
111,FSD,First Trust High Income Long Short Fund Common Shares of Beneficial Interest,"First Trust High Income Long/Short Fund is a closed-ended fixed-income mutual fund launched and managed by First Trust Advisors, L.P. It is co-managed by MacKay Shields LLC. The fund invests in fixed-income markets across the globe. It primarily invests in high-yield corporate fixed-income securities of varying maturities that are rated below-investment grade, including corporate bonds, debentures, notes, and commercial papers. The fund employs fundamental analysis and a long/short strategy, with a focus on such factors as type, size, and cost of a security, financial statements of the issuer, credit quality and cash flow of the issuer, and evaluation of the forces which influence the market to create its portfolio. It benchmarks the performance of its portfolio against the Bank of America Merill Lynch U.S. High Yield Master II Constrained Index. First Trust High Income Long/Short Fund was formed on June 18, 2010 and is domiciled in the United States.",Mr. Louis N. Cohen CFA,Asset Management - Income,12.22,USD,406816020,https://images.financialmodelingprep.com/symbol/FSD.png,133525,11.980392156862745,-0.23,809088,19106466,19106466,"[{'period': '2023', 'revenue': 19.75, 'unit': 'M', 'net_profit': 19.11}, {'period': '2022', 'revenue': -77.71, 'unit': 'M', 'net_profit': -78.36}, {'period': '2021', 'revenue': 64.0, 'unit': 'M', 'net_profit': 62.96}, {'period': '2020', 'revenue': 354.49, 'unit': 'K', 'net_profit': -847.15}]","[{'period': ""Q2 '24"", 'revenue': 13.69, 'unit': 'M', 'net_profit': 38.74}, {'period': ""Q4 '23"", 'revenue': 16.38, 'unit': 'M', 'net_profit': -4.94}, {'period': ""Q2 '23"", 'revenue': 9.49, 'unit': 'M', 'net_profit': 24.04}, {'period': ""Q4 '22"", 'revenue': -1.34, 'unit': 'M', 'net_profit': -27.1}, {'period': ""Q2 '22"", 'revenue': 21.26, 'unit': 'M', 'net_profit': -51.26}, {'period': ""Q4 '21"", 'revenue': 27.69, 'unit': 'M', 'net_profit': 12.57}]",0.57,0.57,599868654,73094560,59855065,202195832,13239495,526761916,2248387,59855065,15775249,1.261019612879076,1.2438440545419875,1.2435897435897436,"[0.05103, 0.1335]","['2024-07-01', '2010-12-01']",__nan__,0.3370668406354168
112,FSK,FS KKR Capital Corp. Common Stock,"FS KKR Capital Corp. is a business development company specializing in investments in debt securities. It provides customized credit solutions to private middle market U.S. companies. It invest primarily in the senior secured debt and, to a lesser extent, the subordinated debt of private middle market U.S. companies. It seeks to purchase interests in loans through secondary market transactions or directly from the target companies as primary market investments. It also seeks to invest in first lien senior secured loans, second lien secured loans and, to a lesser extent, subordinated loans, or mezzanine loans. In connection with the debt investments, the firm also receives equity interests such as warrants or options as additional consideration. It also seek to purchase minority interests in the form of common or preferred equity in our target companies, either in conjunction with one of the debt investments or through a co-investment with a financial sponsor. Additionally, on an opportunistic basis, the fund may also invest in corporate bonds and similar debt securities. The fund does not seek to invest in start-up companies, turnaround situations, or companies with speculative business plans. It seeks to invest in small and middle-market companies based in United States. The fund seeks to invest in firms with annual revenue between $10 million to $2.5 billion. It focus on providing customized one-stop credit solutions to private upper middle market companies with annual EBITDA of $50 million to $100 million at the time of investment. It seeks to exit from securities by selling them in a privately negotiated over- the- counter market. For any investments that are not able to be sold within the secondary market, the firm seeks to exit such investments through repayment, an initial public offering of equity securities, merger, sale or recapitalization.",Mr. Michael Craig Forman J.D.,Asset Management,20.79,USD,5822572140,https://images.financialmodelingprep.com/symbol/FSK.png,2165590,9.95,0.21,1201422,608000000,585000000,"[{'period': '2024', 'revenue': 664.0, 'unit': 'M', 'net_profit': 585.0}, {'period': '2023', 'revenue': 779.0, 'unit': 'M', 'net_profit': 696.0}, {'period': '2022', 'revenue': 1640.0, 'unit': 'M', 'net_profit': 92.0}, {'period': '2021', 'revenue': 1.54, 'unit': 'B', 'net_profit': 1.51}]","[{'period': ""Q1 '25"", 'revenue': 400000000.0, 'unit': '', 'net_profit': 0.0}, {'period': ""Q4 '24"", 'revenue': 270.0, 'unit': 'M', 'net_profit': 147.0}, {'period': ""Q3 '24"", 'revenue': 441.0, 'unit': 'M', 'net_profit': 160.0}, {'period': ""Q2 '24"", 'revenue': 115.0, 'unit': 'M', 'net_profit': 105.0}, {'period': ""Q1 '24"", 'revenue': 185.0, 'unit': 'M', 'net_profit': 173.0}, {'period': ""Q4 '23"", 'revenue': 129.0, 'unit': 'M', 'net_profit': 90.0}]",2.09,2.09,14219000000,278000000,296000000,7597000000,0,3000000,110000000,296000000,1901000000,-0.4825531914893617,-0.15948275862068967,-0.1572580645161291,"[0.7, 0.0186]","['2025-06-18', '2014-04-25']",__nan__,0.5342851114705676
113,FSKR,FS KKR Capital Corp. II Common Stock,"FS KKR Capital Corp. II, formerly known as FS Investment Corp II, is a business development company specializing in investments in floating rate, senior secured loans-first lien and second line, senior secured bonds, subordinated debt, collateralized securities, corporate bonds, debt securities, equity such as warrants or options in middle market private companies. The fund does not intend to invest to any significant degree in start-up companies, turnaround situations or companies with speculative business plans. It seeks to invest in various sectors such as consumer services, energy, capital goods, software and services, telecommunication services, consumer durables and apparel, diversified financials, materials, automobiles and components, commercial and professional services, media, technology hardware and equipment, health care equipment and services, insurance, retailing, transportation, pharmaceuticals, biotechnology, and life sciences, food and staples retailing, food, beverage, and tobacco, household and personal products, real estate, and utilities. The fund seeks to invest in private companies based in the United States. It also invests in non-U.S. securities, which may include securities denominated in U.S. dollars or in non-U.S. currencies, to the extent permitted by the 1940 Act. The fund purchase interests in loans through secondary market transactions in the ?over-the-counter? market for institutional loans or directly from our target companies. It also purchase minority interests in the form of common or preferred equity in target companies, either in conjunction with one of its debt investments or through a co-investment with a financial sponsor, such as an institutional investor or private equity firm. It may have board representation or board observation rights in its portfolio companies.",Mr. Michael Craig Forman J.D.,Asset Management,21.56,USD,0,https://images.financialmodelingprep.com/symbol/FSKR.png,431458,0,-0.110001,546492,-438000000,-376000000,"[{'period': '2020', 'revenue': -261.0, 'unit': 'M', 'net_profit': -376.0}, {'period': '2019', 'revenue': 460.0, 'unit': 'M', 'net_profit': 92.0}, {'period': '2018', 'revenue': 453.98, 'unit': 'M', 'net_profit': -37.44}, {'period': '2017', 'revenue': 523.69, 'unit': 'M', 'net_profit': 189.94}]","[{'period': ""Q1 '21"", 'revenue': 162.0, 'unit': 'M', 'net_profit': 132.0}, {'period': ""Q4 '20"", 'revenue': 197.0, 'unit': 'M', 'net_profit': 161.0}, {'period': ""Q3 '20"", 'revenue': 177.0, 'unit': 'M', 'net_profit': 149.0}, {'period': ""Q2 '20"", 'revenue': 44.0, 'unit': 'M', 'net_profit': 22.0}, {'period': ""Q1 '20"", 'revenue': 195.0, 'unit': 'M', 'net_profit': -708.0}, {'period': ""Q4 '19"", 'revenue': 120430.0, 'unit': 'K', 'net_profit': 210.0}]",-2.19,-2.19,8522000000,160000000,160000000,4257000000,318000000,8024000000,3960000000,160000000,133000000,-7.264150943396227,-5.086956521739131,-17.846153846153843,"[0.55, 0.55]","['2021-06-10', '2020-09-15']",__nan__,0.49953062661347103
114,FSLF,First Eagle Senior Loan Fund ,"THL Credit Senior Loan Fund is headquartered in Boston, Massachusetts.",Mr. James R. Fellows CFA,Asset Management,15.78,USD,0,https://images.financialmodelingprep.com/symbol/FSLF.png,29354,,0.0198994,48824,,,[],[],,,,,,,,,,,,,,,"[0.07, 0.119]","['2021-06-18', '2013-11-14']",__nan__,__nan__
115,FSLY,Fastly Inc. Class A Common Stock,"Fastly, Inc. operates an edge cloud platform for processing, serving, and securing its customer's applications in the United States, the Asia Pacific, Europe, and internationally. The edge cloud is a category of Infrastructure as a Service that enables developers to build, secure, and deliver digital experiences at the edge of the internet. It is a programmable platform designed for web and application delivery. The company offers Compute@Edge; developer hub that includes solution library patterns and recipes, API and language references, change logs, and Fastly Fiddle solutions; device detection and geolocation, edge dictionaries, edge access control lists, and edge authentication services; full site delivery services, such as dynamic site acceleration, origin shield, instant purge, surrogate keys, real-time logging and stats, cloud optimizer, programmatic control, edge databases, content compression, reliability, and modern protocols and performance services; and streaming solutions and services, including live streaming, media shield, and origin connect. It also provides edge security solutions, such as DDoS protection and cloud, edge web application firewall (WAF), transport layer security (TLS), platform TLS, and compliance services; unified web application and API protection solutions that includes runtime self-application protection, advanced rate limiting, API and ATO protection, account takeover protection, bot protection, and next generation WAF. In addition, the company offers edge applications, such as load balancers and image optimizers; video on demand; and managed edge delivery services. It serves customers operating in digital publishing, media and entertainment, technology, online retail, travel and hospitality, and financial services industries. The company was formerly known as SkyCache, Inc. and changed its name to Fastly, Inc. in May 2012. Fastly, Inc. was incorporated in 2011 and is headquartered in San Francisco, California.",Mr. Todd  Nightingale,Software - Application,8.17,USD,1183016000,https://images.financialmodelingprep.com/symbol/FSLY.png,3061475,-7.17,0.07,3070467,-79071000,-158058000,"[{'period': '2024', 'revenue': 543.68, 'unit': 'M', 'net_profit': -158.06}, {'period': '2023', 'revenue': 505.99, 'unit': 'M', 'net_profit': -133.09}, {'period': '2022', 'revenue': 432.73, 'unit': 'M', 'net_profit': -190.77}, {'period': '2021', 'revenue': 354.33, 'unit': 'M', 'net_profit': -222.7}]","[{'period': ""Q1 '25"", 'revenue': 144.47, 'unit': 'M', 'net_profit': -39.15}, {'period': ""Q4 '24"", 'revenue': 140.58, 'unit': 'M', 'net_profit': -32.89}, {'period': ""Q3 '24"", 'revenue': 137.21, 'unit': 'M', 'net_profit': -38.02}, {'period': ""Q2 '24"", 'revenue': 132.37, 'unit': 'M', 'net_profit': -43.73}, {'period': ""Q1 '24"", 'revenue': 133.52, 'unit': 'M', 'net_profit': -43.43}, {'period': ""Q4 '23"", 'revenue': 137.78, 'unit': 'M', 'net_profit': -23.39}]",-1.14,-1.14,1451359000,440195000,295882000,486109000,115988000,0,104456000,286175000,-20808000,-3.1603177943807217,-0.18762022120702093,-0.10679611650485425,__nan__,__nan__,__nan__,0.3349336725096961
116,FSM,Fortuna Silver Mines Inc Ordinary Shares (Canada),"Fortuna Silver Mines Inc. engages in the acquisition, exploration, and mining of precious and base metal deposits in Argentina, Burkina Faso, Mexico, Peru, and Côte d'Ivoire. It holds interest in the Caylloma silver, lead, and zinc mine located in southern Peru; the San Jose silver and gold mine situated in southern Mexico; the Lindero gold project located in Argentina; Yaramoko gold mine situated in south western Burkina Faso; and Séguéla gold mine located in south western Côte d'Ivoire. The company was formerly known as Fortuna Ventures Inc. and changed its name to Fortuna Silver Mines Inc. in June 2005. Fortuna Silver Mines Inc. was incorporated in 1990 and is based in Vancouver, Canada.","Mr. Jorge A. Ganoza Durant B.Sc., Eng",Silver,5.54,USD,1698165120,https://images.financialmodelingprep.com/symbol/FSM.png,16036715,13.51,-0.01,18734151,474261000,128735000,"[{'period': '2024', 'revenue': 1060.0, 'unit': 'M', 'net_profit': 128.74}, {'period': '2023', 'revenue': 842.43, 'unit': 'M', 'net_profit': -50.84}, {'period': '2022', 'revenue': 681.49, 'unit': 'M', 'net_profit': -135.91}, {'period': '2021', 'revenue': 599.85, 'unit': 'M', 'net_profit': 57.88}]","[{'period': ""Q4 '24"", 'revenue': 302.2, 'unit': 'M', 'net_profit': 11.34}, {'period': ""Q3 '24"", 'revenue': 274.92, 'unit': 'M', 'net_profit': 50.51}, {'period': ""Q2 '24"", 'revenue': 262.31, 'unit': 'M', 'net_profit': 40.63}, {'period': ""Q1 '24"", 'revenue': 224.03, 'unit': 'M', 'net_profit': 26.25}, {'period': ""Q4 '23"", 'revenue': 272.04, 'unit': 'M', 'net_profit': -94.87}, {'period': ""Q3 '23"", 'revenue': 243.06, 'unit': 'M', 'net_profit': 27.47}]",0.42,0.41,2115532000,486241000,231328000,649459000,26702000,0,256029000,231328000,161899000,1.0549549588585245,3.5323589582185853,3.4705882352941173,__nan__,__nan__,__nan__,0.3069955925979848
117,FSNB,Fusion Acquisition Corp. II Class A Common Stock,"Fusion Acquisition Corp. II is a blank check company. The company was incorporated in 2021 and is based in New York, New York.",Mr. John  James,Shell Companies,10.49,USD,178070887,https://images.financialmodelingprep.com/symbol/FSNB.png,35500,41.96,-0.02,500,,,[],[],,,,,,,,,,,,,,,__nan__,__nan__,__nan__,__nan__
