,symbol,name,description__profile,ceo__profile,industry__profile,price__profile,currency__profile,mktCap__profile,image__profile,volAvg__profile,pe__quote,change__quote,volume__quote,ebitda__income_statement,netIncome__income_statement,annual_earnings,quaterly_earnings,eps__income_statement,epsdiluted__income_statement,totalAssets__balance_sheet_statement,totalCurrentAssets__balance_sheet_statement,cashAndShortTermInvestments__balance_sheet_statement,totalLiabilities__balance_sheet_statement,netReceivables__balance_sheet_statement,longTermInvestments__balance_sheet_statement,totalCurrentLiabilities__balance_sheet_statement,cashAndCashEquivalents__balance_sheet_statement,freeCashFlow__cash_flow_statement,growthEBITDA__income_statement_growth,growthNetIncome__income_statement_growth,growthEPS__income_statement_growth,dividend__historical-price-full/stock_dividend,date__historical-price-full/stock_dividend,derived__netIncomeMargin,derived__debtRatio
162,GEO,Geo Group Inc (The) REIT,"The GEO Group, Inc. engages in the ownership, leasing, and management of secure facilities, reentry facilities, and processing centers in the United States, Australia, and South Africa. It operates through four segments: U.S. Secure Services, Electronic Monitoring and Supervision Services, Reentry Services, and International Services. The company provides counseling, education, and treatment for alcohol and drug abuse problems at various facilities; and compliance technologies for monitoring services, and evidence-based supervision and treatment programs for community-based parolees, probationers, and pretrial defendants. It also offers secure facility management services, including security, administrative, rehabilitation, education, and food services at secure services facilities; reentry services comprising supervision of individuals in community-based programs and reentry centers, and provision of temporary housing, programming, employment assistance, and other services; and supervision and reporting services that improves the participation of non-detained aliens in the immigration court system. In addition, the company provides secure transportation services; and rehabilitation services, such as evidence-based, including cognitive behavioral treatment and post-release services, as well as academic and vocational classes in life skills and treatment programs under the GEO Continuum of Care platform; and develops new facilities based on contract, as well as designs, constructs, and finances the facilities. The GEO Group, Inc. was founded in 1984 and is headquartered in Boca Raton, Florida.",Mr. J. David Donahue,Security & Protection Services,26.59,USD,3758310370,https://images.financialmodelingprep.com/symbol/GEO.png,3237561,120.86,0.43,1814730,404967000,31966000,"[{'period': '2024', 'revenue': 2420.0, 'unit': 'M', 'net_profit': 31.97}, {'period': '2023', 'revenue': 2410.0, 'unit': 'M', 'net_profit': 107.33}, {'period': '2022', 'revenue': 2380.0, 'unit': 'M', 'net_profit': 171.81}, {'period': '2021', 'revenue': 2260.0, 'unit': 'M', 'net_profit': 77.42}]","[{'period': ""Q1 '25"", 'revenue': 604.65, 'unit': 'M', 'net_profit': 19.56}, {'period': ""Q4 '24"", 'revenue': 607.72, 'unit': 'M', 'net_profit': 14.72}, {'period': ""Q3 '24"", 'revenue': 603.12, 'unit': 'M', 'net_profit': 26.32}, {'period': ""Q2 '24"", 'revenue': 607.18, 'unit': 'M', 'net_profit': -32.51}, {'period': ""Q1 '24"", 'revenue': 605.67, 'unit': 'M', 'net_profit': 22.67}, {'period': ""Q4 '23"", 'revenue': 608.28, 'unit': 'M', 'net_profit': 25.23}]",0.0005,0.0005,3632080000,500179000,76896000,2301553000,376013000,0,340223000,76896000,163545000,-0.16003559250317345,-0.7021569997670627,-0.9993150684931508,"[0.25, 0.2]","['2021-01-22', '2012-08-17']",__nan__,0.633673542432986
163,GER,Goldman Sachs MLP Energy Renaissance Fund,"Goldman Sachs MLP and Energy Renaissance Fund is a closed-ended equity mutual fund launched and managed by Goldman Sachs Asset Management, L.P. The fund invests in public equity markets of the United States. It seeks to invest in stocks of companies operating in the energy sector. The fund primarily invests in growth stocks of Master Limited Partnerships and related energy companies across all market capitalizations, with a focus on midstream MLP investments. It employs fundamental and quantitative analysis with a bottom-up stock selection approach to create its portfolio. The fund benchmarks the performance of its portfolio against the Alerian MLP Index Total Return. Goldman Sachs MLP and Energy Renaissance Fund was formed on September 26, 2014 and is domiciled in the United States.",Mr. Kyri  Loupis,Asset Management,15.67,USD,239989184,https://images.financialmodelingprep.com/symbol/GER.png,0,3.292016806722689,-0.05,260083,0,76558918,"[{'period': '2022', 'revenue': 77.54, 'unit': 'M', 'net_profit': 76.56}, {'period': '2021', 'revenue': 57.63, 'unit': 'M', 'net_profit': 56.27}, {'period': '2020', 'revenue': -208.09, 'unit': 'M', 'net_profit': -209.4}, {'period': '2019', 'revenue': -81.67, 'unit': 'M', 'net_profit': -82.39}]","[{'period': ""Q2 '20"", 'revenue': 2.37, 'unit': 'M', 'net_profit': -225.04}, {'period': ""Q4 '19"", 'revenue': 2.31, 'unit': 'M', 'net_profit': -99.81}, {'period': ""Q2 '19"", 'revenue': 0.0, 'unit': '', 'net_profit': 0.0}, {'period': ""Q4 '18"", 'revenue': -1.33, 'unit': 'M', 'net_profit': -40.55}, {'period': ""Q2 '18"", 'revenue': 0.0, 'unit': '', 'net_profit': 0.0}, {'period': ""Q4 '17"", 'revenue': -2.84, 'unit': 'M', 'net_profit': -80.4}]",8.7,8.7,287318278,1518972,1273193,28869952,245779,284615937,438163,1273193,17750097,0,0.36054077781914706,1.6047904191616766,"[0.24, 0.32]","['2023-05-22', '2014-11-13']",__nan__,0.10048073586185144
164,GES,Guess? Inc. Common Stock,"Guess?, Inc. designs, markets, distributes, and licenses lifestyle collections of apparel and accessories for men, women, and children. It operates through five segments: Americas Retail, Americas Wholesale, Europe, Asia, and Licensing. The company's clothing collection includes jeans, pants, skirts, dresses, shorts, blouses, shirts, jackets, activewear, knitwear, and intimate apparel. It also grants licenses to design, manufacture, and distribute various products that complement its apparel lines, such as eyewear, watches, handbags, footwear, kids' and infants' apparel, outerwear, fragrance, jewelry, and other fashion accessories, as well as to wholesale partners to operate and sell products through licensed retail stores. The company markets its products under the GUESS, GUESS?, GUESS U.S.A., GUESS Jeans, GUESS? and Triangle Design, MARCIANO, Question Mark and Triangle Design, a stylized G and a stylized M, GUESS Kids, Baby GUESS, YES, G by GUESS, GUESS by MARCIANO, and Gc brand names. It sells its products through direct-to-consumer, wholesale, and licensing distribution channels. As of January 29, 2022, the company directly operated 1,068 retail stores in the Americas, Europe, and Asia. Its partner's distributors operated an additional 563 retail stores worldwide. The company also offers its products through its retail websites. Guess?, Inc. was founded in 1981 and is headquartered in Los Angeles, California.",Mr. Carlos E. Alberini,Apparel - Retail,12.15,USD,629826840,https://images.financialmodelingprep.com/symbol/GES.png,1714636,15.78,0.11,462446,178522000,60423000,"[{'period': '2025', 'revenue': 3000.0, 'unit': 'M', 'net_profit': 60.42}, {'period': '2024', 'revenue': 2780.0, 'unit': 'M', 'net_profit': 198.2}, {'period': '2023', 'revenue': 2690.0, 'unit': 'M', 'net_profit': 149.61}, {'period': '2022', 'revenue': 2590.0, 'unit': 'M', 'net_profit': 171.36}]","[{'period': ""Q4 '25"", 'revenue': 932.25, 'unit': 'M', 'net_profit': 81.4}, {'period': ""Q3 '25"", 'revenue': 738.52, 'unit': 'M', 'net_profit': -23.39}, {'period': ""Q2 '25"", 'revenue': 732.56, 'unit': 'M', 'net_profit': -10.6}, {'period': ""Q1 '25"", 'revenue': 591.94, 'unit': 'M', 'net_profit': 13.02}, {'period': ""Q4 '24"", 'revenue': 891.05, 'unit': 'M', 'net_profit': 115.27}, {'period': ""Q3 '24"", 'revenue': 651.17, 'unit': 'M', 'net_profit': 55.7}]",2.02,1.52,2766678000,1249370000,187696000,2215903000,391161000,0,831332000,187696000,35588000,-0.4397604918202559,-0.6951397332983517,-0.5,"[0.3, 0.12]","['2025-04-16', '2007-02-22']",__nan__,0.8009255142810259
165,GF,New Germany Fund Inc. (The) Common Stock,"The New Germany Fund Inc. is a closed ended equity mutual fund launched by Deutsche Investment Management Americas Inc. The fund is managed by Deutsche Asset Management International GmbH. It invests in the public equity markets of Germany. The fund seeks to invest in stocks of companies operating across diversified sectors. It primarily invests in stocks of small and mid cap companies. The fund benchmarks the performance of its portfolio against the Midcap Market Performance Index. The New Germany Fund Inc. was formed on January 16, 1990 and is domiciled in Germany.",Ms. Linda  Lonneberg,Asset Management,10.95,USD,179472690,https://images.financialmodelingprep.com/symbol/GF.png,39546,8.9,0.11,6187,-20204685,-20212188,"[{'period': '2024', 'revenue': -19.1, 'unit': 'M', 'net_profit': -20.21}, {'period': '2023', 'revenue': 3.58, 'unit': 'M', 'net_profit': 24.03}, {'period': '2022', 'revenue': -105.03, 'unit': 'M', 'net_profit': -106.36}, {'period': '2021', 'revenue': 10.84, 'unit': 'M', 'net_profit': 9.19}]","[{'period': ""Q4 '24"", 'revenue': -3.69, 'unit': 'M', 'net_profit': -6.54}, {'period': ""Q2 '24"", 'revenue': 3.05, 'unit': 'M', 'net_profit': -13.68}, {'period': ""Q4 '23"", 'revenue': 0.13797, 'unit': 'M', 'net_profit': 1.78}, {'period': ""Q2 '23"", 'revenue': 3.44, 'unit': 'M', 'net_profit': 22.25}, {'period': ""Q4 '22"", 'revenue': 0.34315, 'unit': 'M', 'net_profit': -1.88}, {'period': ""Q2 '22"", 'revenue': 3.17, 'unit': 'M', 'net_profit': -104.48}]",0,0,161140636,798005,205901,8763641,606886,160298940,0,205901,0,-1.8420665673480796,-1.841110355215593,-1,"[0.0482, 0.26]","['2024-12-30', '1990-11-28']",__nan__,0.05438504661232689
166,GFF,Griffon Corporation Common Stock,"Griffon Corporation, through its subsidiaries, provides consumer and professional, and home and building products in the United States, Europe, Canada, Australia, and internationally. Its Consumer and Professional Products segment manufactures and markets long-handled tools and landscaping products for homeowners and professionals; wood and wire closet organization, general living storage, and wire garage storage products to home center retail chains, mass merchandisers, and direct-to builder professional installers; wheelbarrows and lawn carts; snow, striking, and hand tools; planters and lawn accessories; garden hoses; and pruners, loppers, shears, and other tools, as well as cleaning products for professional, home, and industrial use. The company's Home & Building Products segment manufactures and markets residential and commercial garage doors for professional dealers and various home center retail chains; and rolling steel door and grille products for commercial, industrial, institutional, and retail uses. It sells its products under the True Temper, AMES, ClosetMaid, Clopay, Ideal, Holmes, CornellCookson, Garant, Harper, UnionTools, Westmix, Cyclone, Southern Patio, Northcote Pottery, Nylex, Hills, Kelkay, Tuscan Path, La Hacienda, Kelso, Dynamic Design, Apta, Quatro Design, Razor-Back, Jackson, Darby, Trojan, Supercraft, NeverLeak, Maximum Load, SuperSlide, ShelfTrack, MasterSuite, Suite Symphony, ExpressShelf, Style+, and SpaceCreations brand names. The company was formerly known as Instrument Systems Corporation and changed its name to Griffon Corporation in June 1992. Griffon Corporation was founded in 1959 and is headquartered in New York, New York.",Mr. Ronald J. Kramer,Conglomerates,73.52,USD,3457344168,https://images.financialmodelingprep.com/symbol/GFF.png,445073,15,0.59,438843,461440000,209897000,"[{'period': '2024', 'revenue': 2620.0, 'unit': 'M', 'net_profit': 209.9}, {'period': '2023', 'revenue': 2690.0, 'unit': 'M', 'net_profit': 77.62}, {'period': '2022', 'revenue': 2850.0, 'unit': 'M', 'net_profit': -287.71}, {'period': '2021', 'revenue': 2270.0, 'unit': 'M', 'net_profit': 79.21}]","[{'period': ""Q2 '25"", 'revenue': 611.75, 'unit': 'M', 'net_profit': 56.76}, {'period': ""Q1 '25"", 'revenue': 632.37, 'unit': 'M', 'net_profit': 70.85}, {'period': ""Q4 '24"", 'revenue': 659.67, 'unit': 'M', 'net_profit': 62.49}, {'period': ""Q3 '24"", 'revenue': 647.81, 'unit': 'M', 'net_profit': 41.09}, {'period': ""Q2 '24"", 'revenue': 672.88, 'unit': 'M', 'net_profit': 64.14}, {'period': ""Q1 '24"", 'revenue': 643.15, 'unit': 'M', 'net_profit': 42.18}]",4.41,4.23,2370954000,929476000,114438000,2146066000,312765000,0,348990000,114438000,308867000,-0.003657688703485384,1.704265818055323,1.9597315436241611,"[0.18, 0.02]","['2025-05-30', '2011-11-25']",__nan__,0.9051487291613418
167,GFI,Gold Fields Limited American Depositary Shares,"Gold Fields Limited operates as a gold producer with reserves and resources in Chile, South Africa, Ghana, West Africa, Australia, and Peru. The company also explores for copper deposits. It holds interests in 9 operating mines with an annual gold-equivalent production of approximately 2.34 million ounces, as well as gold mineral reserves of approximately 48.6 million ounces and mineral resources of approximately 111.8 million ounces. Gold Fields Limited was founded in 1887 and is based in Sandton, South Africa.","Mr. Michael John Fraser B.Com., MBL",Gold,20.18,USD,18061584320,https://images.financialmodelingprep.com/symbol/GFI.png,4157818,14.62,-0.01,6836212,2656000000,1245000000,"[{'period': '2024', 'revenue': 5.2, 'unit': 'B', 'net_profit': 1.25}, {'period': '2023', 'revenue': 4500.0, 'unit': 'M', 'net_profit': 703.3}, {'period': '2022', 'revenue': 4290.0, 'unit': 'M', 'net_profit': 711.0}, {'period': '2021', 'revenue': 4200.0, 'unit': 'M', 'net_profit': 789.3}]","[{'period': ""Q4 '24"", 'revenue': 3080.0, 'unit': 'M', 'net_profit': 856.0}, {'period': ""Q2 '24"", 'revenue': 2120.0, 'unit': 'M', 'net_profit': 389.0}, {'period': ""Q4 '23"", 'revenue': 2230.0, 'unit': 'M', 'net_profit': 264.4}, {'period': ""Q2 '23"", 'revenue': 2270.0, 'unit': 'M', 'net_profit': 457.8}, {'period': ""Q4 '22"", 'revenue': 2050.0, 'unit': 'M', 'net_profit': 188.3}, {'period': ""Q2 '22"", 'revenue': 2240.0, 'unit': 'M', 'net_profit': 509.7}]",1.39,1.38,10142900000,1947800000,860200000,4776000000,0,277700000,1710400000,860200000,709200000,0.28402223833695917,0.7702260770652638,0.805194805194805,"[0.37522, 0.572]","['2025-03-14', '1986-12-18']",__nan__,0.4708712498397894
168,GFL,GFL Environmental Inc. Subordinate voting shares no par value,"GFL Environmental Inc. operates as a diversified environmental services company in Canada and the United States. The company offers non-hazardous solid waste management, infrastructure and soil remediation, and liquid waste management services. Its solid waste management business line includes the collection, transportation, transfer, recycling, and disposal of non-hazardous solid waste for municipal, residential, and commercial and industrial customers. The company's infrastructure and soil remediation business line provides remediation of contaminated soils, as well as complementary services, including civil, demolition, and excavation and shoring services. Its liquid waste management business collects, manages, transports, processes, and disposes of a range of industrial and commercial liquid wastes, as well as resells liquid waste products. The company was incorporated in 2007 and is headquartered in Vaughan, Canada.",Mr. Patrick  Dovigi,Waste Management,48.1,USD,17070401400,https://images.financialmodelingprep.com/symbol/GFL.png,2012280,-31.44,-0.58,3223676,1195700000,-722700000,"[{'period': '2024', 'revenue': 7860.0, 'unit': 'M', 'net_profit': -722.7}, {'period': '2023', 'revenue': 7520.0, 'unit': 'M', 'net_profit': 45.4}, {'period': '2022', 'revenue': 6760.0, 'unit': 'M', 'net_profit': -183.2}, {'period': '2021', 'revenue': 5530.0, 'unit': 'M', 'net_profit': -606.8}]","[{'period': ""Q1 '25"", 'revenue': 1.56, 'unit': 'B', 'net_profit': 3.41}, {'period': ""Q4 '24"", 'revenue': 1990.0, 'unit': 'M', 'net_profit': -189.1}, {'period': ""Q3 '24"", 'revenue': 2009.9999999999998, 'unit': 'M', 'net_profit': 110.4}, {'period': ""Q2 '24"", 'revenue': 2060.0, 'unit': 'M', 'net_profit': -471.2}, {'period': ""Q1 '24"", 'revenue': 1800.0, 'unit': 'M', 'net_profit': -172.8}, {'period': ""Q4 '23"", 'revenue': 1880.0, 'unit': 'M', 'net_profit': -52.2}]",-2.11,-2.11,21207400000,1695600000,133800000,13985700000,1261100000,344400000,3150700000,133800000,347200000,-0.48627282491944146,-16.91850220264317,-15.23076923076923,"[0.0154, 0.007187]","['2025-04-14', '2020-04-17']",__nan__,0.6594726369097579
169,GFLU,GFL Environmental Inc. Tangible Equity Units,"GFL Environmental Inc. operates as a diversified environmental services company in Canada and the United States. The company offers non-hazardous solid waste management, infrastructure and soil remediation, and liquid waste management services. Its solid waste management business line includes the collection, transportation, transfer, recycling, and disposal of non-hazardous solid waste for municipal, residential, and commercial and industrial customers. The company's infrastructure and soil remediation business line provides remediation of contaminated soils, as well as complementary services, including civil, demolition, and excavation and shoring services. Its liquid waste management business collects, manages, transports, processes, and disposes of a range of industrial and commercial liquid wastes, as well as resells liquid waste products. The company was incorporated in 2007 and is headquartered in Vaughan, Canada.",Mr. Patrick  Dovigi,Waste Management,70.3,USD,24980306392,https://images.financialmodelingprep.com/symbol/GFLU.png,154941,-91.89542483660131,2.91,1299145,,,[],[],,,,,,,,,,,,,,,"[0.75, 0.833]","['2023-02-28', '2020-05-29']",__nan__,__nan__
170,GFX,Golden Falcon Acquisition Corp. Class A Common Stock,"Golden Falcon Acquisition Corp. does not have significant operations. It focuses effecting a merger, capital stock exchange, asset acquisition, stock purchase, reorganization, or similar business combination with one or more businesses or entities. The company was incorporated in 2020 and is based in Newark, Delaware.",Mr. Makram  Azar,Shell Companies,10.23,USD,131287718,https://images.financialmodelingprep.com/symbol/GFX.png,9531,-73.07142857142857,0.0099,5411,-15769151,13802503,"[{'period': '2022', 'revenue': 0.0, 'unit': 'M', 'net_profit': 13.8}, {'period': '2021', 'revenue': 0.0, 'unit': 'M', 'net_profit': 19.32}, {'period': '2020', 'revenue': 0.0, 'unit': 'K', 'net_profit': -72.21}]","[{'period': ""Q1 '23"", 'revenue': 0.0, 'unit': 'M', 'net_profit': -3.21}, {'period': ""Q4 '22"", 'revenue': 0.0, 'unit': 'M', 'net_profit': -1.4}, {'period': ""Q3 '22"", 'revenue': 0.0, 'unit': 'M', 'net_profit': 1.26}, {'period': ""Q2 '22"", 'revenue': 0.0, 'unit': 'M', 'net_profit': 4.56}, {'period': ""Q1 '22"", 'revenue': 0.0, 'unit': 'M', 'net_profit': 17.28}, {'period': ""Q4 '21"", 'revenue': 0.0, 'unit': 'K', 'net_profit': -412.24}]",0.41,0.41,42678519,115443,23935,12655551,0,42563076,2541318,23935,-1445811,0.3094747745261207,-0.2857021906904853,-0.08888888888888896,__nan__,__nan__,__nan__,0.29653210318755435
171,GGB,Gerdau S.A. Common Stock,"Gerdau S.A. provides steel products and services. The company operates through Brazil Business, North America Business, South America Business, and Special Steel Business segments. It offers semi-finished products, including billets, blooms, and slabs; common long rolled products, such as rebars, wire rods, merchant bars, light shapes, and profiles to the construction and manufacturing industries; finished industrial products, including commercial rolled-steel bars, and light profiles and wires; agricultural products that include stakes and smooth wire products; and drawn products comprises barbed and barbless fence wires, galvanized wires, fences, concrete reinforcing wire meshes, nails, and clamps. The company also produces special steel products used in auto parts, light and heavy vehicles, and agricultural machinery, as well as the oil and gas, wind energy, machinery and equipment, mining and rail, and other markets. In addition, it offers flat products, including hot rolled coils and heavy plates; and resells flat steel products, as well as mines and produces iron ore. It sells its products through independent distributors, direct sales from the mills, and through its retail network. The company was founded in 1901 and is based in Sao Paulo, Brazil.",Mr. Gustavo Werneck Da Cunha,Steel,2.78,USD,5763384272,https://images.financialmodelingprep.com/symbol/GGB.png,10904546,9.93,0.11,11577387,9386895000,4566317000,"[{'period': '2024', 'revenue': 67.03, 'unit': 'B', 'net_profit': 4.57}, {'period': '2023', 'revenue': 68.92, 'unit': 'B', 'net_profit': 7.5}, {'period': '2022', 'revenue': 82.41, 'unit': 'B', 'net_profit': 11.43}, {'period': '2021', 'revenue': 78.35, 'unit': 'B', 'net_profit': 15.49}]","[{'period': ""Q1 '25"", 'revenue': 17380.0, 'unit': 'M', 'net_profit': 749.49}, {'period': ""Q4 '24"", 'revenue': 16820.0, 'unit': 'M', 'net_profit': 316.02}, {'period': ""Q3 '24"", 'revenue': 17.38, 'unit': 'B', 'net_profit': 1.35}, {'period': ""Q2 '24"", 'revenue': 16620.0, 'unit': 'M', 'net_profit': 859.11}, {'period': ""Q1 '24"", 'revenue': 16.21, 'unit': 'B', 'net_profit': 2.04}, {'period': ""Q4 '23"", 'revenue': 14720.0, 'unit': 'M', 'net_profit': 577.95}]",2.18,2.18,86814493000,32669423000,8276843000,28640707000,7244600000,4222317000,10851391000,7767813000,5434826000,-0.29069246931702447,-0.39128475191510037,-0.3859154929577464,"[0.0188, 0.38]","['2025-05-12', '1999-07-20']",__nan__,0.3299069776287238
172,GGG,Graco Inc. Common Stock,"Graco Inc. designs, manufactures, and markets systems and equipment used to move, measure, control, dispense, and spray fluid and powder materials worldwide. The company's Industrial segment offers proportioning systems to spray polyurethane foam and polyurea coatings; equipment that pumps, meters, mixes and dispenses sealant, adhesive, and composite materials; and gel-coat equipment, chop and wet-out systems, resin transfer molding systems and applicators, and precision dispensing solutions. It also provides liquid finishing equipment; paint circulating and supply pumps; paint circulating advanced control systems; plural component coating proportioners; spare parts and accessories; and powder finishing products to coat powder finishing on metals under the Gema and SAT brands. The company's Process segment offers pumps to move and dispense chemicals, water, wastewater, petroleum, food, lubricants, and other fluids; pressure valves used in the oil and natural gas industry, other industrial processes, and research facilities; and chemical injection pumping solutions for injection of chemicals into producing oil wells and pipelines. It also supplies pumps, hose reels, meters, valves, and accessories for fast oil change facilities, service garages, fleet service centers, automobile dealerships, auto parts stores, truck builders, and heavy equipment service centers; and systems, components, and accessories for the automatic lubrication of bearings, gears, and generators in industrial and commercial equipment, compressors, turbines, and on- and off-road vehicles. The company's Contractor segment offers sprayers to apply paint to walls and other structures; and viscous coatings to roofs, as well as markings on roads, parking lots, athletic fields, and floors. It sells its products through distributors, original equipment manufacturers, and home center channels; and directly to end-users. The company was incorporated in 1926 and is headquartered in Minneapolis, Minnesota.",Mr. Mark W. Sheahan J.D.,Industrial - Machinery,85.74,USD,14329983420,https://images.financialmodelingprep.com/symbol/GGG.png,931455,30.3,-0.7,1296589,678860000,486084000,"[{'period': '2024', 'revenue': 2110.0, 'unit': 'M', 'net_profit': 486.08}, {'period': '2023', 'revenue': 2200.0, 'unit': 'M', 'net_profit': 506.51}, {'period': '2022', 'revenue': 2140.0, 'unit': 'M', 'net_profit': 460.64}, {'period': '2021', 'revenue': 1990.0, 'unit': 'M', 'net_profit': 439.87}]","[{'period': ""Q1 '25"", 'revenue': 528.28, 'unit': 'M', 'net_profit': 124.1}, {'period': ""Q4 '24"", 'revenue': 548.67, 'unit': 'M', 'net_profit': 108.71}, {'period': ""Q3 '24"", 'revenue': 519.21, 'unit': 'M', 'net_profit': 122.2}, {'period': ""Q2 '24"", 'revenue': 553.24, 'unit': 'M', 'net_profit': 132.98}, {'period': ""Q1 '24"", 'revenue': 492.19, 'unit': 'M', 'net_profit': 122.2}, {'period': ""Q4 '23"", 'revenue': 566.64, 'unit': 'M', 'net_profit': 109.95}]",2.88,2.82,3139212000,1497441000,675336000,555077000,362533000,0,405808000,675336000,514963000,-0.011262858782422775,-0.04032883787321499,-0.04318936877076409,"[0.275, 2.5301]","['2025-04-14', '1985-01-03']",__nan__,0.17682048870863135
