,Symbol,Name,Last Sale,Net Change,% Change,Market Cap,Country,IPO Year,Volume,Sector,Industry,description__profile,ceo__profile,industry__profile,pe__quote,ebitda__income-statement,netIncome__income-statement,revenue__income-statement,eps__income-statement,epsdiluted__income-statement,totalAssets__balance-sheet-statement,totalLiabilities__balance-sheet-statement,cashAndShortTermInvestments__balance-sheet-statement,freeCashFlow__cash-flow-statement,growthEBITDA__income-statement-growth,growthNetIncome__income-statement-growth,growthEPS__income-statement-growth,derived__netIncomeMargin,derived__debtRatio
146,DISCA,Discovery Inc. Series A Common Stock,$36.25,-0.41,-1.118%,18317583780.0,United States,,6743505,Consumer Services,Television Services,"Discovery, Inc. operates as a media company in the United States and internationally. The company operates in two segments, U.S. Networks and International Networks. The company owns and operates various television networks under the Discovery Channel, TLC, Animal Planet, Investigation Discovery, Science Channel, MotorTrend, Food Network, HGTV, Travel Channel, TVN, DIY Network, Cooking Channel, Discovery Family Channel, American Heroes Channel, Destination America, Discovery Life, Discovery en Espanol, Discovery Familia, Great American Country, ID, the Oprah Winfrey Network, Eurosport, Discovery Kids, DMAX, and Discovery Home & Health brands, as well as other regional television networks. Its content spans genres, including survival, exploration, sports, lifestyle, general entertainment, home, food and travel, heroes, adventure, crime and investigation, health, and kids. The company also operates production studios that develop and produce content; and digital products and Websites. It provides content through various distribution platforms comprising pay-television, free-to-air and broadcast television, authenticated GO applications, digital distribution arrangements, and content licensing agreements, as well as various platforms that include brand-aligned Websites, online streaming, mobile devices, video on demand, and broadband channels. As of February 27, 2020, the company delivered approximately 8,000 hours of original programming each year in approximately 50 languages worldwide. Discovery, Inc. was founded in 1985 and is headquartered in Silver Spring, Maryland.",Mr. David Zaslav,Entertainment,30.304386,5471000000.0,1355000000.0,10671000000.0,2.6831683168316833,2.0163690476190474,34087000000.0,21704000000.0,2598000000.0,-402000000.0,0.20586290500330615,-0.34509424842919284,-0.0747695459201104,0.12697966451129228,0.6367236776483703
147,DISCB,Discovery Inc. Series B Common Stock,$77.88,-1.09,-1.38%,39353749649.0,United States,,2512,Consumer Services,Television Services,"Discovery, Inc. operates as a media company in the United States and internationally. The company operates in two segments, U.S. Networks and International Networks. The company owns and operates various television networks under the Discovery Channel, TLC, Animal Planet, Investigation Discovery, Science Channel, MotorTrend, Food Network, HGTV, Travel Channel, TVN, DIY Network, Cooking Channel, Discovery Family Channel, American Heroes Channel, Destination America, Discovery Life, Discovery en Espanol, Discovery Familia, Great American Country, ID, the Oprah Winfrey Network, Eurosport, Discovery Kids, DMAX, and Discovery Home & Health brands, as well as other regional television networks. Its content spans genres, including survival, exploration, sports, lifestyle, general entertainment, home, food and travel, heroes, adventure, crime and investigation, health, and kids. The company also operates production studios that develop and produce content; and digital products and Websites. It provides content through various distribution platforms comprising pay-television, free-to-air and broadcast television, authenticated GO applications, digital distribution arrangements, and content licensing agreements, as well as various platforms that include brand-aligned Websites, online streaming, mobile devices, video on demand, and broadband channels. As of February 27, 2020, the company delivered approximately 8,000 hours of original programming each year in approximately 50 languages worldwide. Discovery, Inc. was founded in 1985 and is headquartered in Silver Spring, Maryland.",Mr. David M. Zaslav,Entertainment,71.78156,4089000000.0,1219000000.0,10671000000.0,1.82,1.81,34087000000.0,22087000000.0,2091000000.0,2337000000.0,-0.09874366321357725,-0.4108264862252296,-0.37241379310344824,0.11423484209539875,0.6479596327045501
148,DISCK,Discovery Inc. Series C Common Stock,$31.84,-0.385,-1.195%,16089154967.0,United States,,3163153,Consumer Services,Television Services,"Discovery, Inc. operates as a media company in the United States and internationally. The company operates in two segments, U.S. Networks and International Networks. The company owns and operates various television networks under the Discovery Channel, TLC, Animal Planet, Investigation Discovery, Science Channel, MotorTrend, Food Network, HGTV, Travel Channel, TVN, DIY Network, Cooking Channel, Discovery Family Channel, American Heroes Channel, Destination America, Discovery Life, Discovery en Espanol, Discovery Familia, Great American Country, ID, the Oprah Winfrey Network, Eurosport, Discovery Kids, DMAX, and Discovery Home & Health brands, as well as other regional television networks. Its content spans genres, including survival, exploration, sports, lifestyle, general entertainment, home, food and travel, heroes, adventure, crime and investigation, health, and kids. The company also operates production studios that develop and produce content; and digital products and Websites. It provides content through various distribution platforms comprising pay-television, free-to-air and broadcast television, authenticated GO applications, digital distribution arrangements, and content licensing agreements, as well as various platforms that include brand-aligned Websites, online streaming, mobile devices, video on demand, and broadband channels. As of February 27, 2020, the company delivered approximately 8,000 hours of original programming each year in approximately 50 languages worldwide. Discovery, Inc. was founded in 1985 and is headquartered in Silver Spring, Maryland.",Mr. David M. Zaslav,Entertainment,28.370636,4537000000.0,2069000000.0,11144000000.0,2.9,2.88,33735000000.0,22211000000.0,1552000000.0,3110000000.0,0.1348174087043522,2.483164983164983,1.43131313131313,0.18566044508255564,0.658396324292278
149,DISH,DISH Network Corporation Class A Common Stock,$45.93,0.11,0.24%,24220957044.0,United States,1995.0,2963104,Consumer Services,Television Services,"DISH Network Corporation, together with its subsidiaries, provides pay-TV services in the United States. The company operates in two segments, Pay-TV and Wireless. It offers video services under the DISH TV brand; and programming packages that include programming through national broadcast networks, local broadcast networks, and national and regional cable networks, as well as regional and specialty sports channels, premium movie channels, and Latino and international programming packages. The company also provides access to movies and TV shows through TV or Internet-connected tablets, smartphones, and computers; and dishanywhere.com and mobile applications for smartphones and tablets to view authorized content, search program listings, and remotely control certain features. In addition, it offers Sling TV services, including Sling International, Sling Latino, Sling Orange, and Sling Blue services that require an Internet connection and are available on streaming-capable devices, such as TVs, tablets, computers, game consoles, and smart phones primarily to consumers who do not subscribe to traditional satellite and cable pay-TV services. As of December 31, 2019, it had 11.986 million Pay-TV subscribers. The company offers receiver systems and programming through direct sales channels, small satellite retailers, direct marketing groups, local and regional consumer electronics stores, retailers, and telecommunications companies. DISH Network Corporation was founded in 1980 and is headquartered in Englewood, Colorado.",Mr. W. Erik Carlson,Entertainment,11.658499,3653585000.0,1762673000.0,15493435000.0,3.674861411383551,3.674861411383551,38239947000.0,24459302000.0,3733045000.0,1071728000.0,0.4559288418631471,0.2594911654919715,0.2585141819806678,0.11376902539688584,0.6396269848386558
150,DKNG,DraftKings Inc. Class A Common Stock,$51.89,-4.29,-7.636%,20636911879.0,United States,2019.0,27257364,Consumer Services,Services-Misc. Amusement & Recreation,"DraftKings Inc. operates as a digital sports entertainment and gaming company in the United States. The company provides users with daily sports, sports betting, and iGaming opportunities. It is also involved in the design and development of sports betting and casino gaming platform software for online and retail sportsbook, and casino gaming products. The company distributes its product offerings through various channels, including traditional websites, direct app downloads, and direct-to-consumer digital platforms. DraftKings Inc. is headquartered in Boston, Massachusetts.",Mr. Jason D. Robins,Gambling,,-765846000.0,-844270000.0,614532000.0,-21.10675,-21.10675,3439329000.0,742540000.0,1817258000.0,-385571000.0,4.7621831478680905,4.914988720276878,44.88384014052052,-1.3738422083797102,0.21589676358382695
151,DLTR,Dollar Tree Inc. Common Stock,$115.70,1.02,0.889%,27074911877.0,United States,1995.0,1124289,Consumer Services,Department/Specialty Retail Stores,"Dollar Tree, Inc. operates discount variety retail stores. It operates through two segments, Dollar Tree and Family Dollar. The Dollar Tree segment offers merchandise at the fixed price of $1.00. It provides consumable merchandise, including candy and food, and health and beauty care, as well as everyday consumables, such as household paper and chemicals, and frozen and refrigerated food; variety merchandise comprising toys, durable housewares, gifts, stationery, party goods, greeting cards, softlines, and other items; and seasonal goods that include Valentine's Day, Easter, Halloween, and Christmas merchandise. This segment operates 7,505 stores under the Dollar Tree and Dollar Tree Canada brands, as well as 13 distribution centers in the United States and 2 in Canada; and a store support center in Chesapeake, Virginia. The Family Dollar segment operates general merchandise discount retail stores that offer consumable merchandise, which comprise food and beverages, tobacco, health and beauty aids, household chemicals, paper products, hardware and automotive supplies, diapers, batteries, and pet food and supplies; and home products, including housewares, home décor, and giftware, as well as domestics, such as comforters, sheets, and towels. Its stores also provides apparel and accessories merchandise comprising clothing, fashion accessories, and shoes; and seasonal and electronics merchandise that include Valentine's Day, Easter, Halloween, and Christmas merchandise, as well as personal electronics, which comprise pre-paid cellular phones and services, stationery and school supplies, and toys. This segment operates 7,783 stores under the Family Dollar brand; and 11 distribution centers. The company was founded in 1986 and is headquartered in Chesapeake, Virginia.",Mr. Gary Philbin,Discount Stores,19.40708,2574500000.0,1341900000.0,25509300000.0,5.68,5.65,20696000000.0,13410700000.0,1416700000.0,1817500000.0,0.34960159362549803,0.6226118500604595,0.6366895073218803,0.052604344297961916,0.6479851178971782
152,DNLI,Denali Therapeutics Inc. Common Stock,$53.97,0.53,0.992%,6529511067.0,United States,2017.0,441459,Health Care,Biotechnology: Biological Products (No Diagnostic Substances),"Denali Therapeutics Inc., a biopharmaceutical company, discovers and develops therapeutic candidates for neurodegenerative diseases in the United States. The company offers leucine-rich repeat kinase 2 (LRRK2) inhibitor product candidates, including DNL201 that has completed Phase 1b clinical trials and DNL151, which are in Phase 1 and Phase 1b clinical trials for Parkinson's disease. It is also developing receptor interacting serine/threonine protein kinase 1 (RIPK1) product candidates, such as DNL747, a selective and brain-penetrant small molecule RIPK1 inhibitor product candidate that is in Phase 1b clinical trial for Alzheimer's disease and amyotrophic lateral sclerosis (ALS). In addition, the company develops enzyme transport vehicle: iduronate 2-sulfatase, an enzyme replacement therapy program for MPS II, a lysosomal storage disorder; antibody transport vehicle (ATV): alpha-synuclein (aSyn) program, a protein that spreads throughout the brain in Parkinson's disease; ATV: triggering receptor expressed in myeloid cells 2, a therapeutic candidate designed to rescue microglial function in Alzheimer's disease; and ATV: Tau, a therapeutic targeting the spreading of Tau. Further, it has various seed programs under the research, discovery, and preclinical stages of development. Denali Therapeutics Inc. has collaboration agreement with Takeda Pharmaceutical Company and Genentech, Inc., Sanofi, F-star Gamma Limited, F-star Biotechnologische Forschungs-Und Entwicklungsges M.B.H, F-star Biotechnology Limited, SIRION Biotech GmbH, Genzyme Corporation, Harvard University, the Michael J. Fox Foundation, Centogene, and MedGenome Labs Private Ltd; and a research and option agreement with Secarna Pharmaceuticals GmbH & Co. KG. to develop antisense therapies in the field of neurodegenerative diseases. The company was formerly known as SPR Pharma Inc. and changed its name to Denali Therapeutics Inc. in March 2015. Denali Therapeutics Inc. was incorporated in 2013 and is headquartered in South San Francisco, California.",Mr. Ryan Watts,Biotechnology,109.02438,71249000.0,71136000.0,335659000.0,0.7440365371140519,0.7440365371140519,1604280000.0,453749000.0,1469697000.0,413057000.0,-1.347229193978352,-1.359974495734108,-1.3594379406348076,0.2119293687939248,0.28283653726282193
153,DOCU,DocuSign Inc. Common Stock,$193.62,-2.85,-1.451%,37669955180.0,United States,2018.0,4608725,Technology,EDP Services,"DocuSign, Inc. provides cloud based software in the United States and internationally. The company provides e-signature solution that enables businesses to digitally prepare, execute, and act on agreements. It also offers DocuSign CLM, which automates workflows across the entire agreement process; Intelligent Insights that use artificial intelligence to search and analyze agreements by legal concepts and clauses; Gen for Salesforce, which allows sales representatives to automatically generate agreements with a few clicks from within Salesforce; and Negotiate for Salesforce that supports for approvals, document comparisons, and version control. In addition, the company provides Guided Forms, which enable complex forms to be filled via an interactive and step-by-step process; Click that supports no-signature-required agreements for standard terms and consents; Identify, a signer-identification option for checking government-issued IDs; Standards-Based Signatures, which support signatures that involve digital certificates; Payments that enables customers to collect signatures and payment; and eNotary, which offers the ability to execute electronic notarial acts. Further, it offers industry-specific cloud offerings, including Rooms for Real Estate that provides a way for brokers and agents to manage the entire real estate transaction digitally; Rooms for Mortgage, which offers digital workspace to create and close mortgages; FedRAMP, an authorized version of DocuSign eSignature for U.S. federal government agencies; and life sciences modules that support compliance with the electronic signature practices. The company sells its products through direct, partner-assisted, and Web-based sales. It serves enterprise, commercial, and small businesses, such as professionals, sole proprietorships, and individuals. The company was founded in 2003 and is headquartered in San Francisco, California.",Mr. Daniel Springer,Software Application,,-102765000.0,-243267000.0,1453047000.0,-1.31,-1.31,2336507000.0,2010770000.0,773505000.0,214559000.0,-0.28300320246708577,0.16753775934804832,0.11016949152542384,-0.1674185349820068,0.8605880487411337
154,DRNA,Dicerna Pharmaceuticals Inc. Common Stock,$26.67,-1.83,-6.421%,2043321757.0,United States,2014.0,1007534,Health Care,Biotechnology: Commercial Physical & Biological Resarch,"Dicerna Pharmaceuticals, Inc., a biopharmaceutical company, focuses on the discovery and development of ribonucleic acid interference (RNAi)-based pharmaceuticals. The company develops pharmaceuticals using its GalXC RNAi platform for the treatment of diseases involving the liver, including rare diseases, viral infectious diseases, chronic liver diseases, and cardiometabolic diseases. Its principal development programs include nedosiran for the treatment of primary hyperoxaluria; RG6346 for the treatment of chronic hepatitis B virus infection; and a program for an undisclosed rare liver disease. The company's development programs also comprise DCR-A1AT programs; and a program for the treatment of neurodegeneration and pain. Dicerna Pharmaceuticals, Inc. has strategic collaborations with Novo Nordisk A/S, Roche, Eli Lilly and Company, Alnylam Pharmaceuticals, Inc., Alexion Pharmaceuticals, Inc., and Boehringer Ingelheim International GmbH. The company was founded in 2006 and is headquartered in Lexington, Massachusetts.",Dr. Douglas Fambrough,Biotechnology,,-110991000.0,-112747000.0,164307000.0,-1.52,-1.52,707846000.0,570092000.0,568843000.0,163365000.0,-0.1255869284341222,-0.06402178334537062,-0.13636363636363635,-0.6861971796697646,0.805389872938464
155,DSEY,Diversey Holdings Ltd. Ordinary Shares,$17.31,0.1,0.581%,5262384660.0,United States,2021.0,630817,Consumer Durables,Specialty Chemicals,"Diversey Holdings, Ltd., through its subsidiaries, provides infection prevention and cleaning solutions in Europe, North America, Latin America, the Asia Pacific, and the Middle East and Africa. It operates through two segments, Institutional; and Food and Beverage. The company manufactures, markets, and sells infection prevention and personal care products; floor and building care chemicals; kitchen and mechanical ware wash chemicals, and machines; dosing and dispensing equipment; and floor care machines to healthcare, education, food service, retail and grocery, hospitality, and building service contractors industries. It also provides a range of engineering, consulting, and training services related to productivity management, water and energy management, and risk management. In addition, the company offers chemical products; engineering and equipment solutions; training; and knowledge-based services, as well as water treatment services to brewing, beverage, dairy, processed foods, pharmaceutical, and agriculture industries. Diversey Holdings, Ltd. was founded in 1923 and is headquartered in Northampton, United Kingdom.",Mr. Philip Robert Wieland,Personal Services,,,,,,,,,,,,,,,
156,DXCM,DexCom Inc. Common Stock,$357.34,-8.6,-2.35%,34556876658.0,United States,2005.0,870200,Health Care,Medical/Dental Instruments,"DexCom, Inc., a medical device company, focuses on the design, development, and commercialization of continuous glucose monitoring (CGM) systems in the United States and internationally. The company offers its systems for use by people with diabetes, as well as for use by healthcare providers. Its products include DexCom G6, a CGM system for diabetes management; DexCom G5 mobile CGM system to communicate directly to patient's mobile device; DexCom G4 PLATINUM system for continuous use by adults with diabetes; and DexCom Share, a remote monitoring system. DexCom, Inc. has a collaboration and license agreement with Verily Life Sciences LLC and Verily Ireland Limited to develop a series of next-generation CGM products; and a collaboration with Companion Medical, Inc. The company markets its products directly to endocrinologists, physicians, and diabetes educators. DexCom, Inc. was founded in 1999 and is headquartered in San Diego, California.",Mr. Kevin Sayer,Diagnostics & Research,62.51681,366600000.0,493600000.0,1926700000.0,5.418221734357848,5.418221734357848,4290500000.0,2464000000.0,2707700000.0,276600000.0,0.9193717277486911,3.8822947576656777,3.8812808417638283,0.2561893392847875,0.574292040554714
157,EA,Electronic Arts Inc. Common Stock,$141.34,3.48,2.524%,40653062656.0,United States,,1957324,Technology,Computer Software: Prepackaged Software,"Electronic Arts Inc. develops, markets, publishes, and distributes games, content, and services for game consoles, PCs, mobile phones, and tablets worldwide. The company develops and publishes games and services across various genres, such as sports, first-person shooter, action, role-playing, and simulation primarily under the Battlefield, The Sims, Apex Legends, Need for Speed, and Plants v. Zombies brands; and license games from others, including FIFA, Madden NFL, and Star Wars brands. It also provides advertising services; and licenses its games to third parties to distribute and host its games. The company markets and sells its games and services through digital distribution and retail channels, as well as directly to mass market retailers, specialty stores, and distribution arrangements. It has a strategic partnership with KLab Inc. for game development and operation. Electronic Arts Inc. was founded in 1982 and is headquartered in Redwood City, California.",Mr. Andrew Wilson,Electronic Gaming & Multimedia,47.91986,1472000000.0,3039000000.0,5537000000.0,10.37,10.3,11112000000.0,3651000000.0,5735000000.0,1657000000.0,0.4249757986447241,1.9823356231599607,2.0863095238095237,0.5488531695864186,0.3285637149028078
158,EBAY,eBay Inc. Common Stock,$58.82,0.58,0.996%,40071809430.0,United States,1998.0,7582577,Consumer Services,Catalog/Specialty Distribution,"eBay Inc. operates the marketplace and classifieds platforms that connect buyers and sellers worldwide. Its Marketplace platform includes its online marketplace at ebay.com and the eBay suite of mobile apps; and Classifieds platform comprises a collection of brands, such as Mobile.de, Kijiji, Gumtree, Marktplaats, eBay Kleinanzeigen, and others that offer online classifieds to help people find what they are looking for in their local communities. Its platforms enable users to list, buy, sell, and pay for items through various online, mobile, and offline channels that include retailers, distributors, liquidators, import and export companies, auctioneers, catalog and mail-order companies, classifieds, directories, search engines, commerce participants, shopping channels, and networks. The company was founded in 1995 and is headquartered in San Jose, California.",Mr. Scott Schenkel,Retail Apparel & Specialty,14.962405,2738000000.0,5667000000.0,10271000000.0,7.98,7.89,19310000000.0,15749000000.0,3826000000.0,1925000000.0,0.15576192486281132,2.1730123180291154,2.793404255319143,0.551747638983546,0.8155877783531849
159,EBC,Eastern Bankshares Inc. Common Stock,$22.20,0.2,0.909%,4146031019.0,United States,2020.0,753503,Finance,Major Banks,"Eastern Bankshares, Inc. provides commercial banking products and services primarily to retail, commercial, and small business customers. The company offers interest-bearing and non interest-bearing checking deposits, money market deposits, savings deposits, and certificates of deposits. It also offers commercial and industrial loans, commercial real estate and construction loans, business banking loans, residential real estate loans, and home equity and other consumer loans. Its personal banking products and services also include debit and credit cards; mortgage and personal loans; personal and cash reserve lines of credit; auto and student loans; retirement planning products and services; and online learning services in the areas of finance. The company's business banking products and services also include preferred term loans, small business administration loans, lines of credit, cash reserves, cash management, merchant services, escrow express service, correspondent and government banking, international banking, interest on lawyers trust accounts services, products and services for not-for-profit and healthcare, and business telephone banking. In addition, it offers trust and investment products and services; community development and asset-based lending services; financial planning, portfolio management, wealth management, private banking, and fiduciary and retirement products and services; and treasury management, electronic banking, interest rate protection, and foreign exchange products and services. Further, the company acts as an independent insurance agent and offers commercial, personal, and employee benefits insurance products to individual and commercial clients. It operates through 89 banking offices located in eastern Massachusetts and southern and coastal New Hampshire. Eastern Bankshares, Inc. was formerly known as Eastern Bank Corporation. The company was founded in 1818 and is headquartered in Boston, Massachusetts.",Mr. Robert F. Rivers,Banks,,3261449.0,22738000.0,579624000.0,0.10823256965825906,0.10823256965825906,15964190000.0,12536138000.0,5237931000.0,64707000.0,0.0,-0.8316925491124961,-0.8316923826271428,0.039228879411480545,0.7852661487992814
