,Symbol,Name,Last Sale,Net Change,% Change,Market Cap,Country,IPO Year,Volume,Sector,Industry,description__profile,ceo__profile,industry__profile,pe__quote,ebitda__income-statement,netIncome__income-statement,revenue__income-statement,eps__income-statement,epsdiluted__income-statement,totalAssets__balance-sheet-statement,totalLiabilities__balance-sheet-statement,cashAndShortTermInvestments__balance-sheet-statement,freeCashFlow__cash-flow-statement,growthEBITDA__income-statement-growth,growthNetIncome__income-statement-growth,growthEPS__income-statement-growth,derived__netIncomeMargin,derived__debtRatio
289,LOGI,Logitech International S.A. Ordinary Shares,$111.87,-0.94,-0.833%,18828504090.0,United States,1997.0,442072,Technology,Computer peripheral equipment,"Logitech International S.A., through its subsidiaries, designs, manufactures, and markets products that helps people connect to digital and cloud experiences. The company offers pointing devices, such as wireless mouse and trackball; corded and cordless keyboards, living room keyboards, and keyboard-and-mouse combinations; PC webcams; and keyboards for tablets and smartphones, as well as other accessories for mobile devices. It also provides keyboards, mice, headsets, and simulation products, such as steering wheels and flight sticks for gamers; video conferencing products, and controllers for video conferencing room solutions; portable wireless Bluetooth and Wi-Fi speakers, PC speakers, PC headsets, in-ear headphones, and wireless audio wearables; home entertainment controllers for smart home devices comprising lighting, thermostats and door locks, and home security cameras. The company sells its products through a network of distributors, retailers, and e-tailers under the Logitech, Logitech G, ASTRO Gaming, Streamlabs, Ultimate Ears, Jaybird, and Blue Microphones brands. Its channel network includes consumer electronics distributors, retailers, mass merchandisers, specialty stores, computer and telecommunications stores, value-added resellers, and online merchants. The company was founded in 1981 and is headquartered in Lausanne, Switzerland.",Mr. Bracken Darrell,Computer Hardware,19.201452,350246000.0,449723000.0,2975851000.0,2.6955831140574333,2.655097088811614,2363474000.0,874206000.0,715566000.0,385516000.0,0.05864075322280826,0.7460021042578221,0.7331506948940214,0.15112416582685087,0.36988179264929505
290,LPLA,LPL Financial Holdings Inc. Common Stock,$156.54,0.16,0.102%,12511619640.0,United States,2010.0,415379,Finance,Investment Bankers/Brokers/Service,"LPL Financial Holdings Inc., together with its subsidiaries, provides an integrated platform of brokerage and investment advisory services to independent financial advisors and financial advisors at financial institutions in the United States. Its brokerage offerings include variable and fixed annuities, mutual funds, equities, retirement and education savings plans, fixed income, and insurance, as well as alternative investments, such as non-traded real estate investment trusts and business development companies. The company also provides advisory platforms that provide access to mutual funds, exchange-traded funds, stocks, bonds, certain option strategies, unit investment trusts, and institutional money managers and no-load multi-manager variable annuities. In addition, it offers cash sweep programs; and retirement solutions for commission-and fee-based services that allow advisors to provide brokerage services, consultation, and advice to retirement plan sponsors. Further, the company provides other services comprising tools and services that enable advisors to maintain and grow their practices; trust, investment management oversight, and custodial services to trusts for estates and families, as well as insurance brokerage general agency services; and technology products, such as proposal generation, investment analytics, and portfolio modeling. The company was formerly known as LPL Investment Holdings Inc. and changed its name to LPL Financial Holdings Inc. in June 2012. LPL Financial Holdings Inc. was founded in 1989 and is based in San Diego, California.",Mr. Dan Arnold,Capital Markets,26.907219,177821838.0,472640000.0,1997543000.0,5.72536098459153,5.72536098459153,6523571000.0,5208717000.0,808612000.0,634409000.0,0.0,-0.15581910409373437,-0.15555147719888937,0.23661067621573104,0.7984456672580095
291,LPRO,Open Lending Corporation Class A Common Stock,$38.65,0.61,1.604%,4469868983.0,United States,,797624,Finance,Finance: Consumer Services,"Open Lending Corporation provides lending enablement and risk analytics solutions to financial institutions in the United States. The company, through its flagship product, Lenders Protection, offers loan analytics, risk-based pricing, risk modeling, and default insurance, ensuring profitable auto loan portfolios for financial institutions. Open Lending Corporation was founded in 2000 and is based in Austin, Texas.",Mr. John Joseph Flynn,Shell Companies,,58485000.0,-97564000.0,108892000.0,-0.8483826086956522,-0.8483826086956522,294009000.0,267387000.0,101513000.0,23444000.0,0.0,0.0,0.0,-0.8959703192153694,0.9094517514769956
292,LPSN,LivePerson Inc. Common Stock,$50.51,-1.48,-2.847%,3478424842.0,United States,2000.0,1082324,Technology,EDP Services,"LivePerson, Inc. provides conversational commerce solutions. The company operates in two segments, Business and Consumer. The Business segment enables brands to leverage LiveEngage's intelligence engine to connect with consumers through an integrated suite of mobile and online business messaging technologies. The Consumer segment facilitates online transactions between independent service providers and individual consumers seeking information and knowledge through mobile and online messaging. The company offers LiveEngage, an enterprise-class and cloud-based platform, which enables businesses and consumers to connect through conversational interfaces. It also provides professional services and value-added business consulting services. The company sells its products through direct and indirect sales channels to Fortune 500 companies, Internet businesses, online merchants, small businesses, automotive dealers, universities, libraries, government agencies, and not-for-profit organizations. It operates in the United States, Canada, Latin America, South America, Europe, the Middle East, Africa, and the Asia-Pacific region. The company has strategic partnerships with TTEC that focuses on customer experience; and DMI to redefine customer experience with digital engagement, messaging, and artificial intelligence driven automation. LivePerson, Inc. was founded in 1995 and is headquartered in New York, New York.",Mr. Robert LoCascio,Software Application,,-58153000.0,-107594000.0,366620000.0,-1.7189454940235673,-1.7189454940235673,1006432000.0,762498000.0,654152000.0,-8036000.0,-0.3010036660857023,0.11994254249461336,0.12349378694350978,-0.29347553324968634,0.7576249562811993
293,LRCX,Lam Research Corporation Common Stock,$617.44,6.44,1.054%,88058888994.0,United States,1984.0,1190492,Technology,Industrial Machinery/Components,"Lam Research Corporation designs, manufactures, markets, refurbishes, and services semiconductor processing equipment used in the fabrication of integrated circuits in the United States, China, Europe, Japan, Korea, Taiwan, and the southeast Asia. The company offers ALTUS systems to deposit conformal films for tungsten metallization applications; SABRE electrochemical deposition products for copper damascene manufacturing; SOLA ultraviolet thermal processing products for film treatments; and VECTOR plasma-enhanced CVD ALD products. It also provides SPEED gapfill high-density plasma chemical vapor deposition (HDP-CVD) products; and Striker single-wafer atomic layer deposition (ALD) products that provide multiple dielectric film solutions. In addition, the company offers Flex for dielectric etch applications; Kiyo for conductor etch applications; Syndion for through-silicon via etch applications; and Versys metal products for metal etch processes. Further, it provides Coronus bevel clean products to enhance die yield; Da Vinci, DV-Prime, EOS, and SP to address a range of wafer cleaning applications; and Metryx mass metrology systems for high precision in-line mass measurement in semiconductor wafer manufacturing. Lam Research Corporation was founded in 1980 and is headquartered in Fremont, California.",Mr. Timothy Archer,Semiconductor Equipment & Materials,25.032555,2942327000.0,2251753000.0,10044736000.0,15.549277003604624,15.103313434838018,14559047000.0,9386553000.0,6710252000.0,1923212000.0,0.06067527441291731,0.027526774754384125,0.08206520553963814,0.22417244216274076,0.6447230371603306
294,LSCC,Lattice Semiconductor Corporation Common Stock,$49.52,0.96,1.977%,6751988862.0,United States,,1516751,Technology,Semiconductors,"Lattice Semiconductor Corporation, together with its subsidiaries, develops and sells semiconductor technologies in Asia, Europe, and the Americas. The company offers field programmable gate arrays that consist of five product family lines, including the ECP, MachXO, iCE40, and CrossLink, as well as power and thermal management products; and development kits and boards. It also provides video connectivity application specific standard products, such as port processors, port controllers, video processors, transmitters, receivers, bridges, and converters for use in mobile devices, set-top-boxes, UHD TVs, home theater systems, PCs, projectors, and monitors; and various software tools, such as Lattice Diamond design software, radiant software, iCEcube2 design software, ispLEVER classic software, neural network compiler, LatticeMico system development tools, PAC-designer, programmer and deployment tools, and ORCAstra, a PC-based graphical user interface. In addition, the company licenses its technology portfolio through standard IP and IP core licensing, patent monetization, and IP services. It sells its products directly to end customers, and indirectly through a network of independent manufacturers' representatives and independent distributors. The company primarily serves original equipment manufacturers in the communications and computing, consumer, and industrial and automotive end markets. Lattice Semiconductor Corporation was founded in 1983 and is headquartered in Hillsboro, Oregon.",Mr. James Anderson,Semiconductors,115.57457,77506000.0,47392000.0,408120000.0,0.35130427047582335,0.3366793830765187,680067000.0,295640000.0,182332000.0,91687000.0,-0.15843078493327686,0.08964660979927805,0.10880999424241082,0.11612270900715475,0.4347218729919258
295,LSXMA,Liberty Media Corporation Series A Liberty SiriusXM Common Stock,$42.50,-0.74,-1.711%,16005548238.0,United States,,952678,Consumer Services,Broadcasting,"The Liberty SiriusXM Group, through its subsidiary, Sirius XM Holdings Inc., transmits music, sports, entertainment, comedy, talk, news, traffic, and weather channels in the United States and Canada. The company also provides infotainment services; and streaming services through applications for mobile and home devices, and other consumer electronic equipment, as well as online. In addition, it offers connected vehicle services; and Travel Link, a suite of data services that include graphical weather, fuel prices, sports schedules and scores, and movie listings. Further, the company engages in the direct sale of satellite radios and accessories. It distributes its satellite radios through automakers, as well as through its retailers and Website; and provides satellite radio services to customers of rental car companies. As of December 31, 2018, it had approximately 34 million subscribers. The company is based in Englewood, Colorado. The Liberty SiriusXM Group is a subsidiary of Liberty Media Corporation.",None,Broadcasting,,-119917000.0,0.0,178000000.0,0.0,0.0,44004000000.0,24403000000.0,3849000000.0,1278000.0,-1.0472114173228346,-1.0,-1.0,0.0,0.5545632215253159
296,LSXMB,Liberty Media Corporation Series B Liberty SiriusXM Common Stock,$46.49,0.0,0.00%,17508186766.0,United States,,68,Consumer Services,Broadcasting,"The Liberty SiriusXM Group, through its subsidiary, Sirius XM Holdings Inc., transmits music, sports, entertainment, comedy, talk, news, traffic, and weather channels in the United States and Canada. The company also provides infotainment services; and streaming services through applications for mobile and home devices, and other consumer electronic equipment, as well as online. In addition, it offers connected vehicle services; and Travel Link, a suite of data services that include graphical weather, fuel prices, sports schedules and scores, and movie listings. Further, the company engages in the direct sale of satellite radios and accessories. It distributes its satellite radios through automakers, as well as through its retailers and Website; and provides satellite radio services to customers of rental car companies. As of December 31, 2018, it had approximately 34 million subscribers. The company is based in Englewood, Colorado. The Liberty SiriusXM Group is a subsidiary of Liberty Media Corporation.",None,Broadcasting,,2531000000.0,0.0,10292000000.0,6.0,6.0,44189000000.0,22264000000.0,2847000000.0,1803000000.0,0.04803312629399586,-1.0,-0.4237288135593246,0.0,0.503835796238883
297,LSXMK,Liberty Media Corporation Series C Liberty SiriusXM Common Stock,$42.77,-0.48,-1.11%,16107230544.0,United States,,1066459,Consumer Services,Broadcasting,"The Liberty SiriusXM Group, through its subsidiary, Sirius XM Holdings Inc., transmits music, sports, entertainment, comedy, talk, news, traffic, and weather channels in the United States and Canada. The company also provides infotainment services; and streaming services through applications for mobile and home devices, and other consumer electronic equipment, as well as online. In addition, it offers connected vehicle services; and Travel Link, a suite of data services that include graphical weather, fuel prices, sports schedules and scores, and movie listings. Further, the company engages in the direct sale of satellite radios and accessories. It distributes its satellite radios through automakers, as well as through its retailers and Website; and provides satellite radio services to customers of rental car companies. As of December 31, 2018, it had approximately 34 million subscribers. The company is based in Englewood, Colorado. The Liberty SiriusXM Group is a subsidiary of Liberty Media Corporation.",None,Broadcasting,,2540000000.0,106000000.0,10292000000.0,2.0784313725490198,1.7377049180327868,44189000000.0,27894000000.0,1575000000.0,1803000000.0,0.051759834368530024,-0.800376647834275,-0.8003766478342756,0.010299261562378547,0.6312430695421938
298,LYFT,Lyft Inc. Class A Common Stock,$49.80,-2.83,-5.377%,16401536974.0,United States,2019.0,14926128,Technology,EDP Services,"Lyft, Inc. operates a peer-to-peer marketplace for on-demand ridesharing in the United States and Canada. The company offers riders, personalized and on-demand access to various transportation options. It provides Ridesharing Marketplace, which enable drivers to provide their transportation services to riders. The company also offers a network of shared bikes and scooters in various cities to address the needs of riders for shorter routes; Express Drive program, a flexible car rentals program that connects drivers who need access to a car with third-party rental car companies; and concierge for organizations to manage the transportation needs of their customers and employees. In addition, it integrates third-party public transit data into the Lyft app to offer riders various transportation options; offers various enterprise programs, including monthly ride credits for daily commutes, supplementing public transit by providing rides for the first and last leg of commute trips, late-night rides home, and shuttle replacement rides; and provides transportation solutions that can be customized for events, such as recruiting events, conferences, celebrations, meetings, and company retreats. The company was formerly known as Zimride, Inc. and changed its name to Lyft, Inc. in April 2013. Lyft, Inc. was incorporated in 2007 and is headquartered in San Francisco, California.",Mr. Logan Green,Software Application,,-1651029000.0,-1752857000.0,2364681000.0,-7.704933669746548,-7.704933669746548,4678964000.0,3002801000.0,2251068000.0,-1472538000.0,-0.36353255969138615,-0.32640481800109983,-0.32649181208509176,-0.7412657352091043,0.6417662114946813
299,MANH,Manhattan Associates Inc. Common Stock,$132.08,-1.82,-1.359%,8402581041.0,United States,1998.0,433916,Technology,Computer Software: Prepackaged Software,"Manhattan Associates, Inc. develops, sells, deploys, services, and maintains software solutions to manage supply chains, inventory, and omni-channel operations for retailers, wholesalers, manufacturers, logistics providers, and other organizations. The company offers Manhattan SCALE, a portfolio of logistics execution solutions that provide trading partner management, yard management, optimization, warehouse management, and transportation execution services; and Manhattan Active, a set of enterprise and store omni-channel solutions. It also provides inventory optimization and planning solutions; maintenance services comprising customer support services and software enhancements; professional services, such as solutions planning and implementation, and related consulting services; and training and change management services. In addition, the company resells computer hardware, radio frequency terminal networks, radio frequency identification chip readers, bar code printers and scanners, and other peripherals. It offers products through direct sales personnel, as well as through partnership agreements with various organizations. The company operates in the Americas, Europe, the Middle East, Africa, and the Asia Pacific. Manhattan Associates, Inc. was founded in 1990 and is headquartered in Atlanta, Georgia.",Mr. Eddie Capel,Software Application,97.19117,123007000.0,87240000.0,586372000.0,1.37,1.36,465412000.0,246515000.0,204705000.0,138155000.0,-0.0072955589092171,0.017233739884797462,0.030075187969924838,0.14877927322587026,0.5296704855053157
300,MANT,ManTech International Corporation Common Stock $0.01 Par Value,$83.86,0.89,1.073%,3404340978.0,United States,2002.0,212121,Technology,EDP Services,"ManTech International Corporation provides technology solutions and services for U.S. defense, intelligence community, and federal civilian agencies worldwide. The company offers cyber solutions and services, including security operations, threat intelligence, incident response and forensics, boundary defense, security systems engineering, infrastructure security, and computer forensics and exploitation. It also provides solutions involving hardware and software to support the technology infrastructure for various applications, including IT service management, help desk, data center consolidation, enterprise architecture, mobile computing and device management, network operations and infrastructure, virtualization/cloud computing and migration, network and database administration, enterprise systems development and management, infrastructure as a managed service, and data collection and analytics; and designs, develops, integrates, operates, and sustains software applications and systems. In addition, the company offers professional and technical solutions, and mission support services; command-and-control infrastructure, intelligence, surveillance and reconnaissance platforms and sensors, and data services; and vulnerability assessment, insider threat protection, exposure analysis, secrecy architecture design, security policy development and implementation, lifecycle acquisition program security, anti-tamper, export compliance support, foreign disclosure, system security engineering, security awareness and training, security support services, and technical certification and accreditation services. Further, it provides requirement analysis, development, and management; systems development and integration; enterprise architecture and concept of operations; systems engineering and technical assistance; test and evaluation; training; and supply chain management and logistics services. The company was founded in 1968 and is headquartered in Herndon, Virginia.",Mr. Kevin Phillips,Software Application,28.030151,228349000.0,120530000.0,2518384000.0,2.99,2.97,2213664000.0,634252000.0,41193000.0,170922000.0,0.17582027146711704,0.05830187022565633,0.0491228070175439,0.04786005629006537,0.2865168336296746
301,MAR,Marriott International Class A Common Stock,$142.59,-1.92,-1.329%,46421312796.0,United States,,2179993,Consumer Services,Hotels/Resorts,"Marriott International, Inc. operates, franchises, and licenses hotel, residential, and timeshare properties worldwide. The company operates through North American Full-Service, North American Limited-Service, and Asia Pacific segments. It operates its properties under the JW Marriott, The Ritz-Carlton, Ritz-Carlton Reserve, W Hotels, The Luxury Collection, St. Regis, EDITION, Bulgari, Marriott Hotels, Sheraton, Delta Hotels, Marriott Executive Apartments, Marriott Vacation Club, Westin, Renaissance, Le Méridien, Autograph Collection, Gaylord Hotels, Tribute Portfolio, Design Hotels, Courtyard, Residence Inn, Fairfield by Marriott, SpringHill Suites, Four Points, TownePlace Suites, Aloft, AC Hotels by Marriott, Protea Hotels, Element, and Moxy brand names. As of October 07, 2020, it operated approximately 7,400 properties under 30 hotel brands in 135 countries and territories. Marriott International, Inc. was founded in 1927 and is headquartered in Bethesda, Maryland.",Mr. Arne Sorenson,Lodging,,697000000.0,-267000000.0,10571000000.0,-0.8025247971145176,-0.8025247971145176,24701000000.0,24271000000.0,877000000.0,1504000000.0,-0.6941641070645019,-1.2097407698350353,-1.2095365005520935,-0.025257780720840034,0.982591797902919
302,MARA,Marathon Digital Holdings Inc. Common Stock,$31.40,-2.15,-6.408%,3102465570.0,United States,,13874266,Finance,Investment Managers,"Marathon Patent Group, Inc. operates as a digital asset technology company that mines cryptocurrencies. It owns cryptocurrency mining machines and a data center to mine digital assets in Quebec, Canada. The company was formerly known as American Strategic Minerals Corporation and changed its name to Marathon Patent Group, Inc. in February 2013. Marathon Patent Group, Inc. was founded in 2010 and is headquartered in Las Vegas, Nevada.",Mr. Merrick Okamoto,Capital Markets,31.09875,-5800604.0,-10447771.0,4357443.0,-0.13,-0.13,313251239.0,1506275.0,143594432.0,-91163611.0,1.1372785844140818,1.9705936626135712,-0.7547169811320755,-2.3976839169210016,0.00480852048601155
303,MASI,Masimo Corporation Common Stock,$221.45,0.12,0.054%,12179845666.0,United States,2007.0,290428,Health Care,Medical/Dental Instruments,"Masimo Corporation, a medical technology company, develops, manufactures, and markets noninvasive monitoring technologies and hospital automation solutions worldwide. The company offers Masimo Signal Extraction Technology (SET) pulse oximetry with measure-through motion and low perfusion pulse oximetry monitoring to address the primary limitations of conventional pulse oximetry. It also provides Masimo rainbow SET platform that includes rainbow SET Pulse CO-Oximetry products that noninvasively monitor hemoglobin species, including oxygen saturation, pulse rate, perfusion index, pleth variability index, and respiration rate from the pleth; noninvasively monitor hemoglobin concentration, and carboxyhemoglobin and methemoglobin; monitor arterial oxygen saturation and acoustic respiration rate; and calculates oxygen content and oxygen reserve index. In addition, the company offers SedLine brain function monitoring technology to measure the brain's electrical activity by detecting EEG signals; capnography and gas monitoring products comprising external plug-in-and-measure capnography and gas analyzers, integrated modules, handheld capnograph and capnometer devices, and capnography sampling lines; and O3 regional oximetry for tissue oxygen saturation measurement. Further, it provides Patient SafetyNet, a surveillance, remote monitoring, and clinician notification solution; MyView, a wireless presence-detection system; and connectivity devices. Additionally, the company offers Trace, a patient data visualization and reporting software for Masimo Root and Radical-7 monitors. The company provides its products directly, as well as through distributors and original equipment manufacturers partners to hospitals, emergency medical service providers, physician offices, home care providers, long term care facilities, veterinarians, and consumers. Masimo Corporation was founded in 1989 and is headquartered in Irvine, California.",Mr. Joseph Kiani,Medical Instruments & Supplies,54.057343,285123000.0,240282000.0,1143744000.0,4.405368241570871,4.140151972017851,1712552000.0,304912000.0,641447000.0,138414000.0,0.16517983024319277,0.22457903534879928,0.19968018214670608,0.2100837250293772,0.17804539657773896
