,Symbol,Name,Last Sale,Net Change,% Change,Market Cap,Country,IPO Year,Volume,Sector,Industry,description__profile,ceo__profile,industry__profile,pe__quote,ebitda__income-statement,netIncome__income-statement,revenue__income-statement,eps__income-statement,epsdiluted__income-statement,totalAssets__balance-sheet-statement,totalLiabilities__balance-sheet-statement,cashAndShortTermInvestments__balance-sheet-statement,freeCashFlow__cash-flow-statement,growthEBITDA__income-statement-growth,growthNetIncome__income-statement-growth,growthEPS__income-statement-growth,derived__netIncomeMargin,derived__debtRatio
433,ROOT,Root Inc. Class A Common Stock,$10.22,0.02,0.196%,2572324310.0,United States,2020.0,6927711,Finance,Property-Casualty Insurers,"Root Inc. is the parent company of Root Insurance, the nation's first licensed insurance carrier powered entirely by mobile. We were founded on the belief that the services you need for everyday life should serve you better. That's why we base insurance coverages on you, not your demographic. It's the way insurance should be. And it's all conveniently in an app. Root is headquartered in Columbus, Ohio, with renters insurance available in Arkansas, Missouri, Ohio, Georgia, Kentucky, Nevada, Tennessee, and Utah, and auto insurance currently available to drivers in Arizona, Arkansas, California, Colorado, Connecticut, Delaware, Georgia, Illinois, Indiana, Iowa, Kentucky, Louisiana, Maryland, Mississippi, Missouri, Montana, Nebraska, New Mexico, Nevada, North Dakota, Ohio, Oklahoma, Oregon, Pennsylvania, South Carolina, Tennessee, Texas, Utah, Virginia, and West Virginia. For more information, visit https://www.joinroot.com and get a free quote. Sign up online or download the app.",Mr. Alexander Edward Timm,Insurance,,-270400000.0,-363000000.0,346800000.0,-1.9846910880262438,-1.9846910880262438,1762300000.0,729900000.0,1336800000.0,-303300000.0,0.0,0.28541076487252126,0.28876044677028573,-1.046712802768166,0.41417465811723314
434,ROST,Ross Stores Inc. Common Stock,$129.06,0.34,0.264%,46024273866.0,United States,1985.0,1643404,Consumer Services,Clothing/Shoe/Accessory Stores,"Ross Stores, Inc., together with its subsidiaries, operates off-price retail apparel and home fashion stores under the Ross Dress for Less and dd's DISCOUNTS brands. Its stores primarily offers apparel, accessories, footwear, and home fashions. The company's Ross Dress for Less stores sell its products at department and specialty stores primarily to middle income households; and dd's DISCOUNTS stores sell its products at department and discount stores regular prices to customers from households with moderate income. As of October 21, 2020, it operated approximately 1,800 off-price apparel and home fashion stores in 39 states, the District of Columbia, and Guam. The company was founded in 1982 and is headquartered in Dublin, California.",Ms. Barbara Rentler,Apparel Retail,535.0833,364245000.0,0.0,0.0,0.24,0.24,12717867000.0,9427227000.0,4819293000.0,1840500000.0,-0.8541312752445462,-1.0,-0.9478100896144253,,0.7412584987718459
435,RPD,Rapid7 Inc. Common Stock,$73.55,-2.71,-3.554%,4052001449.0,United States,2015.0,876482,Technology,Computer Software: Prepackaged Software,"Rapid7, Inc. provides cyber security solutions. The company offers a cloud-native insight platform that enable customers to create and manage analytics-driven cyber security risk management programs. Its platform include vulnerability management solutions comprising InsightVM that is designed to provide a way to collect vulnerability data, prioritize risk, and automate remediation; InsightIDR, an incident detection and response solution; InsightAppSec provides application security testing that analyzes web applications for security vulnerabilities; and InsightConnect, a SOAR solution that is used by security professionals. The company's other products include Nexpose, an on-premise version of company's vulnerability risk management solution; AppSpider, an on-premise version of company's application security testing solution; Metasploit, a penetration testing software solution; and InsightOps that enables organizations to store and search data in real time. It offers its products through a combination of perpetual and term software licenses, cloud-based subscriptions, and managed services. The company serves customers in a range of industries, including technology, energy, financial services, healthcare and life sciences, manufacturing, media and entertainment, retail, education, real estate, transportation, government, and professional services industries through sales teams, and indirect channel partner relationships, as well as directly in the Americas, Europe, the Middle East, Africa, and the Asia Pacific. It has a strategic partnership with Snyk to deliver end-to-end application security to organizations developing cloud native applications. Rapid7, Inc. was incorporated in 2000 and is headquartered in Boston, Massachusetts.",Mr. Corey Thomas,Software Application,,-51468000.0,-98849000.0,411486000.0,-1.94,-1.94,913122000.0,841586000.0,312456000.0,-15045000.0,0.746631825431839,0.8358064815674622,0.7636363636363634,-0.2402244547809646,0.9216577850495333
436,RPRX,Royalty Pharma plc Class A Ordinary Shares ,$41.05,-0.76,-1.818%,24921901214.0,United States,2020.0,1532402,Health Care,Major Pharmaceuticals,"Royalty Pharma plc operates in the biopharmaceutical industry. The company operates as a buyer of biopharmaceutical royalties and a funder of innovation in the biopharmaceutical industry. It is involved in the identification, evaluation, and acquisition of royalties and royalty-related assets on various biopharmaceutical therapies. The company collaborates with innovators from academic institutions, research hospitals and not-for-profits, small and mid-cap biotechnology companies, and pharmaceutical companies. Its portfolio includes royalties on approximately 45 commercial products and three development-stage product candidates. The company has royalties on various therapeutic areas and drug classes, including Neulasta, Neupogen, Rituxan, Imbruvica, Trodelvy, Tazverik, and Xtandi in oncology; Lyrica in neuropathic pain; Biktarvy, Genvoya, Prezista, Symtuza, Truvada, and Atripla in HIV; Humira, Remicade, and Cimzia TNF inhibitors; Kalydeco, Orkambi, Symdeko, and Trikafta in cystic fibrosis; Tecfidera and Tysabri in multiple sclerosis; Emgality, Nurtec ODT (rimegepant), and vazegepant in migraine; and others. Royalty Pharma plc was founded in 1996 and is based in New York, New York.",Mr. Pablo Gerardo Legorreta,Biotechnology,,1618457000.0,975040000.0,2122353000.0,2.752985027439288,2.752985027439288,16020286000.0,6124471000.0,2649136000.0,2034629000.0,-0.3885924218956594,-0.5848305432961399,-0.17821342464498802,0.4594146214131202,0.38229473556214916
437,RRR,Red Rock Resorts Inc. Class A Common Stock,$37.61,-0.32,-0.844%,4400370000.0,United States,2016.0,1121162,Consumer Services,Recreational Products/Toys,"Red Rock Resorts, Inc., through its interest in Station Holdco and Station LLC, engages in casino entertainment, and gaming and entertainment businesses in the United States. It operates through two segments, Las Vegas Operations and Native American Management. The company develops, manages, and operates casino entertainment properties; and owns and operates 10 gaming and entertainment facilities, and 10 smaller casinos in the Las Vegas regional market. In addition, it manages Graton Resort & Casino in northern California. It operates approximately 20,400 slot machines, 375 table games, and 5,000 hotel rooms. The company was formerly known as Station Casinos Corp. and changed its name to Red Rock Resorts, Inc. in January 2016. Red Rock Resorts, Inc. was founded in 1976 and is based in Las Vegas, Nevada.",Mr. Frank Fertitta,Resorts & Casinos,,356517000.0,-150397000.0,1182445000.0,-2.1619636311363473,-2.1619636311363473,3739954000.0,3135313000.0,121176000.0,154294000.0,-0.27291137691578204,43.8812294837362,42.239272622727,-0.12719153956420806,0.8383292949592428
438,RUBY,Rubius Therapeutics Inc. Common Stock,$25.06,-0.07,-0.279%,2207247811.0,United States,2018.0,410804,Health Care,Biotechnology: Biological Products (No Diagnostic Substances),"Rubius Therapeutics, Inc. focuses on the development of red cell therapeutics (RCTs) for the treatment of patients with severe diseases. The company is developing RTX-240 and RTX-224 for the treatment of cancer; and RTX-aAPC to treat solid and hematological cancers. It is also developing RTX-321 for the treatment of HPV-positive tumors; and RTX-T1D for treating type 1 diabetes. The company was founded in 2013 and is headquartered in Cambridge, Massachusetts.",Dr. Pablo Cagnoni,Biotechnology,,-160757000.0,-167731000.0,0.0,-2.1315718849111054,-2.1315718849111054,277794000.0,136234000.0,176287000.0,-133145000.0,-0.03510677886750777,0.026141271764000537,0.024794175438033535,-inf,0.49041375983642554
439,RUSHA,Rush Enterprises Inc. Common Stock Cl A,$50.09,0.28,0.562%,2782258367.0,United States,,123810,Consumer Services,Other Specialty Stores,"Rush Enterprises, Inc., through its subsidiaries, operates as an integrated retailer of commercial vehicles and related services in the United States. The company operates a network of commercial vehicle dealerships under the Rush Truck Centers name. Its Rush Truck Centers primarily sell commercial vehicles manufactured by Peterbilt, International, Hino, Ford, Isuzu, Mitsubishi Fuso, IC Bus, or Blue Bird; provides new and used commercial vehicles, and aftermarket parts, as well as service and repair, financing, and leasing and rental services; and offers property and casualty insurance, including collision and liability insurance on commercial vehicles, cargo insurance, and credit life insurance to its commercial vehicle customers. The company also offers equipment installation and repair, parts installation, and paint and body repair services; new vehicle pre-delivery inspection, truck modification, and natural gas fuel system installation services; body, chassis upfit, and component installation services, as well as sells tires for use on commercial vehicles, new and used trailers, and vehicle telematics products; and manufactures compressed natural gas fuel systems and related component parts for commercial vehicles. It serves regional and national truck fleets, corporations, local and state governments, and owner operators. The company operates a network of centers located in the states of Alabama, Arizona, California, Colorado, Florida, Georgia, Idaho, Illinois, Indiana, Kansas, Kentucky, Missouri, Nevada, Nebraska, New Mexico, North Carolina, Ohio, Oklahoma, Pennsylvania, Tennessee, Texas, Utah, and Virginia. Rush Enterprises, Inc. was founded in 1965 and is headquartered in New Braunfels, Texas.",Mr. W. M. Rush,Auto & Truck Dealerships,21.369637,210209000.0,114887000.0,4735940000.0,2.089291397292161,2.089291397292161,2985393000.0,1717356000.0,312048000.0,626782000.0,-0.2268288466560492,-0.18855371054434503,-0.18809909277494985,0.024258542126800592,0.5752529064012678
440,RUSHB,Rush Enterprises Inc. Class B,$44.68,-0.4,-0.887%,2481758910.0,United States,,12405,Consumer Services,Other Specialty Stores,"Rush Enterprises, Inc., through its subsidiaries, operates as an integrated retailer of commercial vehicles and related services in the United States. The company operates a network of commercial vehicle dealerships under the Rush Truck Centers name. Its Rush Truck Centers primarily sell commercial vehicles manufactured by Peterbilt, International, Hino, Ford, Isuzu, Mitsubishi Fuso, IC Bus, or Blue Bird; provides new and used commercial vehicles, and aftermarket parts, as well as service and repair, financing, and leasing and rental services; and offers property and casualty insurance, including collision and liability insurance on commercial vehicles, cargo insurance, and credit life insurance to its commercial vehicle customers. The company also offers equipment installation and repair, parts installation, and paint and body repair services; new vehicle pre-delivery inspection, truck modification, and natural gas fuel system installation services; body, chassis upfit, and component installation services, as well as sells tires for use on commercial vehicles, new and used trailers, and vehicle telematics products; and manufactures compressed natural gas fuel systems and related component parts for commercial vehicles. It serves regional and national truck fleets, corporations, local and state governments, and owner operators. The company operates a network of centers located in the states of Alabama, Arizona, California, Colorado, Florida, Georgia, Idaho, Illinois, Indiana, Kansas, Kentucky, Missouri, Nevada, Nebraska, New Mexico, North Carolina, Ohio, Oklahoma, Pennsylvania, Tennessee, Texas, Utah, and Virginia. Rush Enterprises, Inc. was founded in 1965 and is headquartered in New Braunfels, Texas.",Mr. W. Marvin Rush III,Auto & Truck Dealerships,19.257425,210209000.0,114887000.0,4735940000.0,2.089291397292161,2.089291397292161,2985393000.0,1717356000.0,312048000.0,626782000.0,-0.1608813031476557,-0.18855371054434503,-0.18628635153018674,0.024258542126800592,0.5752529064012678
441,RVMD,Revolution Medicines Inc. Common Stock,$29.00,-1.2,-3.974%,2129835574.0,United States,2020.0,885970,Consumer Durables,Specialty Chemicals,"Revolution Medicines, Inc., a clinical-stage precision oncology company, focuses on developing therapies to inhibit targets primarily within the RAS and mTOR signaling pathways. The company's principal product candidate is RMC-4630, an inhibitor of SHP2, which is in Phase 1b/2 study for the treatment of RAS-dependent tumors. Its products in preclinical stage include mutant RAS proteins; SOS1, a protein that converts RAS (OFF) to RAS (ON) in cells; and RMC-5552, a mTORC1 inhibitor. Revolution Medicines, Inc. has a collaboration agreement with Sanofi for the research and development of SHP2 inhibitors. The company was founded in 2014 and is headquartered in Redwood City, California.","Dr. Mark A. Goldsmith M.D., Ph.D.",Biotechnology,,-104152000.0,-108159000.0,42983000.0,-2.01,-2.01,567401000.0,92725000.0,440741000.0,-102997000.0,1.0511245027374059,1.2691968781470293,0.7177740041824805,-2.516320405741805,0.16342057909661772
442,RXRX,Recursion Pharmaceuticals Inc. Class A Common Stock,$28.00,-4.42,-13.634%,4642161720.0,United States,2021.0,389414,Health Care,Major Pharmaceuticals,"Recursion Pharmaceuticals, Inc. operates as a clinical-stage biotechnology company decoding biology by integrating technological innovations across biology, chemistry, automation, data science, and engineering to industrialize drug discovery. It has four clinical-stage drug candidates focused on rare, monogenic diseases; and 33 additional programs in various stages of preclinical development. Recursion Pharmaceuticals, Inc. has strategic agreements with Bayer; Ohio State Innovation Foundation; Chromaderm, Inc.; and Takeda Pharmaceutical Company Limited. The company was founded in 2013 and is based in Salt Lake City, Utah.",Dr. Christopher C. Gibson,Biotechnology,,-80173000.0,-87006000.0,3962000.0,-0.7736200454853661,-0.7736200454853661,298585000.0,504874000.0,262126000.0,-52134000.0,0.3612176983938334,0.4060666785177524,0.40606549137474246,-21.960121150933873,1.6908886916623407
443,RXT,Rackspace Technology Inc. Common Stock,$23.90,-0.05,-0.209%,4927634769.0,United States,2020.0,665451,Technology,EDP Services,"Rackspace Technology, Inc. operates as a multi cloud technology services company worldwide. It operates through Multicloud Services and Apps & Cross Platform segments. The Multicloud Services segment provides public and private cloud managed services, which allow customers to determine, manage, and optimize the right infrastructure, platforms, and services; and professional services related to designing and building multi cloud solutions and cloud-native applications. The Apps & Cross Platform segment includes managed applications, managed security, and data services, as well as professional services related to designing and implementing application, security, and data services. The company serves automotive, digital agencies, education, energy, financial services, gaming, government, healthcare, manufacturing, media and entertainment, non-profit, retail, and public sectors. Rackspace Technology, Inc. was founded in 1998 and is headquartered in San Antonio, Texas.",Mr. Kevin M. Jones,Software,,561600000.0,-245800000.0,2707100000.0,-14.995484577741978,-14.995484577741978,6377800000.0,4994100000.0,104700000.0,200000.0,-0.15675675675675677,1.4027370478983383,1.658763018828469,-0.09079827121273688,0.7830443099501395
444,SABR,Sabre Corporation Common Stock,$12.40,-0.07,-0.561%,3934954905.0,United States,2014.0,12048255,Technology,EDP Services,"Sabre Corporation, through its subsidiary, Sabre Holdings Corporation, provides technology solutions to the travel and tourism industry worldwide. It operates in three segments: Travel Network, Airline Solutions, and Hospitality Solutions. The Travel Network segment operates as a business-to-business travel marketplace that offers travel content, such as inventory, prices, and availability from a range of travel suppliers, including airlines, hotels, car rental brands, rail carriers, cruise lines, and tour operators with a network of travel buyers comprising online and offline travel agencies, travel management companies, and corporate travel departments. The Airline Solutions segment provides a portfolio of software technology products and solutions through software-as-a-service (SaaS) and hosted delivery models to airlines and other travel suppliers. Its products include SabreSonic Customer Sales & Service, a reservation system that provides capabilities around managing sales and customer service across an airline's touch points; Sabre AirVision Marketing & Planning, a set of airline commercial planning solutions; and Sabre AirCentre Enterprise Operations, a set of solutions for planning and management of airline, airport, and customer operations. The Hospitality Solutions segment provides software and solutions to hoteliers through SaaS and hosted delivery model. It offers SynXis, a central reservation system; SynXis Property Manager Solution for property management; and marketing, professional, and revenue management services. Sabre Corporation has strategic partnership with Google to develop an artificial intelligence (ai)-driven technology platform. sThe company was founded in 2006 and is headquartered in Southlake, Texas.",Mr. Sean Menke,Information Technology Services,,-624296.0,-1274332.0,1334100.0,-0.004622286383767452,-0.004622286383767452,6077722000.0,5715090000.0,1523930000.0,-65420000.0,-1.0008023978263272,-1.00803528551251,-1.0079908382091454,-0.9551997601379207,0.9403342239082341
445,SAGE,Sage Therapeutics Inc. Common Stock,$72.07,1.27,1.794%,4207585911.0,United States,2014.0,474797,Health Care,Major Pharmaceuticals,"Sage Therapeutics, Inc., a biopharmaceutical company, develops and commercializes novel medicines to treat central nervous system (CNS) disorders. Its lead product candidate is ZULRESSO, a proprietary intravenous formulation of brexanolone for the treatment of postpartum depression (PPD). The company's product pipeline also includes SAGE-217, a novel neuroactive steroid, which is in Phase III clinical trials for treating PPD, major depressive disorders, bipolar depression, and generalized anxiety disorders; and SAGE-324, a novel compound that is in Phase II clinical trial to treat essential tremors, as well as has completed Phase I clinical trial for epileptiform disorders and Parkinson's diseases. In addition, its product pipeline comprises SAGE-718, an oxysterol-based positive allosteric modulator of the NMDA receptor, which has completed Phase I clinical trial for the treatment of depression, Huntington's disease, Alzheimer's disease, attention deficit hyperactivity disorder, schizophrenia, and neuropathic pain. Further, the company is developing SAGE-904, an oral therapy that is in Phase I clinical trial for disorders associated with NMDA hypofunction; and SAGE-689 for intramuscular administration. Sage Therapeutics, Inc. has a strategic collaboration with Shionogi & Co., Ltd. for the development and commercialization of SAGE-217 in Japan, Taiwan, and South Korea. The company was formerly known as Sterogen Biopharma, Inc. and changed its name to Sage Therapeutics, Inc. in September 2011. Sage Therapeutics, Inc. was founded in 2010 and is headquartered in Cambridge, Massachusetts.",Dr. Jeffrey Jonas,Biotechnology,6.24035,626599000.0,606073000.0,1114200000.0,11.922629409225985,11.922629409225985,2159246000.0,86912000.0,2099549000.0,663935000.0,-1.8877339230789938,-1.8909719833352445,-1.8910784311828102,0.5439535092443009,0.0402510876481883
446,SANA,Sana Biotechnology Inc. Common Stock,$16.65,-0.02,-0.12%,3121972519.0,United States,2021.0,937921,Consumer Durables,Specialty Chemicals,"Sana Biotechnology, Inc. develops and delivers engineered cells as medicine for patients. It identifies and develops potential product candidates; and executes preclinical studies. The company develops technologies to repair and control genes in cells; and replace any cell in the body. Sana Biotechnology, Inc. was formerly known as FD Therapeutics, Inc. and changed its name to Sana Biotechnology, Inc. in September 2018. The company was founded in 2018 and is based in Seattle, Washington with additional offices in South San Francisco, California; and Cambridge, Massachusetts.",Dr. Steven D. Harr,Biotechnology,,-280228000.0,-285305000.0,0.0,-1.627387,-1.627387,730296000.0,1151480000.0,378264000.0,,0.0,0.0,0.0,-inf,1.576730531181877
447,SANM,Sanmina Corporation Common Stock,$41.64,0.37,0.897%,2703542333.0,United States,1993.0,337244,Technology,Electrical Products,"Sanmina Corporation provides integrated manufacturing solutions, components, products and repair, logistics, and after-market services worldwide. It operates in two segments, Integrated Manufacturing Solutions; and Components, Products and Services. The company offers product design and engineering, including concept development, detailed design, prototyping, validation, preproduction, and manufacturing design release; manufacturing solutions of components, subassemblies, and complete systems; final system assembly and test services; direct order fulfillment and logistics services; after-market product service and support; and supply chain management services. It also provides interconnect systems, such as printed circuit board fabrication, backplane, cable assemblies, and plastic injection moldings; mechanical systems comprising enclosures and precision machining; memory, radio frequency, optical, and microelectronic solutions; defense and aerospace products; storage solutions; and cloud-based manufacturing execution software. The company offers its products and services to companies that serve the communications networks, computing and data storage, industrial, defense and aerospace, medical, automotive, energy, and other industries. The company was formerly known as Sanmina-SCI Corporation and changed its name to Sanmina Corporation in November 2012. Sanmina Corporation was founded in 1980 and is headquartered in San Jose, California.",Mr. Hartmut Liebel,Electronic Components,15.049856,376430000.0,139713000.0,6960370000.0,2.02,1.97,3772656000.0,2142740000.0,480526000.0,234573000.0,-0.15173941736589044,-0.012733632477122567,0.02497246845583786,0.020072639816561474,0.5679659104885258
448,SASR,Sandy Spring Bancorp Inc. Common Stock,$47.68,0.71,1.512%,2249894708.0,United States,,94594,Finance,Major Banks,"Sandy Spring Bancorp, Inc. operates as the bank holding company for Sandy Spring Bank that provides commercial and retail banking, mortgage, private banking, and trust services to individuals and businesses in central Maryland, Northern Virginia, and Washington D.C. The company operates in three segments: Community Banking, Insurance, and Investment Management. The Community Banking segment provides financial products and services, including various loan and deposit products. This segment accepts deposits, such as demand, money market savings, regular savings, and time deposits. Its loan products include residential real estate loans; commercial real estate loans, commercial construction loans, and other commercial loans; and consumer loans comprising home equity loans and lines, installment loans, and personal lines of credit. The Insurance segment provides general insurance agency services and annuities. The Investment Management segment provides investment management and financial planning, including cash flow analysis, investment review, tax and retirement planning, insurance analysis, and estate planning to individuals, families, small businesses, and associations. The company also provides equipment leasing, personal trust, and wealth management services. It serves customers through a network of 50 community offices and six financial centers. Sandy Spring Bancorp, Inc. was founded in 1868 and is headquartered in Olney, Maryland.",Mr. Daniel Schrider,Banks Regional,13.937701,425500000.0,96953000.0,463411000.0,2.7062538460692482,2.7062538460692482,12798429000.0,11328474000.0,1644733000.0,136940000.0,0.0,-0.16730651962931473,-0.16730651962931323,0.20921600911501884,0.8851456690504749
